"No.","Date","Genre","Bibl","URL","Hit"
"910","2020-06-23","internetbasiert","Coronavirus-News - Laschet warnt vor Stigmatisierung von Bürgern des Kreises Gütersloh - DER SPIEGEL - Wissenschaft. Derspiegel, 2020-06-23","https://www.spiegel.de/wissenschaft/coronavirus-news-am-dienstag-die-wichtigsten-entwicklungen-zu-sars-cov-2-und-covid-19-a-a2245a96-72c7-46ca-925c-2b2a94894400","Bei der Schließung von Schulen und Kitas sei es um eine Abwägung gegangen, und es sei die Variante gewählt worden, ""bei der nicht so viele Menschen sterben"", betonte die Familienministerin."
"911","2020-04-01","internetbasiert","Die Stärke der Corona-App ist auch ihre größte Schwäche. Tagesspiegel, 2020-04-01","https://www.tagesspiegel.de/politik/freiwilligkeit-statt-ueberwachungsstaat-die-staerke-der-corona-app-ist-auch-ihre-groesste-schwaeche/25704702.html","Es ist gewissermaßen die europäische Variante des Trackings."
"912","2020-04-02","internetbasiert","Coronavirus: Unnötiger Alarm bei Covid-19?. Spektrum, 2020-04-02","https://www.spektrum.de/video/unnoetiger-alarm-bei-covid-19/1719442","Wie Tanja Stadler von der ETH-Zürich in Basel der »Neuen Zürcher Zeitung« sagte, gebe es zwar genetische Unterschiede zwischen der chinesischen und europäischen Variante."
"913","2020-04-28","internetbasiert","Wie funktioniert die Corona App?. Heute Plus, 2020-04-28","https://www.zdf.de/uri/73654ad5-a6ad-4f76-b2aa-fb63074bd50f","Die Bundesregierung hat sich auf eine konkrete Variante der möglichen Corona-Apps geeinigt."
"914","2020-05-09","internetbasiert","Corona-Pandemie: »Viren gedeihen auch in unseren Ställen«. Spektrum, 2020-05-09","https://www.spektrum.de/news/sars-und-covid-19/1732972","Mit jeder Replikationsrunde entstehen so neue Varianten des Virus."
"915","2020-03-31","internetbasiert","Coronavirus in Bayern: Wenn Männer in Schutzanzügen unerwartet klingeln, machen Sie bloß nicht auf. https://www.merkur.de, 2020-03-31","https://www.merkur.de/bayern/coronavirus-bayern-muenchen-betrug-maenner-schutzanzuegen-haustuer-masche-polizei-warnung-zr-13630607.html","Dieses Beispiel beschreibt jedoch nur eine Variante von verschiedenen Betrugsmaschen."
"916","2020-11-02","internetbasiert","Coronavirus-News am 2.11.: Französische Experten rechnen mit weiteren Infektions-Wellen - DER SPIEGEL - Wissenschaft. Derspiegel, 2020-11-02","https://www.spiegel.de/wissenschaft/coronavirus-news-am-montag-alles-entwicklungen-zu-covid-19-und-sars-cov-2-im-ueberblick-a-bcaa4e51-b1ca-443d-a9ef-41af2fbfcb6c","11.27 Uhr: Der russische Arzneimittel-Hersteller Pharmasyntez will womöglich eine Variante des Medikaments Remdesivir vom US-Konzern Gilead ohne dessen Genehmigung herstellen."
"917","2020-04-29","internetbasiert","Bundesministerium für Gesundheit beauftragt Werbeagentur für Corona-PR | KenFM.de. KenFM.de, 2020-04-29","https://kenfm.de/bundesministerium-fuer-gesundheit-beauftragt-werbeagentur-fuer-corona-pr/","An dieser Stelle möchte ich auch endlich einmal loswerden, dass mich persönlich mal ganz abgesehen von der einseitigen und sensationell aufgemachten Berichterstattung die Bilder/Fotos/ Großaufnahmen/Aufsteller/Plakate in allen Varianten, Formen und Farben des Coronavirus in der Berichterstattung der Mainstream Medien von Anfang an irritiert und gestört haben."
"918","2020-05-05","internetbasiert","Kriegsende 1945 und Corona heute: Zweierlei Überlebenskampf - WELT. DIE WELT, 2020-05-05","https://www.welt.de/debatte/kommentare/plus207735967/Kriegsende-1945-und-Corona-heute-Zweierlei-Ueberlebenskampf.html","Ein typisches Isolationsphänomen, eine Variante des Stockholm-Syndroms: Man sieht die Welt allmählich mit den Augen des Geiselnehmers, des Covid-19 Virus, und läuft Gefahr, das Leben davor, vor der Geiselnahme, aus der Erinnerung zu verlieren."
"919","2020-04-02","internetbasiert","Brüssel plant neue Hilfen - Streit über Corona-Bonds. Cash, 2020-04-02","https://www.cash.ch/news/politik/bruessel-plant-neue-hilfen-streit-ueber-corona-bonds-1516992","Nun werden immer neue Varianten ins Gespräch gebracht."
"920","2020-11-06","internetbasiert","Nerzfarmen in Dänemark: Sorgen vor mutiertem Coronavirus. Panorama, 2020-11-06","https://www.zdf.de/uri/7e5c2b4e-44ba-43b1-9c41-a5f8fcd8489f","""Mit Sicherheit muss der Imfpstoff regelmäßig angepasst werden, möglicherweise müssen wir uns auch gegen verschiedene Varianten des Coronavirus gleichzeitig impfen und damit schützen lassen."""
"921","2020-07-26","internetbasiert","Corona-Krise - Wie gefährlich ist Covid-19?. freitag.de, 2020-07-26","https://www.freitag.de/autoren/gunnar-jeschke/wie-gefaehrlich-ist-covid-19","Sich manipuliert, gehasst und verfolgt zu fühlen ist für die meisten vermutlich wesentlich einfacher zu ertragen, als die viel zutreffendere Variante, dass die Überzahl der Menschen sich einfach gar nicht für sie interessiert."
"922","2020-03-16","internetbasiert","Verschwörungstheorien in Corona-Zeiten: Erichs Rache. Tazgezwitscher, 2020-03-16","https://taz.de/!5668690/","Bei der Preis Variante gäbe es eben kein Hamstern, wie ich erklärt habe."
"923","2020-04-20","internetbasiert","Ein Schweizer Forscher macht Hoffnung im Kampf gegen Covid-19. Tagesspiegel, 2020-04-20","https://www.tagesspiegel.de/wissen/woran-sterben-corona-patienten-wirklich-ein-schweizer-forscher-macht-hoffnung-im-kampf-gegen-covid-19/25750666.html","Gerade bei den Genen, die die Blutgerinnungskaskade steuern, gibt es viele Varianten, die mal zu schnellerer, mal zu langsamerer Gerinnung führen."
"924","2020-11-18","internetbasiert","Die Kiezhelden-Box soll kleine Berliner Läden retten. Tagesspiegel, 2020-11-18","https://www.tagesspiegel.de/berlin/charity-aktion-in-corona-zeiten-die-kiezhelden-box-soll-kleine-berliner-laeden-retten/26633086.html","Die Verschenker können wählen, ob sie eine Mischung mit Advents- und Weihnachtssachen haben möchten, eine alkoholfreie Box oder weitere Varianten:"
"925","2020-11-05","internetbasiert","Corona-Mutation aus Spanien: Neue Virusvariante verbreitet sich überall in Europa - auch in Deutschland. Merkur.de, 2020-11-05","https://www.merkur.de/welt/coronavirus-mutation-variante-spanien-deutschland-europa-verbreitung-sars-urlaub-reise-zr-90086541.html","„Es ist wichtig festzuhalten, dass es derzeit keinen Hinweis darauf gibt, dass die Verbreitung der neuen Variante auf einer Mutation beruht, die die Übertragung erhöht oder den Krankheitsverlauf beeinflusst“, betontHodcroftdeshalb auch explizit.20A.EU1sei nicht die einzige Variante, die derzeit in Europa umgehe, erklärtRichard Nehervon derUniversität Baselals Autor der Studie und merkt an, dass in anderen Ländern wieder völlig andere Varianten für den Anstieg derInfektionszahlenverantwortlich seien."
"926","2020-11-12","internetbasiert","Corona bei dänischen Nerzen: Keine Gefahr durch Mutationen. Tazgezwitscher, 2020-11-12","https://taz.de/!5723833/","So ansteckend kann die neue Variante wohl doch nicht sein."
"927","2020-10-31","internetbasiert","Covid-19 - Magische Abnahme von Nicht-Covid-Erkrankungen. freitag.de, 2020-10-31","https://www.freitag.de/autoren/gunnar-jeschke/magischer-abfall-von-nicht-covid-erkrankungen-1","Weil es davon knapp 30.000 in verschiedenen Varianten gibt."
"928","2020-04-16","internetbasiert","Wirtschaftsweiser über Folgen der Corona-Krise: „Wir können uns Schulden leisten“. https://www.fr.de, 2020-04-16","https://www.fr.de/wirtschaft/corona-wirtschaft-deutschland-krise-pandemie-achim-truger-kurzarbeit-13652995.html","Es gäbe eine andere Variante der Krisenbewältigung:"
"929","2020-07-24","internetbasiert","Corona-Proteste der Eventbranche: Ist da alles tutti?. Tazgezwitscher, 2020-07-24","https://taz.de/!5703757/","Variante 3, die weniger zugelassen Besucher zahlen mehr."
"930","2020-10-29","internetbasiert","In Europa breitet sich eine neue Corona-Variante aus. futurezone.at, 2020-10-29","https://futurezone.at/science/in-europa-breitet-sich-eine-neue-corona-variante-aus/401080701","Unter anderem die Lockerung der Reisebeschränkungen machten der neuen Variante ein leichtes Spiel sich auszubreiten."
"931","2020-04-15","internetbasiert","Anstand in Krisenzeiten: Corona zeigt, wie wichtig Manieren sind. Neue Zürcher Zeitung, 2020-04-15","https://www.nzz.ch/feuilleton/anstand-in-krisenzeiten-corona-zeigt-wie-wichtig-manieren-sind-ld.1550843","Gelassenheit angesichts leichter Verstösse aller Art gegen den guten Ton ist in diesen Tagen und Wochen mindestens so wichtig wie Social Distancing in allen Varianten."
"932","2020-04-08","internetbasiert","Corona-Mutation? Rätselhafter Fall: Infizierter kämpft 49 Tage gegen das Virus. https://www.merkur.de, 2020-04-08","https://www.merkur.de/welt/coronavirus-symptome-mutation-behandlung-england-klinik-forschung-forschung-kampf-zr-13641103.html","In China wird bereits über zwei Varianten des Virus diskutiert, den L-Subtyp und den S-Subtyp . Den Forschern zufolge sei ersterer mit 70 Prozent deutlich weiter verbreitet und springe auch schneller auf andere Menschen über."
"933","2020-02-01","internetbasiert","So schätzt der Berliner Sars-Entdecker das Coronavirus ein. Tagesspiegel, 2020-02-01","https://www.tagesspiegel.de/wissen/das-virus-wird-leichter-uebertragen-als-sars-so-schaetzt-der-berliner-sars-entdecker-das-coronavirus-ein/25497296.html","Wir wissen, dass dann die Fitness im Vergleich zur Ursprungspopulation sinken kann, weil sich da auch zufällige ungünstige genetische Varianten durchsetzen können."
"934","2020-05-22","internetbasiert","Cory Doctorow auf der re:publica - Es gibt noch eine andere Pandemie und es ist eine ideologische. netzpolitik.org, 2020-05-22","https://netzpolitik.org/2020/es-gibt-noch-eine-andere-pandemie-und-es-ist-eine-ideologische/","Ist schon ein schönes Symbol- Abstand halten als effektive Maßnahme, in einer Gesellschaft, die die Privatsphäre zunehmend nur nach als lästiges Luxusgut gesehen und Stalking zu einer Art Kunstform erhoben hat, in verschiedensten Varianten, quer durch alle Schichten."
"935","2020-03-16","internetbasiert","Verschwörungstheorien in Corona-Zeiten: Erichs Rache. Tazgezwitscher, 2020-03-16","https://taz.de/!5668690/","Variante 2"
"936","2020-04-30","internetbasiert","Corona-Krise zeigt Defizite im Parlament auf. Neue Zürcher Zeitung, 2020-04-30","https://www.nzz.ch/meinung/corona-krise-zeigt-defizite-im-parlament-auf-ld.1554222","In der mildesten Variante wäre sie ein reines Konsultativgremium."
"937","2020-03-31","internetbasiert","Corona-Krise: Diese Geldsorgen bedrücken die Deutschen - Capital.de. Capital.de, 2020-03-31","https://www.capital.de/geld-versicherungen/corona-krise-diese-geldsorgen-bedruecken-die-deutschen","Was schließlich das Bezahlen angeht, so wird in der Krise die bargeldlose Variante beliebter."
"938","2020-04-20","internetbasiert","„Vertrauen braucht Optionen“ - Philosophie Magazin. Philosophie Magazin, 2020-04-20","https://philomag.de/vertrauen-braucht-optionen/","Die Systemtheorie suggeriert in manchen Varianten, dass Vertrauen kommt, wenn wir es brauchen oder weil wir es brauchen."
"939","2020-04-17","internetbasiert","Corona-Cooking, Folge 4: Mörsern gegen den angestauten Frust. RepublikMagazin, 2020-04-17","https://www.republik.ch/2020/04/17/moersern-gegen-den-angestauten-frust","Diese Variante sollte aber ruhig so cremig wie ein Zürcher Geschnetzeltes sein, definitiv weniger suppenartig als ein durchschnittliches Thai-Curry."
"940","2020-11-05","internetbasiert","Corona-Mutation aus Spanien: Neue Virusvariante verbreitet sich überall in Europa - auch in Deutschland. Merkur.de, 2020-11-05","https://www.merkur.de/welt/coronavirus-mutation-variante-spanien-deutschland-europa-verbreitung-sars-urlaub-reise-zr-90086541.html","„Es ist wichtig festzuhalten, dass es derzeit keinen Hinweis darauf gibt, dass die Verbreitung der neuen Variante auf einer Mutation beruht, die die Übertragung erhöht oder den Krankheitsverlauf beeinflusst“, betontHodcroftdeshalb auch explizit.20A.EU1sei nicht die einzige Variante, die derzeit in Europa umgehe, erklärtRichard Nehervon derUniversität Baselals Autor der Studie und merkt an, dass in anderen Ländern wieder völlig andere Varianten für den Anstieg derInfektionszahlenverantwortlich seien."
"941","2020-04-24","internetbasiert","Angeln in Corona-Zeiten: Aus dem Altrheinarm in den Backofen. Frankfurter Allgemeine Zeitung, 2020-04-24","https://www.faz.net/1.6737481","Anders als bei Bagger- oder Angelseen mit teils ausgesetzten Fischen ist das Angeln am Strom für Schäfer die ursprünglichere Variante seines Hobbys."
"942","2020-09-21","internetbasiert","Covid-19: Das Coronavirus mutiert – wie gefährlich ist das?. Spektrum, 2020-09-21","https://www.spektrum.de/news/das-coronavirus-mutiert-wie-gefaehrlich-ist-das/1768398","In ihrem Preprint-Artikel vom April konnten sie zum Beispiel zeigen, dass D614G auch in Kanada, Australien und Teilen der USA andere Varianten schnell überholt hatte (eine Ausnahme ist Island, wo G-Viren, die zu Beginn des Ausbruchs vorhanden waren, von D-Viren abgelöst wurden)."
"943","2020-05-16","internetbasiert","Rollt die zweite Corona-Welle auf uns zu?. N-Tv Nachrichten, 2020-05-16","https://www.n-tv.de/panorama/Rollt-die-zweite-Corona-Welle-auf-uns-zu-article21781815.html","Dann könnte eine neue Variante auftauchen."
"944","2018-05-13","internetbasiert","Studie zeigt ""unfaires"" aber effektives Vorgehen bei Pandemie. Cash, 2018-05-13","https://www.cash.ch/news/studie-zeigt-unfaires-aber-effektives-vorgehen-bei-pandemie-1172815","Abgesehen von den Ärzten empfinden sie diese Variante als die unfairste."
"945","2020-04-27","internetbasiert","Die Wahrheit: Schläfrig im Kettenpanzer. Tazgezwitscher, 2020-04-27","https://taz.de/!5678531/","... Ich schlage vor doch eine Ü18 Variante des Films(Gürteltiere!) zu machen, der dann mit Webeunterbrechungen von Sexhotlines nachts um halb 1 kommt."
"946","2020-04-17","internetbasiert","Coronavirus-Pandemie: Ein hundert Jahre alter Impfstoff weckt Hoffnungen. https://www.fr.de, 2020-04-17","https://www.fr.de/wissen/corona-krise-coronavirus-impfstoff-hoffnungen-zr-13653108.html","„VPM 1002 ist die gentechnologisch verbesserte Variante eines jahrzehntealten Impfstoffs, der in vielen Ländern zur Bekämpfung des Tuberkulose-Erregers eingesetzt wird“, erklärt Studienleiter Christoph Schindler vom Clinical Research Center der MHH."
"947","2020-03-18","internetbasiert","Coronavirus: Der Stammbaum der Pandemie. Spektrum, 2020-03-18","https://www.spektrum.de/news/der-stammbaum-der-pandemie/1713516","Eine chinesische Variante des Virus mit den drei Mutationen könnte gleichzeitig in beide Länder gekommen sein."
"948","2020-10-29","internetbasiert","Merkel-Gipfel berät über Corona-Regeln: „Lockdown Light“, „Wellenbrecher“ und „Plan C“ - die Optionen kurz erklärt. Merkur.de, 2020-10-29","https://www.merkur.de/politik/coronavirus-deutschland-lockdown-light-pandemie-wellenbrecher-massnahmen-merkel-ueberblick-zr-90083022.html","Diese Variante sieht vor, dass Bars und Restaurants geschlossen sowie Veranstaltungen abgesagt werden."
"949","2020-02-24","internetbasiert","Coronavirus: Der ewige Kampf des Menschen gegen gefährliche Keime. profil.at, 2020-02-24","https://profil.at/wissenschaft/coronavirus-viren-kampf-menschen-keime-11358734","Die humane Variante HIV führte zur bekannten grausamen Pandemie."
"950","2020-01-25","internetbasiert","COVID-19-Pandemie. de.wikipedia.org, 2020-01-25","https://de.wikipedia.org/wiki/COVID-19-Pandemie","Für beide Varianten sind während einer dynamisch sich ausbreitenden Erkrankungswelle mit mutmaßlich hohen Dunkelziffern nur begrenzt verlässliche Aussagen möglich."
"951","2020-03-18","internetbasiert","Olympia in Tokio: Der Ort bleibt, aber der Termin wankt. Frankfurter Allgemeine Zeitung, 2020-03-18","https://www.faz.net/1.6683530","In einer Erklärung vom Dienstag benutzte die Organisation zwar einen Standardsatz, den Präsident Thomas Bach zuletzt mehrmals wiederholt hatte, aber mit einer Variante:"
"952","2020-03-31","internetbasiert","Erhebung von Bewegungsdaten: Forderung: Anti-Corona-App nur auf freiwilliger Basis. ZEIT ONLINE, 2020-03-31","https://www.zeit.de/news/2020-03/31/lindner-fuer-freiwillige-apps-im-kampf-gegen-corona","«Die schlechteste Variante wäre:"
"953","2020-04-28","internetbasiert","Corona-Tracking in Deutschland: Nur ein Baustein. Tazgezwitscher, 2020-04-28","https://taz.de/!5678648/","Nach wochenlangen zähen Debatten um ihren Einsatz liegt nun eine Variante vor, die wenigstens ein bisschen mehr Vertrauen in und Akzeptanz für die Digitalkompetenz der Bundesregierung schafft."
"954","2020-09-18","internetbasiert","Erst im zweiten Anlauf! Neue Corona-Studien zeigen: So kam Virus nach Europa und Nordamerika. Merkur.de, 2020-09-18","https://www.merkur.de/welt/coronavirus-ausbreitung-europa-deutschland-italien-usa-china-nordamerika-pandemie-zr-90045412.html","Die getesteten Infizierten der folgenden Wochen trugen eine leicht veränderte Variante desCoronavirusin sich."
"955","2020-09-30","internetbasiert","Neandertaler-Gene erhöhen Risiko für schweren Coronaverlauf. Deutsches Ärzteblatt, 2020-09-30","https://www.aerzteblatt.de/nachrichten/116990/Neandertaler-Gene-erhoehen-Risiko-fuer-schweren-Coronaverlauf","Die Variante ist ein weiterer Risikofaktor zusätzlich zu vielen schon länger bekannten wie Alter und manchen Vorerkrankungen."
"956","2020-10-08","internetbasiert","Spahn nennt Pandemie „Charaktertest für unsere Gesellschaft“. Tagesspiegel, 2020-10-08","https://www.tagesspiegel.de/politik/rki-meldet-mehr-als-4000-neuinfektionen-spahn-nennt-pandemie-charaktertest-fuer-unsere-gesellschaft/26256618.html","Dies sei „die viel bessere Variante“ als danach Beherbergungsverbote auszusprechen."
"957","2020-07-04","internetbasiert","Corona-Forscher entdecken gefährliche Virus-Mutation - Erreger könnte weitaus mehr Zellen infizieren. Merkur.de, 2020-07-04","https://www.merkur.de/welt/coronavirus-mutation-europa-usa-gefahr-studie-infektionen-forschung-d614g-covid-19-veraenderung-zr-13809446.html","Die D614G-Virusvariante habe am Beginn einzelner größerer Ausbrüche* gestanden und sich in der Folge stärker ausgebreitet als andere Varianten."
"958","2020-05-28","internetbasiert","Corona-Diaries - Lockerungseuphorie und Corona-Cafard. freitag.de, 2020-05-28","https://www.freitag.de/autoren/der-freitag/lockerungseuphorie-und-corona-cafard","Daneben begegnen Silvia und ich auch der milden Variante dieser identifikatorischen „"
"959","2020-03-31","internetbasiert","Junge Unternehmen bangen: Start-ups rennt die Zeit davon. Frankfurter Allgemeine Zeitung, 2020-03-31","https://www.faz.net/1.6705646","Das Start-up aus Berlin hat eine digitale Variante der altbekannten Fotoautomaten programmiert und leiht diese für Werbeaktionen an Unternehmen aus."
"960","2020-08-20","internetbasiert","Neue Corona-Reisewarnungen: Jeder macht, was er will. Tazgezwitscher, 2020-08-20","https://taz.de/!5708768/","Rücksichtnahme auf religiöse Empfindlichkeit ist keine Selbstzensur und Macrons Variante von Laizismus kein universeller Wert."
"961","2020-04-24","internetbasiert","Die Aussichten auf einen Immunschutz gegen Covid-19 sind vage. Tagesspiegel, 2020-04-24","https://www.tagesspiegel.de/wissen/die-hohen-huerden-beim-corona-impfstoff-die-aussichten-auf-einen-immunschutz-gegen-covid-19-sind-vage/25768352.html","Weder gegen die recht harmlosen, nur Schnupfen auslösenden Varianten, noch gegen das in arabischen Staaten von Kamelen auf den Menschen übergesprungene Mers-Coronavirus oder das inzwischen verschwundene Sars-Virus, das 2002 vor allem China und benachbarte Länder betraf."
"962","2020-04-26","internetbasiert","Regierung lenkt im Streit über Corona-App ein - DER SPIEGEL - Politik. Derspiegel, 2020-04-26","https://www.spiegel.de/politik/deutschland/regierung-lenkt-im-streit-ueber-corona-app-ein-a-f621bc4d-90bd-4972-91a3-b874b50bddea","Gegen diese Variante gab es erhebliche Kritik von Datenschützern:"
"963","2020-05-25","internetbasiert","""Es wird viele Pandemiewellen geben"". AerzteZeitung.de, 2020-05-25","https://www.aerztezeitung.de/Medizin/Es-wird-viele-Pandemiewellen-geben-369930.html","Auch ohne Reassortment kann plötzlich eine virulentere Variante entstehen, die sich durchsetzt."
"964","2020-04-20","internetbasiert","Das gefährliche Chaos um die Corona-App. Tagesspiegel, 2020-04-20","https://www.tagesspiegel.de/wissen/welche-technologie-soll-es-sein-das-gefaehrliche-chaos-um-die-corona-app/25755338.html","Sonst gewinnt man kein Vertrauen, für keine Variante.(Mitarbeit: Paul Dalg, Lina Rusch und Oliver Voß)"
"965","2020-04-11","internetbasiert","Contact Tracing gegen Corona - Apple und Google schaffen globalen Standard. netzpolitik.org, 2020-04-11","https://netzpolitik.org/2020/apple-und-google-schaffen-globalen-standard/","Sie befürchten, dass eine zentralisierte Variante, bei der alle Informationen über Kontakte zwischen Nutzer:innen an einem Punkt zusammenlaufen, zum Missbrauch einlädt."
"966","2020-04-10","internetbasiert","Ostern unter Quarantäne: Sechs Tipps gegen Langeweile an den Feiertagen. Frankfurter Allgemeine Zeitung, 2020-04-10","https://www.faz.net/1.6717908","Oder klemmen Sie eines hinter einen wuchtigen Bilderrahmen, der nicht zu eng an der Wand liegt; diese Variante hat sich im Selbsttest als besonders schwierig herausgestellt."
"967","2020-08-28","internetbasiert","COVID-19: Antikoagulanzien könnten Sterberisiko halbieren. Deutsches Ärzteblatt, 2020-08-28","https://www.aerzteblatt.de/nachrichten/116051/COVID-19-Antikoagulanzien-koennten-Sterberisiko-halbieren","Auch hier gab es keine Unterschiede zwischen den beiden Varianten."
"968","2020-08-30","internetbasiert","Immer mehr Fälle wiederholter Corona-Infektionen. Merkur.de, 2020-08-30","https://www.merkur.de/welt/immer-mehr-faelle-wiederholter-corona-infektionen-zr-13870044.html","Auch bei dem Ecuadorianer gingen die beiden Infektionen auf verschiedene Varianten des Virus zurück, wie das IMUSFQ mitteilte."
"969","2020-03-17","internetbasiert","Corona und das Ende der Welt ohne Grenzen. Tichys Einblick, 2020-03-17","http://www.tichyseinblick.de/feuilleton/corona-und-das-ende-der-welt-ohne-grenzen/","Die Gattung der Coronaviren gibt es schon länger, das ist korrekt, nicht aber diese Variante, um die es jetzt geht."
"970","2020-11-06","internetbasiert","»Cluster 5«: Die wahre Gefahr durch das Nerz-Coronavirus. Spektrum, 2020-11-06","https://www.spektrum.de/news/die-wahre-gefahr-durch-das-nerz-coronavirus/1790780","Wegen der recht hohen Mutationsrate sind solche und andere Varianten mit hoher Wahrscheinlichkeit bereits im Menschen aufgetreten; wenn sie einen deutlichen Vorteil bei der Verbreitung bieten würden, hätten sie sich längst weit verbreitet."
"971","2020-04-13","internetbasiert","+++ Corona News vom 13. April +++: Über 440.000 weltweit wieder gesund. Tazgezwitscher, 2020-04-13","https://taz.de/!5677969/","Es ist völlig unmöglich die unbekannten Verzerrungen in den Rohdaten nachträglich zu korrigieren, es fehlt in den meisten Fällen jegliche Zusatzinformation, z. B. zu den Varianten der Testmethodik oder Zuverlässigkeit der Testkits."
"972","2020-04-28","internetbasiert","Das etwas andere Logbuch - Das Leben in den Zeiten der Corona, Woche 6. freitag.de, 2020-04-28","https://www.freitag.de/autoren/cabee/das-leben-in-den-zeiten-der-corona-woche-6","Als ich ihn damals nach dem Grund fragte, führte er eben diesen Infektionsschutz an, den wir aktuell in aberwitzigsten Varianten zelebrieren."
"973","2020-03-24","internetbasiert","Automobil-Krise - Autobranche im Corona-Stress - Das Filetieren folgt später. Cash, 2020-03-24","https://www.cash.ch/news/top-news/automobil-krise-autobranche-im-corona-stress-das-filetieren-folgt-spaeter-1507996","Für eine Allianz des Stuttgarter Konzerns kämen drei Varianten infrage:"
"974","2020-03-16","internetbasiert","Verschwörungstheorien in Corona-Zeiten: Erichs Rache. Tazgezwitscher, 2020-03-16","https://taz.de/!5668690/","Variante 2"
"975","2020-05-01","internetbasiert","Corona-Krise: Pleitegefahr trotz langer Schlangen? Baumärkte überraschen mit Warnung. https://www.merkur.de, 2020-05-01","https://www.merkur.de/wirtschaft/corona-wirtschaft-deutschland-condor-insolvenz-lufthansa-einzelhandel-produktivitaet-kurzarbeit-zr-13656588.html","„Eine befristete Absenkung derMehrwertsteuerist eine Variante“, sagte der SPD-Chef am Montag in einem Interview mit dem RadiosenderBayern 2.GastgewerbeundGastronomiegehörten mit Sicherheit zu den Branchen, die Hilfe benötigten."
"976","2020-08-26","internetbasiert","Wie 90 Menschen 20.000 Corona-Infektionen auslösten. Tagesspiegel, 2020-08-26","https://www.tagesspiegel.de/wissen/studie-zu-superspreading-event-in-boston-wie-90-menschen-20-000-corona-infektionen-ausloesten/26130036.html","Sie stellten fest, dass Viren, die mit der Veranstaltung und der darauffolgenden Verbreitung in Verbindung standen die genetische Variante „C2416T“ enthielten."
"977","2020-04-29","internetbasiert","Das große FAQ zur Pandemie. Tagesspiegel, 2020-04-29","https://www.tagesspiegel.de/wissen/99-fragen-und-antworten-zum-coronavirus-das-grosse-faq-zur-pandemie/25583902.html","Aussagen wie die Salomons, in denen über seltene, vermeintlich besonders aggressive Varianten spekuliert wird, entbehren bislang jeder wissenschaftlichen Grundlage."
"978","2020-04-27","internetbasiert","Wie Hamburg die Maskenpflicht durchsetzt: Maske oder Schal – egal. Tazgezwitscher, 2020-04-27","https://taz.de/!5678505/","Ärztekammerpräsident Pedram Emami appellierte an die Bürger, diese selbst genähten Varianten zu nutzen, um den Engpass im Medizinbereich nicht zu verschärfen."
