"No.","Date","Genre","Bibl","URL","Hit"
"282","2020-03-30","internetbasiert","Coronavirus und das Getty Museum: Große Kunst, Quarantäne-Edition - DER SPIEGEL - Netzwelt. Derspiegel, 2020-03-30","https://www.spiegel.de/netzwelt/web/coronavirus-und-das-getty-museum-grosse-kunst-quarantaene-edition-a-439cdf6c-d7cd-4bb7-9adc-db611d163135","Diese Variante von ""Die durchbohrte Zeit"" von René Magritte orientiert sich stärker am Original:"
"283","2020-10-04","internetbasiert","Corona-Infektion von Donald Trump: Wenn sich Lügen rächen. Tazgezwitscher, 2020-10-04","https://taz.de/!5715799/","Rücksichtnahme auf religiöse Empfindlichkeit ist keine Selbstzensur und Macrons Variante von Laizismus kein universeller Wert."
"284","2020-05-12","internetbasiert","Coronavirus: Mutationen betreffen auch Schlüsselprotein - DER SPIEGEL - Wissenschaft. Derspiegel, 2020-05-12","https://www.spiegel.de/wissenschaft/medizin/coronavirus-mutationen-betreffen-auch-schluesselprotein-was-das-bedeutet-a-a29c656f-0dd6-4509-aecf-5a4de178d0df","Viren mit dieser Variante könnten für den Test unsichtbar sein."
"285","2020-02-06","internetbasiert","Absage des Formel-1-Rennens in China steht kurz bevor. Tagesspiegel, 2020-02-06","https://www.tagesspiegel.de/sport/ausweichtermin-wegen-coronavirus-gesucht-absage-des-formel-1-rennens-in-china-steht-kurz-bevor/25518938.html","Dem Fachmagazin „Auto, Motor und Sport“ zufolge sollen allerdings zwei Varianten schon bei den Teams durchgefallen sein:"
"286","2020-04-02","internetbasiert","Die Ruhe vor dem Sturm. Heise Online, 2020-04-02","https://www.heise.de/tp/features/Die-Ruhe-vor-dem-Sturm-4695274.html","Man mag mir nachsehen, dass ich als Angehöriger einer Risikogruppe eine Grundsympathie für Variante 1 habe."
"287","2020-12-01","internetbasiert","Morning Briefing : Die Anti-Covid-Waffe aus Mainz. handelsblatt.com, 2020-12-01","https://www.handelsblatt.com/meinung/morningbriefing/morning-briefing-die-anti-covid-waffe-aus-mainz/25765574.html","Die einen wollten eine Variante „Söder plus“, also einen „Führer“, der noch durchsetzungsstärker ist und noch klarer durchregiert, so wieMarkus Söderin Bayern also."
"288","2020-04-23","internetbasiert","Leichte Sprache in Corona-Zeiten: „Regeln müssen verstanden werden“. Tazgezwitscher, 2020-04-23","https://taz.de/!5677622/","Maaß:Beide Varianten sind gegenüber dem Standard deutlich verständlicher."
"289","2020-04-22","internetbasiert","Covid-19: Über 30 Varianten mit vielen genetischen Unterschieden. Heise Online, 2020-04-22","https://www.heise.de/tp/features/Covid-19-Ueber-30-Varianten-mit-vielen-genetischen-Unterschieden-4707064.html","In Wuhan gab es zwar auch die Variante A, hier überwog allerdings wie auch in Ostasien die Variante B."
"290","2020-09-21","internetbasiert","Covid-19: Das Coronavirus mutiert – wie gefährlich ist das?. Spektrum, 2020-09-21","https://www.spektrum.de/news/das-coronavirus-mutiert-wie-gefaehrlich-ist-das/1768398","Rückblickend bedauern Montefiori und seine Kollegen, die Verbreitung der neuen Variante zunächst als »Besorgnis erregend« bezeichnet zu haben."
"291","2020-04-14","internetbasiert","Diese Zahlen und Faktoren sind jetzt wichtig. Tagesspiegel, 2020-04-14","https://www.tagesspiegel.de/wissen/worauf-es-in-der-coronakrise-ankommt-diese-zahlen-und-faktoren-sind-jetzt-wichtig/25737632.html","Was es für die freiheitlichere der beiden Varianten braucht, sind Einsicht und Bewusstheit."
"292","2020-05-30","internetbasiert","SeniorInnen in der Coronakrise: Auf Dauer in Einzelhaft?. Tazgezwitscher, 2020-05-30","https://taz.de/!5689181/","Zahlreiche Staaten diskutierten bereits Varianten der Umkehrisolation."
"293","2020-11-25","internetbasiert","RKI veröffentlicht neue Version der Corona-Warn-App. Heise Online, 2020-11-25","https://www.heise.de/news/RKI-veroeffentlicht-neue-Version-der-Corona-Warn-App-4971193.html","Die offizielle Corona-Warn-App des Bundes steht in einer verbesserten Variante zum Herunterladen bereit."
"294","2020-04-22","internetbasiert","Massentierhaltung - Das Silicon Valley der Viren. freitag.de, 2020-04-22","https://www.freitag.de/autoren/the-guardian/das-silicon-valley-der-viren","Das nenne ich eine moderne Variante der Symbiose von Blut und Boden und Volk ohne Raum."
"295","2020-01-30","internetbasiert","Synthetischer Wirkstoff hemmt Coronaviren in Laborexperiment. Deutsches Ärzteblatt, 2020-01-30","https://www.aerzteblatt.de/nachrichten/109025/Synthetischer-Wirkstoff-hemmt-Coronaviren-in-Laborexperiment","Die Forscher experimentieren deshalb mit CR-31-B, einer synthetischen Variante von Silvestrol, die schneller und kostengünstiger produziert werden könnte."
"296","2020-03-08","internetbasiert","Corona-Virus auch in Lateinamerika: Nach dem Dengue-Fieber kam Corona. Tazgezwitscher, 2020-03-08","https://taz.de/!5669994/","Die ernstere Variante, Dengue hemorrágico, kann starke Blutungen aus Mund und Nase auslösen."
"297","2020-01-31","internetbasiert","Coronavirus breitet sich rasant aus - 1981 neue Fälle in China. Cash, 2020-01-31","https://www.cash.ch/news/politik/coronavirus-breitet-sich-rasant-aus-1981-neue-faelle-china-1471977","Der neue ""2019-nCoV""-Erreger ist eine Variante des damaligen Sars-Virus."
"298","2020-06-29","internetbasiert","Pop und Corona: Der Sieg der puren Vernunft. Tazgezwitscher, 2020-06-29","https://taz.de/!5691522/","„Es wirkt heute so, als hätte sich diese spezielle Variante von Rock-Rebellion totgelaufen."
"299","2020-01-23","internetbasiert","Impfstoff gegen Coronavirus frühestens 2021. N-Tv Nachrichten, 2020-01-23","https://www.n-tv.de/panorama/Impfstoff-gegen-Coronavirus-fruehestens-2021-article21527448.html","Das neue Virus soll nach derzeitigem Stand eine harmlosere Variante sein."
"300","2020-03-25","internetbasiert","Gefährlicher Gemütszustand: Schützt euch vor der Coronawut! - DER SPIEGEL - Netzwelt. Derspiegel, 2020-03-25","https://www.spiegel.de/netzwelt/netzpolitik/corona-schuetzt-euch-vor-der-corona-wut-kolumne-a-2b8e5337-8354-4eca-ab95-7f86a497fd35","Oder in der rassistischen Variante eine asiatischstämmig aussehende Person."
"301","2020-10-29","internetbasiert","In Europa breitet sich eine neue Corona-Variante aus. futurezone.at, 2020-10-29","https://futurezone.at/science/in-europa-breitet-sich-eine-neue-corona-variante-aus/401080701","In der Schweiz gehören zwischen 30 und 40 Prozent der untersuchten Virusgenom-Sequenzen zur neuen Variante."
"302","2020-04-12","internetbasiert","Corona-Verschwörer*innen demonstrieren: Braune Infektionskette. Tazgezwitscher, 2020-04-12","https://taz.de/!5677960/","@zebra Die ""Keule"" in ihren diversen Varianten habe ich mit der Lieben Göttin vereinbart, um damit Rechte und Wahnwichtel zu kennzeichnen."
"303","2020-03-31","internetbasiert","Videokonferenzen: Ok, Zoomer. ZEIT ONLINE, 2020-03-31","https://www.zeit.de/digital/2020-03/videokonferenzen-zoom-app-homeoffice-quarantaene-coronavirus","Stattdessen sprechen Geschäftsführer Eric Yuan und seine Mitarbeiter öffentlich lieber von großen Zuwächsen bei den Nutzerinnen und Nutzer der kostenfreien Variante ihres Angebots – und darüber, dass man aus der Corona-Krise keinen Profit schlagen wolle."
"304","2020-03-25","internetbasiert","Corona-Rettungspaket der Regierung: Der Sozialstaat ist zurück. Tazgezwitscher, 2020-03-25","https://taz.de/!5670691/","Rücksichtnahme auf religiöse Empfindlichkeit ist keine Selbstzensur und Macrons Variante von Laizismus kein universeller Wert."
"305","2020-04-16","internetbasiert","Das grosse sozial-digitale Experiment. RepublikMagazin, 2020-04-16","https://www.republik.ch/2020/04/16/das-grosse-sozial-digitale-experiment","Da die Forscherinnen verschiedene Varianten entwickelt haben, bezog das Konsortium noch keine Stellung zur Frage, welches Modell das Bessere sei: zentrales oder dezentralesTracing."
"306","2020-04-29","internetbasiert","Corona-App: Überwachung gegen die Pandemie. Spektrum, 2020-04-29","https://www.spektrum.de/news/ueberwachung-gegen-die-pandemie/1727184","Dabei, so Gürses, ist die dezentrale Variante von DP-3T schonender für die Privatsphäre und den Datenschutz."
"307","2020-04-22","internetbasiert","Wegen Corona-Krise: Feldweg wird vorerst nicht ausgebaut. https://www.merkur.de, 2020-04-22","https://www.merkur.de/lokales/starnberg/gilching-ort28732/wegen-corona-krise-feldwegwird-vorerst-nicht-ausgebaut-13698645.html","„Hier handelt es sich um eine sicherheitsrechtliche Variante, die ich sogar wegen der geringen Kosten als Bürgermeister ohne Beschluss anordnen kann“, ergänzte Manfred Walter."
"308","2020-05-11","internetbasiert","Jenseits der Kompetenzen - OXI Blog. OXI Blog, 2020-05-11","http://oxiblog.de/jenseits-der-kompetenzen-bundesverfassungsgericht-eugh-pspp-ezb/","Damit eine bestimmte Nation, hier Deutschland in seiner rechtspopulistischen Variante, sich in wichtigen wirtschafts- und geldpolitischen Fragen nicht über andere Mitgliedsländer in der EU stellen kann, ist die Unabhängigkeit der Zentralbank unverzichtbar."
"309","2020-05-14","internetbasiert","Corona-Krise: Jugendliche nicht nur als Schüler sehen. https://www.merkur.de, 2020-05-14","https://www.merkur.de/welt/corona-krise-jugendliche-nicht-nur-als-schueler-sehen-zr-13762471.html","Die digitale Variante, Freundschaften zu pflegen, werde oft als nicht ausreichend wahrgenommen."
"310","2020-11-13","internetbasiert","Wer profitiert bereits von der Berliner IT-Prämie?. Tagesspiegel, 2020-11-13","https://www.tagesspiegel.de/berlin/digitale-transformation-in-der-coronakrise-wer-profitiert-bereits-von-der-berliner-it-praemie/26619060.html","Also schnell mal eine neuere Variante des iPhones oder ein zusätzliches Tablet für die Beschäftigten davon anzuschaffen, ist nicht erlaubt."
"311","2020-05-06","internetbasiert","Coronavirus: Steiner kontert Kritik an Halbklassen und Matura. Neue Zürcher Zeitung, 2020-05-06","https://www.nzz.ch/schweiz/coronavirus-steiner-kontert-kritik-an-halbklassen-und-matura-ld.1554954","Und der geplante Halbklassenunterricht, als eine der Varianten, seine Berechtigung in Corona-Zeiten hat."
"312","2020-03-27","internetbasiert","Gin als Desinfektionsmittel: Was dem Virus nicht schmeckt. Frankfurter Allgemeine Zeitung, 2020-03-27","https://www.faz.net/1.6696950","Gin gehört seit gut zwei Jahren zum Angebot, und was dessen jüngste Variante angeht, umschreibt Alles das Prinzip als „Desinfektionsmittel mit Geschmack“."
"313","2020-09-30","internetbasiert","Covid-19: Neandertaler-Gene erhöhen Risiko für schweren Corona-Verlauf. Spektrum, 2020-09-30","https://www.spektrum.de/news/neandertaler-gene-erhoehen-risiko-fuer-schweren-corona-verlauf/1777080","In Europa habe etwa einer von sechs Menschen sie geerbt – in Afrika und Ostasien komme die Variante hingegen so gut wie gar nicht vor."
"314","2020-08-02","internetbasiert","Alles digital wegen Corona: Zoom in die Vergangenheit. Tazgezwitscher, 2020-08-02","https://taz.de/!5699673/","In der digitalen Variante gehe das ja nicht."
"315","2020-03-31","internetbasiert","App des Robert-Koch-Instituts könnte schon diese Woche präsentiert werden. Tagesspiegel, 2020-03-31","https://www.tagesspiegel.de/politik/handy-tracking-von-corona-infektionsfaellen-app-des-robert-koch-instituts-koennte-schon-diese-woche-praesentiert-werden/25698920.html","„Die schlechteste Variante wäre:"
"316","2020-03-27","internetbasiert","12 Fragen von „Knoblauch“ bis „Kalte Dusche“. Tagesspiegel, 2020-03-27","https://www.tagesspiegel.de/wissen/was-hilft-gegen-das-coronavirus-ein-faktencheck-12-fragen-von-knoblauch-bis-kalte-dusche/25685564.html","Im März gelangen meist noch nicht ausreichend der für die Herstellung von Vitamin D nötigen Variante der UV-Strahlen bis zur Erde."
"317","2020-04-17","internetbasiert","Soziologisches zur Pandemie IV. Soziopolis, 2020-04-17","https://soziopolis.de/lesen/presse/artikel/soziologisches-zur-pandemie-iv/","Wie diese Variante von Aufklärung unter anderem aussehen kann, zeigen Rainer Schnell und Menno Smid, die an gleicher Stelle epidemiologische Erhebungsmethoden kritisch reflektieren."
"318","2020-03-18","internetbasiert","Merkels Ansprache zu Corona: Deutsche Gründlichkeit. Tazgezwitscher, 2020-03-18","https://taz.de/!5672371/","Rücksichtnahme auf religiöse Empfindlichkeit ist keine Selbstzensur und Macrons Variante von Laizismus kein universeller Wert."
"319","2020-10-27","internetbasiert","Streit um Schutzmaßnahmen gegen Corona: Die Schule als Kampfplatz. Tazgezwitscher, 2020-10-27","https://taz.de/!5720713/","Das ist -nicht Zufällig- eine Variante des von der AFD inititierten Denunziantentums gegen -vorgeblich- ""parteiische"" und ""links-indoktrinierende"" LehrerInnen."
"320","2020-05-15","internetbasiert","Virologe Drosten: Tanzen mit dem Tiger. Deutsches Ärzteblatt, 2020-05-15","https://www.aerzteblatt.de/nachrichten/112900/Virologe-Drosten-Tanzen-mit-dem-Tiger","Bei der Variante Ignorieren sind die Kosten sehr ungleich verteilt, die Leidtragenden sind Menschen mit Risikofaktoren und Mitarbeiter im Gesundheitssystem."
"321","2020-05-13","internetbasiert","Coronavirus: Covid-19-Medikament könnte binnen Wochen auf Markt kommen - „Es wirkt“. https://www.merkur.de, 2020-05-13","https://www.merkur.de/welt/corona-deutschland-medikament-rki-reproduktionszahl-aktuell-zahlen-tote-merkel-lockerungen-news-berlin-zr-13748823.html","Bei den vorgetragenen Varianten handelt es sich nur um Spekulationen, fest steht für die Forscher, dass uns diePandemienochbis zu 24 Monate begleitenkönnte - in welcher Form, bleibt abzuwarten."
"322","2020-09-21","internetbasiert","Covid-19: Das Coronavirus mutiert – wie gefährlich ist das?. Spektrum, 2020-09-21","https://www.spektrum.de/news/das-coronavirus-mutiert-wie-gefaehrlich-ist-das/1768398","Im März nahm dann die Häufigkeit der G-Variante auf dem gesamten Kontinent zu, und im April dominierte die Variante schließlich, wie Korber, Montefiori und ihr Team berichteten."
"323","2020-07-30","internetbasiert","Wirtschaftskrise durch Corona: Dem Staat sei Dank. Tazgezwitscher, 2020-07-30","https://taz.de/!5699514/","Rücksichtnahme auf religiöse Empfindlichkeit ist keine Selbstzensur und Macrons Variante von Laizismus kein universeller Wert."
"324","2020-03-30","internetbasiert","Forderung nach Corona-Bonds: Solidarität dringend gesucht. Tazgezwitscher, 2020-03-30","https://taz.de/!5672675/","Rücksichtnahme auf religiöse Empfindlichkeit ist keine Selbstzensur und Macrons Variante von Laizismus kein universeller Wert."
"325","2020-01-07","internetbasiert","Zürich: Betrüger ergaunert mit Telefondienst Spenden. Neue Zürcher Zeitung, 2020-01-07","https://www.nzz.ch/zuerich/betrueger-ergaunert-mit-telefondienst-spenden-und-verkauft-telefonische-pandemie-informationen-ld.1532809","Jene Kunden, die sich darauf über die aktuelle Verbreitungssituation der im Jahr zuvor entdeckten Variante des Influenzavirus informieren wollten, hörten laut Staatsanwaltschaft auf der Nummer des Informationsdienstes allerdings bloss Musik von einem Tonband."
"326","2020-05-04","internetbasiert","Viral durch Quasi-Sex: Die evolutionären Sprünge der Viren. Frankfurter Allgemeine Zeitung, 2020-05-04","https://www.faz.net/1.6751137","Viren nutzen – so wie alle anderen Lebewesen auch – Rekombination, um das Spektrum genetischer Varianten zu erhöhen."
"327","2020-03-16","internetbasiert","Verschwörungstheorien in Corona-Zeiten: Erichs Rache. Tazgezwitscher, 2020-03-16","https://taz.de/!5668690/","@Teddy Brown Die Preis Variante gab es in der DDR nicht."
"328","2020-04-29","internetbasiert","COVID-19-Tracking: Apples ""Project Bubble"" beschäftigt dutzende Mitarbeiter. Mac & i, 2020-04-29","https://www.heise.de/mac-and-i/meldung/COVID-19-Tracking-Apples-Project-Bubble-beschaeftigt-dutzende-Mitarbeiter-4711439.html","So gibt es etwa in Großbritannien Pläne, lieber einen zentralisierten Ansatz zu verfolgen statt die dezentrale Variante von Apple und Google."
"329","2020-05-15","internetbasiert","Weniger Verkehrstote wegen Corona: Ohne Autos endlich sicher. Tazgezwitscher, 2020-05-15","https://taz.de/!5683364/","Autos abschaffen,also in allen Varianten der Antriebstechnik, da es dem Überfahrenen herzlich egal ist, ob die ihn erwischt habende Tonne Stahl vorher ökologisch korrekt beschleunigt wurde oder es sich um den letzten 70er-Jahre Diesel handelt."
"330","2020-04-20","internetbasiert","T-Systems: Corona-Hilfe nur für Neukunden?. Ix Magazin, 2020-04-20","https://www.heise.de/ix/meldung/Corona-Hilfe-von-T-Systems-Nur-fuer-Neukunden-4705918.html","Zur Verfügung stehen mit #S, #M und #L drei Varianten, die sich vor allem in der bereitgestellten Expertenberatung (""Kick-Start-"", ""Quick-Set-Up-"" oder ""Transformations-Beratung"") unterscheiden."
"331","2020-02-12","internetbasiert","Coronavirus: 39 weitere Infizierte auf Quarantäneschiff in Japan. ZEIT ONLINE, 2020-02-12","https://www.zeit.de/wissen/gesundheit/2020-02/coronavirus-lungenkrankheit-kreuzfahrtschiff-japan-china-tote-infizierte","Die Viren sind Experten zufolge Varianten ein und derselben Virusart."
"332","2020-09-17","internetbasiert","Deutschland erklärt Wien zum Corona-Risikogebiet. Merkur.de, 2020-09-17","https://www.merkur.de/leben/deutschland-erklaert-wien-zum-corona-risikogebiet-zr-13903326.html","Die eher positive Variante sage ein tägliches Plus von etwa 650 Fällen voraus, pessimistischere Varianten gingen von 1500 täglichen Neuinfektionen aus."
"333","2020-04-28","internetbasiert","Nach Corona ist vor der Bundestagswahl. Tagesspiegel, 2020-04-28","https://www.tagesspiegel.de/politik/kampf-um-die-kanzlerkandidatur-nach-corona-ist-vor-der-bundestagswahl/25778250.html","Und ob Jens Spahn in ein paar Monaten noch so beliebt ist, und ob Armin Laschet mit einer, sagen wir, schwedischen Variante der Lockerungen am Ende das Richtige getan haben wird, steht dahin."
"334","2020-07-03","internetbasiert","Coronavirus: Neue Mutation ""infektiöser"" als ursprüngliches Virus - DER SPIEGEL - Wissenschaft. Derspiegel, 2020-07-03","https://www.spiegel.de/wissenschaft/medizin/coronavirus-neue-mutation-infektioeser-als-urspruengliches-virus-a-4db9b4e8-1851-4f89-ae6b-10be7a726517","Fauci betonte ebenfalls, dass noch ungewiss sei, ob die Variante schwerere Erkrankungen auslöse oder nicht."
"335","2020-07-05","internetbasiert","Covid-19 - Schweizer Corona-Testdaten. Eine Autopsie.. freitag.de, 2020-07-05","https://www.freitag.de/autoren/gunnar-jeschke/schweizer-corona-testdaten-eine-autopsie","Bei aller hysterischen Grundveranlagung, die ich Lauterbach attestieren würde, könnte die Basis seiner Warnungen ja real sein und damit die Frage - stirbt man dran häufiger als man sonst auch gestorben wäre? - angesichts möglicher (bekannter) Langzeitfolgen beinahe noch die gnädigere Variante sein, die verbirgt, dass es schlimmer sein könnte, damit zu leben als daran gestorben zu sein."
"336","2020-03-24","internetbasiert","Ja, die Polizei warnt vor Betrügern, die die Coronavirus-Krise ausnutzen. correctiv.org, 2020-03-24","https://correctiv.org/faktencheck/2020/03/24/coronavirus-polizei-warnt-vor-betruegern-die-sich-als-mitarbeiter-des-gesundheitsamtes-ausgeben/","Manchmal scheint es eine Variante des telefonischen „Enkeltricks“ zu sein – zum Beispiel in Mannheim."
"337","2020-04-03","internetbasiert","Bildungsungerechtigkeit in Coronazeiten: Die digitale Kluft überwinden. Tazgezwitscher, 2020-04-03","https://taz.de/!5673481/","Rücksichtnahme auf religiöse Empfindlichkeit ist keine Selbstzensur und Macrons Variante von Laizismus kein universeller Wert."
"338","2020-11-07","internetbasiert","Wie gefährlich ist die neue Coronavirus-Variante für Menschen?. Tagesspiegel, 2020-11-07","https://www.tagesspiegel.de/wissen/nerze-uebertragen-mutiertes-virus-wie-gefaehrlich-ist-die-neue-coronavirus-variante-fuer-menschen/26597234.html","Die mutierte Variante zeigt Veränderungen in genau der Struktur, auf die viele der aktuell in Entwicklung befindlichen Impfstoffkandidaten zielen."
"339","2020-06-02","internetbasiert","Corona-Warnapps sind auf dem Vormarsch. N-Tv Nachrichten, 2020-06-02","https://www.n-tv.de/wissen/Corona-Warnapps-sind-auf-dem-Vormarsch-article21819422.html","Eigentlich sollte die deutsche Variante schon Mitte April veröffentlicht werden, eine Diskussion um die Art und Weise der Datenspeicherung verzögerte allerdings die Entwicklung."
"340","2020-04-25","internetbasiert","Karl Lauterbach über Covid-19: „Die Pandemie ist schrecklich“. Tazgezwitscher, 2020-04-25","https://taz.de/!5678392/","Alles nur eine weitere Variante von ""wir - die anderen""."
"341","2020-03-12","internetbasiert","Corona und Schulschließungen: Schulen bald überall zu?. Tazgezwitscher, 2020-03-12","https://taz.de/!5671571/","Im Gunde gibt es gegenwärtig doch nur zwei schlechte Varianten: wenn die Kitas und Schulen offen bleiben, besteht die Gefahr, das angesichts der nicht mehr ermittelbaren Infektionsketten das Virus noch schneller in den Haushalten ankommt."
"342","2020-02-11","internetbasiert","Coronavirus: Zahl der Infizierten in Deutschland steigt auf 16. ZEIT ONLINE, 2020-02-11","https://www.zeit.de/wissen/gesundheit/2020-02/coronavirus-bayern-anzahl-faelle-bundestag-massnahmen","Die Viren sind den Expertinnen und Experten zufolge Varianten ein und derselben Virusart."
"343","2020-03-16","internetbasiert","Verschwörungstheorien in Corona-Zeiten: Erichs Rache. Tazgezwitscher, 2020-03-16","https://taz.de/!5668690/","@Teddy Brown Die Preis Variante gab es in der DDR nicht."
"344","2020-03-09","internetbasiert","Hamsterkäufe in den Sechzigern: ""Denke dran, schaff Vorrat an!"" - DER SPIEGEL - Geschichte. Derspiegel, 2020-03-09","https://www.spiegel.de/geschichte/coronavirus-und-hamsterkaeufe-in-den-sechzigern-denke-dran-schaff-vorrat-an-a-c32b507f-09b4-4ff3-a6b5-5c42dea946cc","Mit immer neuen Varianten versuchte Minister Schwarz die Deutschen zu überzeugen:"
"345","2020-11-24","internetbasiert","Bildung und Corona: Schulen dürfen nicht schließen. Tazgezwitscher, 2020-11-24","https://taz.de/!5731302/","Rücksichtnahme auf religiöse Empfindlichkeit ist keine Selbstzensur und Macrons Variante von Laizismus kein universeller Wert."
"346","2020-09-23","internetbasiert","AUA plant Corona-Schnelltests für Passagiere. futurezone.at, 2020-09-23","https://futurezone.at/digital-life/aua-plant-corona-schnelltests-fuer-passagiere/401041016","Eine weitere Variante, über die man nachdenke, seien Europa-Flüge mit ausschließlich getesteten Passagieren."
"347","2020-04-23","internetbasiert","Rückkehr des Autokinos wegen Corona: Sicher auf dem eigenen Sitz. Tazgezwitscher, 2020-04-23","https://taz.de/!5678237/","Für die Variante in der BRD – 1960 mit deutlich weniger Kfz besiedelt – wurde das Konzept angeglichen."
"348","2020-07-24","internetbasiert","Corona-Proteste der Eventbranche: Ist da alles tutti?. Tazgezwitscher, 2020-07-24","https://taz.de/!5703757/","Etwas Zuschuss vom Staat bei Variante drei."
"349","2020-11-07","internetbasiert","Wie gefährlich ist die neue Coronavirus-Variante für Menschen?. Tagesspiegel, 2020-11-07","https://www.tagesspiegel.de/wissen/nerze-uebertragen-mutiertes-virus-wie-gefaehrlich-ist-die-neue-coronavirus-variante-fuer-menschen/26597234.html","Nach ersten Einschätzungen von Forschenden ist es jedoch unwahrscheinlich, dass die dänische Variante gefährlicher ist als die derzeit schon weit verbreiteten Varianten."
"350","2020-02-02","internetbasiert","Viren: Wie entsteht eine Seuche?. ZEIT ONLINE, 2020-02-02","https://www.zeit.de/2020/06/viren-seuche-entstehung-infektionskrankheit-mutationen-ansteckung-pandemie","Von dort stammt auch das Ebolavirus, dessen gefährlichste Variante bis zu 80 Prozent der Infizierten töten kann."
"351","2020-04-07","internetbasiert","Die Schäbigen, die Tödlichen und die Saudummen. Tagesspiegel, 2020-04-07","https://www.tagesspiegel.de/themen/reportage/verschwoerungstheorien-zum-coronavirus-die-schaebigen-die-toedlichen-und-die-saudummen/25716306.html","Antisemiten nutzen die Coronakrise, um das, woran sie ohnehin glauben, in einer neuen Variante zu verbreiten."
"352","2020-05-06","internetbasiert","Massnahmen gegen Coronavirus: Wir brauchen regionale Alleingänge. Neue Zürcher Zeitung, 2020-05-06","https://www.nzz.ch/meinung/wir-brauchen-alleingaenge-bei-den-massnahmen-gegen-das-coronavirus-ld.1555022","Beides sind sehr schlechte Varianten – und überhaupt nicht fair."
"353","2020-06-08","internetbasiert","BTK-Inhibitor zeigt klinische Wirkung bei COVID-19. Deutsches Ärzteblatt, 2020-06-08","https://www.aerzteblatt.de/nachrichten/113571/BTK-Inhibitor-zeigt-klinische-Wirkung-bei-COVID-19","Mediziner des Brigham and Women’s Hospital in Boston berichteten kürzlich, dass 6 ihrer Patienten, die wegen eines Morbus Waldenström, einer Variante des Non-Hodgkin-Lymphoms, langfristig mit Ibrutinib behandelt wurden, an COVID-19 erkrankt waren."
"354","2020-03-25","internetbasiert","(21) Coronavirus-Update: Antikörpertests kommen bald. Ndr, 2020-03-25","https://www.ndr.de/nachrichten/info/21-Coronavirus-Update-Antikoerpertests-kommen-bald,podcastcoronavirus156.html","Korinna Hennig:Wenn wir noch mal zurückkehren zum Rachenabstrich, das ist ja die gängige Variante:"
"355","2020-04-07","internetbasiert","Positiver Test und doch kein Covid-19: Entwarnung - WELT. DIE WELT, 2020-04-07","https://www.welt.de/regionales/mecklenburg-vorpommern/article207103995/Positiver-Test-und-doch-kein-Covid-19-Entwarnung.html","Der 84-Jährige habe sich mit einer älteren und harmlosen Variante des Coronavirus infiziert, das habe ein Folgetest ergeben, teilte die Stadtverwaltung Schwerin am Dienstag mit."
