"No.","Date","Genre","Bibl","URL","Hit"
"562","2020-03-23","internetbasiert","Corona-Tests: So testet Deutschland. ZEIT ONLINE, 2020-03-23","https://www.zeit.de/wissen/gesundheit/2020-03/coronatests-deutschland-coronavirus-covid-19-who-pandemie","Und gegen diesen aggressiveren Virusstamm wäre dann jemand, der die Infektion mit einer milderen Variante durchgemacht hat, dann nicht immun."
"563","2020-06-23","internetbasiert","Coronavirus: Mutation ""D614G"" könnte die Übertragbarkeit erhöhen. Neue Zürcher Zeitung, 2020-06-23","https://www.nzz.ch/wissenschaft/coronavirus-mutation-d614g-koennte-die-uebertragbarkeit-erhoehen-ld.1562726","Nun spekulieren Forscher, ob die ausserordentlich weite Verbreitung dieser Variante mit einer bestimmten genetischen Veränderung zusammenhängen könnte – einer, die dem Virus eine leichtere Übertragung ermöglicht."
"564","2020-11-05","internetbasiert","Corona-Mutation aus Spanien: Neue Virusvariante verbreitet sich überall in Europa - auch in Deutschland. Merkur.de, 2020-11-05","https://www.merkur.de/welt/coronavirus-mutation-variante-spanien-deutschland-europa-verbreitung-sars-urlaub-reise-zr-90086541.html","Gemeinsam mit ihrem Team analysierteHodcroftVirusgenomsequenzenvonCovid-19-Patientenaus ganz Europa*, um sich die Ausbreitungswege der neuen Variante genau zu erschließen."
"565","2020-07-03","internetbasiert","Coronavirus: Neue Mutation ""infektiöser"" als ursprüngliches Virus - DER SPIEGEL - Wissenschaft. Derspiegel, 2020-07-03","https://www.spiegel.de/wissenschaft/medizin/coronavirus-neue-mutation-infektioeser-als-urspruengliches-virus-a-4db9b4e8-1851-4f89-ae6b-10be7a726517","Noch halten es Forscher nicht für ausgeschlossen, dass sich das Coronavirus mit der Mutation D614G zufällig in Europa ausgebreitet hat, weil es die erste Variante war, die den Kontinent erreichte."
"566","2020-10-26","internetbasiert","CDU verschiebt Parteitag auf nächstes Jahr. Politik, 2020-10-26","https://www.zdf.de/uri/e246b846-3409-44e5-8c50-44feafbe4a73","Ein Präsenzparteitag ist die bevorzugte Variante der Präsidiumsmitglieder und der Parteivorsitzenden."
"567","2020-02-24","internetbasiert","Coronavirus und die Auswirkungen auf die SIX. Cash Forum, 2020-02-24","https://www.cash.ch/forum/boerse/aktien-schweiz/coronavirus-und-die-auswirkungen-auf-die-six","Die schlimmste Variante wäre ein L: ein wirtschaftlicher Einbruch, auf den eine Stagnation folgt."
"568","2020-04-05","internetbasiert","Frankreich: Auf dem spanisch-italienischen Weg?. Heise Online, 2020-04-05","https://www.heise.de/tp/features/Frankreich-Auf-dem-spanisch-italienischen-Weg-4697335.html","Schaut man sich die Entwicklungen der letzten Wochen an, ist eher die zweite Variante zu vermuten."
"569","2020-01-22","internetbasiert","Deutlich mehr Tote in China. Tagesspiegel, 2020-01-22","https://www.tagesspiegel.de/wissen/coronavirus-aus-wuhan-breitet-sich-schnell-aus-deutlich-mehr-tote-in-china/25459068.html","Das neue Virus gehört zur selben Virusart, es ist nur eine andere – nach derzeitigem Stand harmlosere – Variante."
"570","2020-03-14","internetbasiert","Corona und Spanische Grippe: Eine unvergleichbare Pandemie. Frankfurter Allgemeine Zeitung, 2020-03-14","https://www.faz.net/1.6678110","Mehr als 7000 Mal gehen inzwischen jeden Monat Verdachtsmeldungen bei der Weltgesundheitsorganisation ein, und im Jahr 2018 waren erstmals in einem Jahr gleichzeitig neue Varianten von sechs der acht am meisten gefürchteten Erreger aufgetaucht."
"571","2020-04-05","internetbasiert","Boris Palmer über Corona-Quarantäne: „Ein neuer Generationenvertrag“. Tazgezwitscher, 2020-04-05","https://taz.de/!5676475/","Der Artikel versucht hier das Leid quasi aufzusummiren und beide Varianten zu vergleichen, was zumindest der einzig vernünftig Ansatz ist und so, wie im Artikel erwähnt, von keinem Staat umgesetzt wurde."
"572","2020-05-25","internetbasiert","Diese Unternehmen mussten in der Corona-Krise Insolvenz anmelden - Capital.de. Capital.de, 2020-05-25","https://www.capital.de/wirtschaft-politik/diese-unternehmen-mussten-in-der-corona-krise-insolvenz-anmelden","Bei dieser besonderen Variante des Insolvenzverfahrens bleibe das betroffene Unternehmen weitgehend in Eigenverwaltung, aber vor Liquiditätsanforderungen bewahrt."
"573","2020-11-19","internetbasiert","Coronavirus: Nerz-Mutationen in sieben Ländern nachgewiesen - DER SPIEGEL - Wissenschaft. Derspiegel, 2020-11-19","https://www.spiegel.de/wissenschaft/mensch/coronavirus-nerz-mutationen-in-sieben-laendern-nachgewiesen-a-74d75d05-50cd-4e08-a9cd-2657f2935445","Aber es war befürchtet worden, dass die derzeit entwickelten Impfstoffe weniger gut gegen diese Variante wirken."
"574","2020-05-12","internetbasiert","Klimawandel: Wer das Verhängnis nicht leugnet, wird handlungsfähig. ZEIT ONLINE, 2020-05-12","https://www.zeit.de/2020/20/klimawandel-corona-krise-klimakatastrophe-zukunft-szenarien","Oder aber – dritte Variante – der Zusammenbruch wird vermieden, weil unsere Zivilisation das Ruder doch noch ""radikal und rasch"" herumreißt."
"575","2020-04-12","internetbasiert","Corona-Verschwörer*innen demonstrieren: Braune Infektionskette. Tazgezwitscher, 2020-04-12","https://taz.de/!5677960/","Die ""Keule"" in ihren diversen Varianten habe ich mit der Lieben Göttin vereinbart, um damit Rechte und Wahnwichtel zu kennzeichnen."
"576","2020-03-19","internetbasiert","Wirtschaftshilfen in Corona-Krise: Vermögende, zur Kasse bitte. Tazgezwitscher, 2020-03-19","https://taz.de/!5669010/","Rücksichtnahme auf religiöse Empfindlichkeit ist keine Selbstzensur und Macrons Variante von Laizismus kein universeller Wert."
"577","2020-05-26","internetbasiert","Corona-Live-Ticker vom 6. April: Merkel nennt Corona größte Bewährungsprobe der EU | DW | 06.04.2020. DW.COM, 2020-05-26","https://www.dw.com/de/corona-live-ticker-vom-6-april-merkel-nennt-corona-gr%C3%B6%C3%9Fte-bew%C3%A4hrungsprobe-der-eu/a-53025287","Vor Beratungen der EU-Finanzminister am Dienstag warben nicht nur die EU-Kommissare Paolo Gentiloni und Thierry Breton für sogenannteAuch die französische Regierung setzte sich abermals für eine Variante dieser Gemeinschaftsanleihen ein, die gezielt für den Kampf gegen die wirtschaftlichen Folgen der Pandemie eingesetzt werden sollen."
"578","2020-04-10","internetbasiert","Corona-Tagebuch: Was Mediatheken besser machen können. TÜV Rheinland Blog, 2020-04-10","https://blog.tuv.com/corona-tagebuch-was-mediatheken-besser-machen-koennen/","Da gibt es bessere Varianten bei anderen Marken."
"579","2020-09-23","internetbasiert","Pandemie: Was Coronavirus-Schnelltests können und was nicht. Spektrum, 2020-09-23","https://www.spektrum.de/news/was-bringen-coronavirus-schnelltests/1772691","Wieder andere Verfahren sind schnellere Varianten des PCR-Tests, die andere Reagenzien als das Original verwenden."
"580","2020-04-19","internetbasiert","Abitur in Corona-Zeiten: „Die ich rief, die Geister, werd ich nun nicht los“. Tichys Einblick, 2020-04-19","http://www.tichyseinblick.de/kolumnen/josef-kraus-lernen-und-bildung/abitur-in-corona-zeiten-die-ich-rief-die-geister-werd-ich-nun-nicht-los/","Alle möglichen Varianten von Nicht- oder Alternativ-Abitur geistern nun durch die Landschaft."
"581","2020-10-22","internetbasiert","Corona im Landkreis Erding: In zwei Tagen von Grün auf Rot - diese Beschränkungen gelten ab Freitag. Merkur.de, 2020-10-22","https://www.merkur.de/lokales/erding/erding-ort28651/erding-corona-ampel-rot-inzidenz-beschraenkungen-freitag-13923697.html","Für diese Variante haben sich trotz Freistellung durch Landrat Martin Bayerstorfer auch die weiterführenden Schulen entschieden."
"582","2020-04-27","internetbasiert","Ein Neuland-Trauerspiel mit vorläufigem Happy End - DER SPIEGEL - Netzwelt. Derspiegel, 2020-04-27","https://www.spiegel.de/netzwelt/web/corona-app-ein-neuland-trauerspiel-mit-vorlaeufigem-happy-end-a-8e8bcd30-d091-4933-9f77-ebad350d466c","Dass sich Jens Spahn nun für die dezentrale Variante ausspricht, spricht für ihn."
"583","2020-03-31","internetbasiert","Videokonferenzen: Ok, Zoomer. ZEIT ONLINE, 2020-03-31","https://www.zeit.de/digital/2020-03/videokonferenzen-zoom-app-homeoffice-quarantaene-coronavirus","Nein, es gibt auch eine kostenpflichtige Variante von Zoom."
"584","2020-04-17","internetbasiert","Die Zeit nach Corona: Keine Rückkehr zum Normalzustand. Technology Review, 2020-04-17","https://www.heise.de/hintergrund/Die-Zeit-nach-Corona-Keine-Rueckkehr-zum-Normalzustand-4700775.html","Untersucht wurde auch die Variante, Einschränkungen nur für eine etwa fünfmonatige Phase gelten zu lassen."
"585","2020-04-27","internetbasiert","Corona-Warn-App: Regierung schwenkt auf dezentrale Lösung um. Deutsches Ärzteblatt, 2020-04-27","https://www.aerzteblatt.de/nachrichten/112308/Corona-Warn-App-Regierung-schwenkt-auf-dezentrale-Loesung-um","Spahn erklärte die Änderung damit, dass die dezentrale Variante besser angenommen werde."
"586","2020-04-29","internetbasiert","Corona-App: Überwachung gegen die Pandemie. Spektrum, 2020-04-29","https://www.spektrum.de/news/ueberwachung-gegen-die-pandemie/1727184","Insbesondere die Deanonymisierung von persönlichen Daten sehen die DP-3T-Foscher jedoch als großes Problem der zentralen Variante."
"587","2020-09-11","internetbasiert","100.000 Corona-Tests täglich in Österreich möglich. futurezone.at, 2020-09-11","https://futurezone.at/science/100000-corona-tests-taeglich-in-oesterreich-moeglich/401028746","Als dritte Variante, um die Testkapazitäten deutlich zu erhöhen, führt die Arbeitsgruppe Verfahren an, die auf Next-generation-sequencing (NGS) basieren."
"588","2020-05-27","internetbasiert","Aids - Geschichte einer Pandemie | DW | 21.10.2009. DW.COM, 2020-05-27","https://www.dw.com/de/aids-geschichte-einer-pandemie/a-4812256","Aber das HI-Virus ist sehr aggressiv und zeigt immer wieder neue Varianten und Sub-Typen."
"589","2020-07-26","internetbasiert","Corona-Krise - Wie gefährlich ist Covid-19?. freitag.de, 2020-07-26","https://www.freitag.de/autoren/gunnar-jeschke/wie-gefaehrlich-ist-covid-19","Wie gesagt, in Zweifelsfällen würde ich bis zum Beweis des Gegenteil von der schlimmeren Variante ausgehen, ich dachte, Sie sähen das auch so?"
"590","2020-10-22","internetbasiert","Coronavirus-News am Donnerstag: Gericht kippt Höchstgrenze für private Feiern - DER SPIEGEL - Wissenschaft. Derspiegel, 2020-10-22","https://www.spiegel.de/wissenschaft/coronavirus-news-am-donnerstag-die-wichtigsten-entwicklungen-zu-sars-cov-2-und-covid-19-a-bb580f8e-24ac-491b-9b53-0434695a5019","""Wir denken, dass es sich um eine ansteckendere Variante des Virus handelt, die sich im Bus befand"", sagte die Ärztin Heidi Syre, die das Forschungsprojekt leitet, dem NRK."
"591","2020-04-12","internetbasiert","Der neue Klassenkampf. Salonkolumnisten, 2020-04-12","https://www.salonkolumnisten.com/der-neue-klassenkampf/","Davon gab es eine sozialdemokratische oder eine christdemokratische Variante."
"592","2020-08-26","internetbasiert","Wie die Corona-Protestanten ticken - DER SPIEGEL - Netzwelt. Derspiegel, 2020-08-26","https://www.spiegel.de/netzwelt/corona-proteste-psychogramm-der-empoerten-kolumne-a-e853511e-eb67-48df-a801-194dd373a7cd","In der radikalsten Variante mündet der Corona-Protest im extremistischen Wunsch nach dem Tag X, dem Tag der mordlüsternen Abrechnung mit der verhassten liberalen, multikulturell geprägten Gesellschaft."
"593","2020-04-04","internetbasiert","Corona-Zwangsschliessungen: Viele Vermieter bleiben hart. Neue Zürcher Zeitung, 2020-04-04","https://www.nzz.ch/wirtschaft/corona-zwangsschliessungen-viele-vermieter-bleiben-hart-ld.1549839","Eigentlich hätte deshalb auch hier die Variante «Stundung» vorgeschlagen werden sollen; der Vorschlag, dass man auch eine ausserordentliche, sofortige Kündigung akzeptieren würden, sei eigentlich nur ein zusätzlicher Lösungsvorschlag in diesem spezifischen Einzelfall."
"594","2020-04-10","internetbasiert","„Wir alle sind in einem riesigen psychologischen Experiment“. Tagesspiegel, 2020-04-10","https://www.tagesspiegel.de/politik/die-gesellschaft-kann-aus-der-pandemie-lernen-wir-alle-sind-in-einem-riesigen-psychologischen-experiment/25703778.html","Ich denke, die Menschen begreifen, dass die liberal-offene Variante langfristig mehr hilft, weil sie mehr Empathie, Solidarität und demokratisches Miteinander kennt."
"595","2020-08-25","internetbasiert","Forscher überprüfen Abwasser auf Coronaviren. Deutsches Ärzteblatt, 2020-08-25","https://www.aerzteblatt.de/nachrichten/115929/Forscher-ueberpruefen-Abwasser-auf-Coronaviren","So gebe es inzwischen verschiedene regionale Varianten von SARS-CoV-2, erklärte Lackner."
"596","2020-04-02","internetbasiert","Palmkinder während Corona: Auf drei Wegen zum Segen. https://www.merkur.de, 2020-04-02","https://www.merkur.de/lokales/region-holzkirchen/holzkirchen-ort28831/palmkinder-waehrend-corona-auf-drei-wegen-zum-segen-13637473.html","Die dritte Variante ist aufwendiger, aber nah dran am vertrauten Ritual:"
"597","2020-07-28","internetbasiert","Kinder hungern wegen Corona: Menschenunrecht. Tazgezwitscher, 2020-07-28","https://taz.de/!5699310/","Rücksichtnahme auf religiöse Empfindlichkeit ist keine Selbstzensur und Macrons Variante von Laizismus kein universeller Wert."
"598","2020-01-23","internetbasiert","Peking warnt vor möglicher Mutation des Corona-Virus - WELT. DIE WELT, 2020-01-23","https://www.welt.de/print/die_welt/article205270361/Peking-warnt-vor-moeglicher-Mutation-des-Corona-Virus.html","„Es ist dieselbe Virusart, nur in einer anderen Variante“, sagte der Direktor des Instituts für Virologie an der Charité in Berlin."
"599","2020-04-23","internetbasiert","Leichte Sprache in Corona-Zeiten: „Regeln müssen verstanden werden“. Tazgezwitscher, 2020-04-23","https://taz.de/!5677622/","Maaß:Beide Varianten sind gegenüber dem Standard deutlich verständlicher."
"600","2020-04-16","internetbasiert","Das grosse sozial-digitale Experiment. RepublikMagazin, 2020-04-16","https://www.republik.ch/2020/04/16/das-grosse-sozial-digitale-experiment","Ohne dass diese eine App herunterladen, das Bluetooth-Signal einschalten und demTracingaktiv zustimmen, geschieht bei dieser Variante – gar nichts."
"601","2020-05-13","internetbasiert","Gaming im Corona-Alltag: Warum jetzt so viel gespielt wird und welche Spiele gut für Einsteiger sind - DER SPIEGEL - Familie. Derspiegel, 2020-05-13","https://www.spiegel.de/familie/gaming-im-corona-alltag-welches-videospiel-ist-das-richtige-fuer-mich-a-0939f0c5-44e9-47e9-b24b-dd2e79fbdbd0","Es gibt von der einfachsten Variante, ich sage jetzt mal Mensch ärgere dich nicht - gäbe ja auch die Variante:"
"602","2020-01-22","internetbasiert","China riegelt Millionenstadt Wuhan ab. N-Tv Nachrichten, 2020-01-22","https://www.n-tv.de/panorama/China-riegelt-Millionenstadt-Wuhan-ab-article21526961.html","Das neue Virus soll nach derzeitigem Stand eine harmlosere Variante sein."
"603","2020-05-01","internetbasiert","Der Fußball entdeckt die Demut. Süddeutsche Zeitung, 2020-05-01","https://www.sueddeutsche.de/sport/bundesliga-coronavirus-dfl-1.4892394","Beide Varianten, die schwarz-weiße und die farbige, haben ihre Vorzüge, das eint sie."
"604","2020-04-19","internetbasiert","Abitur in Corona-Zeiten: „Die ich rief, die Geister, werd ich nun nicht los“. Tichys Einblick, 2020-04-19","http://www.tichyseinblick.de/kolumnen/josef-kraus-lernen-und-bildung/abitur-in-corona-zeiten-die-ich-rief-die-geister-werd-ich-nun-nicht-los/","Alle möglichen Varianten von Nicht- oder Alternativ-Abitur geistern hier durch die Landschaft: ein Verschieben um zwei oder drei Wochen, eine Verschiebung in die womöglich verkürzten Sommerferien oder ins neue Schuljahr hinein, ein gänzliches Wegfallenlassen der Abschlussprüfungen, ein Hochrechnen bisheriger Schulleistungen zu einer fiktiven Abiturnote usw."
"605","2020-05-03","internetbasiert","Stadtrat in München: Amtsketten aus dem Jahr 1818. Süddeutsche Zeitung, 2020-05-03","https://www.sueddeutsche.de/muenchen/coronavirus-muenchen-stadtrat-amtskette-tradition-1.4894150","Aber man wählte eine sanftere Variante, eine, die geeignet gewesen wäre, im Falle einer Rückkehr des Monarchen die Medaille ohne großen Aufwand wieder königstreu zu machen."
"606","2020-12-02","internetbasiert","Pandemie-Zwischenbilanz: Ampeln, Schnelltests, Seniorenstunden: Wie Europa gegen Corona kämpft. Handelsblatt_De, 2020-12-02","https://www.handelsblatt.com/politik/international/pandemie-zwischenbilanz-ampeln-schnelltests-seniorenstunden-wie-europa-gegen-corona-kaempft/26653608.html","Berlin, Madrid, Paris, Rom, Stockholm, Wien An einem zweiten Lockdown kommt kein Staat ganz vorbei, doch die Ausgestaltung vom harten Lockdown in Österreich bis zur lockersten Variante in Schweden ist höchst unterschiedlich."
"607","2020-05-11","internetbasiert","Die verzweifelte Sehnsucht nach Normalität. Tagesspiegel, 2020-05-11","https://www.tagesspiegel.de/sport/berliner-sportklubs-in-der-coronavirus-krise-die-verzweifelte-sehnsucht-nach-normalitaet/25817366.html","„Ich habe auch für diese Variante gestimmt."
"608","2020-03-06","internetbasiert","+++ 22:14 Virus-Papst fordert zwei Wochen Corona-Ferien +++. N-Tv Nachrichten, 2020-03-06","https://www.n-tv.de/panorama/22-14-Virus-Papst-fordert-zwei-Wochen-Corona-Ferien--article21622722.html","Dabei stießen sie auf zwei Varianten von Sars-CoV-2, die zwei Stadien in der Evolution des Virus darstellen sollen."
"609","2020-04-22","internetbasiert","Covid-19: Über 30 Varianten mit vielen genetischen Unterschieden. Heise Online, 2020-04-22","https://www.heise.de/tp/features/Covid-19-Ueber-30-Varianten-mit-vielen-genetischen-Unterschieden-4707064.html","Gut möglich, dass Variante C aggressiver sein kann als A oder B."
"610","2020-11-14","internetbasiert","Nerz-Massenmord in Dänemark: Land tötet Millionen Tiere – wegen Corona-Mutation. Merkur.de, 2020-11-14","https://www.merkur.de/welt/daenemark-nerze-coronavirus-toetung-nordjuetland-einschraenkungen-mutation-zr-90092612.html","Auch mehrere Menschen haben sich bereits mit dieser Variante des Virus („Cluster-5-Virus“) angesteckt."
"611","2020-11-10","internetbasiert","Nochmals 1,5 bis 2 Milliarden Euro: Tui buhlt um weitere Milliardenhilfen vom Staat - manager magazin - Unternehmen. Manager_Magazin, 2020-11-10","https://www.manager-magazin.de/unternehmen/tui-buhlt-in-der-corona-krise-um-weitere-milliardenhilfen-vom-staat-a-ffc32097-4e3f-402a-b232-7423e2c98654","Es würden verschiedene Varianten geprüft, auch Mischmodelle."
"612","2020-04-04","internetbasiert","„Haben enorme Rückgänge bei bestimmten Straftaten“. Tagesspiegel, 2020-04-04","https://www.tagesspiegel.de/politik/berlins-polizeipraesidentin-ueber-die-corona-krise-haben-enorme-rueckgaenge-bei-bestimmten-straftaten/25715144.html","Es gibt eine neue Variante des Enkeltricks, da wird dem Opfer vorgegaukelt, dass der Enkel auf der Intensivstation liegt und sofort Geld für Mittel braucht, weil er sonst stirbt."
"613","2020-06-24","internetbasiert","Wie der Mensch die Evolution von Sars-CoV-2 formen kann. Tagesspiegel, 2020-06-24","https://www.tagesspiegel.de/wissen/das-stete-mutieren-des-covid-19-erregers-wie-der-mensch-die-evolution-von-sars-cov-2-formen-kann/25946680.html","Gibt es infektiösere Varianten, aggressivere, gefährlichere für die Patienten?"
"614","2020-05-07","internetbasiert","Elternwünsche in Coronazeiten: Selbst gemachtes Leid. Tazgezwitscher, 2020-05-07","https://taz.de/!5681171/","Rücksichtnahme auf religiöse Empfindlichkeit ist keine Selbstzensur und Macrons Variante von Laizismus kein universeller Wert."
"615","2020-05-15","internetbasiert","Wenn Krankheitserreger von Tieren auf Menschen springen - quarks.de. quarks.de, 2020-05-15","https://www.quarks.de/umwelt/tierwelt/wenn-krankheitserreger-von-tieren-auf-menschen-springen/","Ebenso Milzbrand (Anthrax), Campylobacter-Enteritis (bakterielle Durchfall-Erkrankung), FSME (Frühsommer-Meningoenzephalitis), Borreliose, Aviäre Influenza (“Vogelgrippe“), Taeniose (Bandwurm-Befall), Neue Variante der Creutzfeldt-Jakob-Krankheit, Malleus (Rotz), Nipah-Virus und Hendraviren."
"616","2020-02-12","internetbasiert","Wieder fast 100 neue Todesopfer durch Coronavirus in China. Cash, 2020-02-12","https://www.cash.ch/news/politik/wieder-fast-100-neue-todesopfer-durch-coronavirus-china-1478191","Die Viren sind Experten zufolge Varianten ein und derselben Virusart./dg/DP/zb"
"617","2018-05-13","internetbasiert","Bei Pandemie wäre Vortritt für Junge zu Impfstoff am effektivsten. Cash, 2018-05-13","https://www.cash.ch/news/politik/bei-pandemie-waere-vortritt-fuer-junge-zu-impfstoff-am-effektivsten-1172820","""Die Studie zeigt verschiedene Varianten auf, wie im Pandemiefall beim Impfen vorgegangen werden kann"", erläuterte Daniel Koch, Leiter übertragbare Krankheiten beim BAG, am Sonntag auf Anfrage der SDA."
"618","2020-03-05","internetbasiert","Schutz gegen das Coronavirus: Berechtigter Aufwand. Tazgezwitscher, 2020-03-05","https://taz.de/!5666035/","Rücksichtnahme auf religiöse Empfindlichkeit ist keine Selbstzensur und Macrons Variante von Laizismus kein universeller Wert."
"619","2020-04-02","internetbasiert","Wie der Volkssport Kegeln in die Krise geriet - und jetzt unter dem Coronavirus leidet - DER SPIEGEL - Sport. Derspiegel, 2020-04-02","https://www.spiegel.de/sport/wie-der-volkssport-kegeln-in-die-krise-geriet-und-jetzt-unter-dem-coronavirus-leidet-a-0877edda-df1c-4a1c-a721-6d950b873490","Gekegelt wird in unterschiedlichen Varianten."
"620","2020-06-12","internetbasiert","Freiheit - Wie Pekings Pandemie unsere Freiheit bedroht. freitag.de, 2020-06-12","https://www.freitag.de/autoren/mpoellath/wie-pekings-pandemie-unsere-freiheit-bedroht","Wird man: von China lernen heißt siegen lernen, so die zeitgemäße Variante."
"621","2020-04-20","internetbasiert","Covid-19 - Forscher:innen warnen, Kontaktverfolgung könne zur Überwachung missbraucht werden. netzpolitik.org, 2020-04-20","https://netzpolitik.org/2020/forscherinnen-warnen-kontaktverfolgung-koenne-zur-ueberwachung-missbraucht-werden/","Soweit ich das verstanden habe, sollten doch bei der dezentralen Variante nur die gesendeten Tokens der infizierten bereitgestellt werden."
"622","2020-10-02","internetbasiert","Trump mit Coronavirus infiziert: Was wäre, wenn?. Tazgezwitscher, 2020-10-02","https://taz.de/!5718211/","Schön, dass die wahrscheinlichste Variante an erster Stelle steht."
"623","2020-04-07","internetbasiert","Lockdown - Unter jedem Dach. freitag.de, 2020-04-07","https://www.freitag.de/autoren/martina-mescher/unter-jedem-dach","Da klingt die Variante des Smart Distancing, die dem Virologen Alexander Kekulé als Strategie für den Ausstieg aus dem Lockdown vorschwebt, menschenfreundlicher."
"624","2020-03-26","internetbasiert","Einbrecher und Trickbetrug - Kriminalität in Corona-Zeiten. https://www.merkur.de, 2020-03-26","https://www.merkur.de/welt/einbrecher-und-trickbetrug-kriminalitaet-in-corona-zeiten-zr-13628574.html","Auch das Landeskriminalamt (LKA) in Stuttgart warnt vor einer neuen Variante des sogenannten Enkeltricks:"
"625","2020-04-21","internetbasiert","Corona auf Flugzeugträger Charles de Gaulle: Schwimmender Laborversuch - DER SPIEGEL - Politik. Derspiegel, 2020-04-21","https://www.spiegel.de/politik/ausland/corona-auf-flugzeugtraeger-charles-de-gaulle-schwimmender-laborversuch-a-1c6b4130-34a1-40ca-9ecf-d88668e942bc","Mittlerweile hält auch die Armeeführung den Landgang im bretonischen Brest für kritisch; als bisher wahrscheinlichste Variante gilt, dass sich einer oder mehrere Soldaten hier mit dem Virus infizierten."
"626","2020-04-28","internetbasiert","Coronavirus und Covid-19: Was ist das? Der Erreger und die Krankheit. https://www.merkur.de, 2020-04-28","https://www.merkur.de/welt/coronavirus-covid19-china-was-ist-lungenkrankheit-wuhan-viren-epidemie-sars-cov-2-13456371.html","Einige Varianten der Familie können aber überaus gefährlich werden."
"627","2020-05-02","internetbasiert","Covid-19 - ein Fall für Medical Detectives. Heise Online, 2020-05-02","https://www.heise.de/tp/features/Covid-19-ein-Fall-fuer-Medical-Detectives-4713219.html","Woher wissen wir also, dass die Diskrepanz zwischen den vielen harmlosen Infektionen und den wenigen schwereren Verläufen nicht dadurch bedingt ist, dass unterschiedliche Varianten mit dem benutzten Test gleichermaßen gefunden werden?"
"628","2020-05-13","internetbasiert","„Kinderspiel zur 0 zu kommen!“ Expertin erklärt bei Anne Will entscheidenden Corona-Punkt. https://www.merkur.de, 2020-05-13","https://www.merkur.de/politik/anne-will-corona-tv-ard-lockerungen-reproduktionszahl-berlin-expertin-kubicki-fdp-talkshow-zr-13757811.html","Die Frage sei nun, ob es das Ziel sei, dasVirus tatsächlich unter Kontrolle zu bringen- oder ob man mit einer „chronischen“, flächendeckenden Variante leben wolle."
"629","2020-04-08","internetbasiert","Depression in lausigen Zeiten. Tichys Einblick, 2020-04-08","http://www.tichyseinblick.de/meinungen/depression-in-lausigen-zeiten/","Aber fast jeder kennt seine Variante des Hofgartens."
"630","2020-04-26","internetbasiert","Aquakultur: Wie grün ist der Lachs?. Spektrum, 2020-04-26","https://www.spektrum.de/news/wie-aquakulturen-ihre-haltungsbedingungen-verbessern-koennten/1725772","Eine zweite Variante sind Anti-Läuse-Medikamente, eine Methode, die vielfach in den letzten 40 Jahren eingesetzt wurde."
"631","2019-05-20","internetbasiert","Wildtierseuchen: Fünf Zoonosen aus der Wildnis, die Mediziner auf Trab halten. Spektrum, 2019-05-20","https://www.spektrum.de/wissen/fuenf-zoonosen-aus-der-wildnis-die-mediziner-auf-trab-halten/1646794","Die Krankheit kommt in drei Varianten vor."
