"No.","Date","Genre","Bibl","URL","Hit"
"1879","2012-03-09","internetbasiert","Mitarbeiter des Kameha Grand Bonn erfolgreich: Stephan Schmitz gewinnt Stipendium. bonner-presseblog.de, 2012-03-09","http://www.bonner-presseblog.de/vermischtes/mitarbeiter-des-kameha-grand-bonn-erfolgreich-stephan-schmitz-gewinnt-stipendium","Carsten K. Rath ist Preisträger des Querdenker Award und Arbeitgeber des Jahres."
"1880","2011-09-13","internetbasiert","Ich bin zu haben. Ganz kurz nur - Später ist gleich vorbei, 2011-09-13","http://www.ganzkurznur.de/2011/09/13/ich-bin-zu-haben/","Ich würde mich gar nicht mal als Querdenker bezeichnen, habe im Moment eher das Gefühl einer Normalisierung oder Entgiftung, z. B. von nervigen Gebeten wie „Wir müssen uns vernetzen, schnell handeln und Nischen besetzen“."
"1881","2012-09-26","internetbasiert","Wissenschaften. philosophie-beitmann.de, 2012-09-26","http://philosophie-beitmann.de/wissenschaften","In Deutschland hat kaum jemand eine wissenschaftliche Chance, der sich nicht den Regeln der hier herrschenden fachlichen Zunft unterwirft, sei es als Bewerber aus dem Ausland, bzw. als Außenseiter oder Querdenker im Inland."
"1882","2011-03-18","internetbasiert","Stromrebellen pflanzen Regenwald. 88Energie, 2011-03-18","https://www.88energie.de/stromrebellen-pflanzen-regenwald-369985.html","Die Querdenker GmbH unter der Leitung von Dipl.-Ing Leo Pröstler ist eine Firma für Beratung und Projektentwicklung in den Bereichen Unternehmensverantwortung und Nachhaltiges Investment."
"1883","2011-12-07","internetbasiert","Supply Chain, Agilität, Diversität und Resilienz. www.business-wissen.de, 2011-12-07","https://www.business-wissen.de/artikel/supply-chain-agilitaet-diversitaet-und-resilienz/","Diversity Management Hierbei geht es vor allem um das Einstellen und die Integration von Querdenkern sowie das Fördern von interdisziplinären und interkulturellen Vermischungen."
"1884","2011-04-25","internetbasiert","AUSGEZEICHNET! - KU64 HOLT DEN GRENANDER AWARD • KU64 Die Zahnspezialisten. KU64 Die Zahnspezialisten Berlin Charlottenburg, Berlin Mitte und Potsdam, 2011-04-25","https://ku64.de/blog/ausgezeichnet-ku64-holt-den-grenander-award/","Nach der Verleihung des Querdenker Awards 2010 in der Kategorie innovative Unternehmen ist der Grenander Award in der Kategorie Dienstleistung nun schon der zweite Preis für KU64 innerhalb von einem halben Jahr – wow!"
"1885","2012-05-24","internetbasiert","Archiv › loggn.de. loggn.de, 2012-05-24","https://www.loggn.de/archiv/","Vorstellung – equinux tizi Querdenker - Lightning oder Micro USB"
"1886","2010-08-30","internetbasiert","PANIK VOR WELTWIRTSCHAFTSKRISE NIMMT ZU. Alternativesdenken, 2010-08-30","https://alternativesdenken.wordpress.com/2010/08/30/453/","Für Querdenker, die innerhalb der letzten zwei Jahre auch nur irgendetwas dazu gelernt haben, dürfte das bereits genügen um sich in die Flucht zu schlagen."
"1887","2011-10-02","internetbasiert","Kapitalismuskritik. Mission Impossible, 2011-10-02","https://thinktankboy.wordpress.com/f-rubriken/f-rubrik-kapitalismuskritik/","Mal: Antizionistisch oder antisemitisch sind nicht ein „paar Querdenker“."
"1888","2011-09-21","internetbasiert","Ypsilon Buchhandlung & Café - Nordend. y-buchladen.de, 2011-09-21","https://www.y-buchladen.de/lesung/archiv-lesungen/nordend-1/","Das Nordend – ein Mekka für Kaffeetrinker, Ökobewusste, Querdenker, Künstler und viele junge Familien."
"1889","2010-03-22","internetbasiert","Teilnehmende Betriebe. jobweek.at, 2010-03-22","https://www.jobweek.at/betriebe","Wir sind Vordenker, Querdenker und Mitdenker."
"1890","2011-01-26","internetbasiert","Kunst + Film: Der Welt-Menschheit größte Erfindung! – Karl Hans Janke: Ideen eines Weltraumfantasten. Kunst+Film, 2011-01-26","https://kunstundfilm.de/2011/01/der-welt-menschheit-groste-erfindung-karl-hans-janke/","Für Querdenker seines Schlages war in der DDR kein Platz."
"1891","2010-11-29","internetbasiert","Ines Zock zeigt der SPD die rote Karte.. Falkenseer Focus, 2010-11-29","https://rincewind1964.wordpress.com/2010/11/29/ines-zock-zeigt-der-spd-die-rote-karte/","Es hat den Anschein, das in der SPD Schönwalde keine Querdenker und engagierte Mitglieder gewünscht werden."
"1892","2011-10-14","internetbasiert","AZM #016 Top motiviert und leistungsstark dank richtigem kreativ-chaotischen Lebens-Arbeitsmodell • GlüXX-Factory.de. GlüXX-Factory.de, 2011-10-14","https://www.gluexx-factory.de/azm-016-top-motiviert-und-leistungsstark-dank-richtigem-kreativ-chaotischen-lebens-arbeitsmodell/","Unter dem Kürzel AZM (Abenteuer Zeitmanagement) erwarten Sie regelmäßige Tipps und Methoden, wie Sie als Kreativer Chaot, als Querdenker, als Scanner, als Polypotential mehr Ruhe und Gelassenheit in Ihren Alltag bekommen und somit ein glückliches und erfülltes Leben leben (statt ein gefülltes )."
"1893","2011-01-01","internetbasiert","TECXIPIO GmbH. CyberForum e.V., 2011-01-01","https://www.cyberforum.de/mitglieder","Wir sind Querdenker und Ausprobierer, Optimierer und Jongleure, gehen immer noch einen Schritt weiter und sehen eine Lösung nie als fertig an."
"1894","2012-05-24","internetbasiert","Ein Stück Wald für Staatspräsidentin von Costa Rica. 88Energie, 2012-05-24","https://www.88energie.de/ein-stueck-wald-fuer-staatspraesidentin-von-costa-rica-645887.html","Die Querdenker GmbH leistet mit ihren Aufforstungsprojekten BaumInvest und VisionsWald einen Beitrag zur Erreichung dieses Ziels."
"1895","2010-08-01","internetbasiert","Anregungen für gutes Gelingen. scorecard.de, 2010-08-01","http://www.scorecard.de/anregungen-fur-gutes-gelingen","Um auch neue Ideen und Gedanken aufzunehmen, haben wir zusätzlich drei jüngere Mitarbeiter hinzu gebeten, von denen wir annehmen, dass sie in einigen Jahren zu unserer Führungscrew gehören werden – Querdenker also."
"1896","2012-02-13","internetbasiert","Weiter IHK Vollversammlungsmitglied? NEIN – DANKE. Kammerspartakus, 2012-02-13","https://kammerspartakus.wordpress.com/2012/02/13/weiter-ihk-vollversammlungsmitglied-nein-danke/","Das könne er unmöglich mittragen, sagt Rosenheimer, der als Querdenker mit der Neigung zu klaren Worten und Wirtschaftsexperte in beiden Landkreisen hohes Ansehen genießt."
"1897","2012-12-31","internetbasiert","Silvester. Qu3Rdenker, 2012-12-31","https://qu3rdenker.wordpress.com/2012/12/31/silvester/","Verfasst von Jonathan Querdenker - Dezember 31, 2012 in Uncategorized"
"1898","2010-05-21","internetbasiert","Von Mitmachern, Mitdenkern und Querdenkern. entscheiderblog.de, 2010-05-21","https://entscheiderblog.de/von-mitmachern-mitdenkern-und-querdenkern/","Denn der Querdenker ist seinem Chef meistens haushoch überlegen und hat keine Scheu das auch durchblicken zu lassen."
"1899","2012-08-17","internetbasiert","…und gewonnen hat (Auflösung Sommerrätsel):. blogs.nmz.de, 2012-08-17","http://blogs.nmz.de/badblog/2012/08/17/und-gewonnen-hat-auflosung-sommerratsel/","Rihms Freund – der legendäre SLOTERDIJK, oberster Philosoph und Querdenker der Generation Golf."
"1900","2010-04-11","internetbasiert","Mitwirkende 2010. buendische-akademie.de, 2010-04-11","http://www.buendische-akademie.de/wordpress/dokumentation/dokumentation-2010/mitwirkende/","Alexander Maria Faßbender ist Querdenker und kreativer Umsetzer, Experte für mehr Handlungsfähigkeit und Chancen-Checker – mit ihm finden Menschen ihre Chancen."
"1901","2012-12-08","internetbasiert","Samstag: Rote, Teufel, Sakramente – gute eBooks kostenlos! › xtme: gute eBooks. Xtme: Gute Ebooks, 2012-12-08","http://www.xtme.de/2012/12/samstag-rote-teufel-sakramente-gute-ebooks-kostenlos/","„Alexander Peters, ein Querdenker mit ausgeprägtem Gerechtigkeitssinn und recht freizügiger Mundart, übernimmt einen Job bei einem Entwicklungshelfer als Projektberater und Berufschullehrer in den Vereinigten Arabischen Emiraten …“ – Cardigan schreibt „keine weichgespülten Kitschromane, sondern eine realistische Beschreibung von Abend- und Morgenland mit großem Verständnis für die fremde Kultur und einem leidenschaftlichen Plädoyer für mehr Verständnis und Menschlichkeit“."
"1902","2011-07-27","internetbasiert","Verbaut die Kirche ihre Zukunft? | chrismonshop. Chrismonshop, 2011-07-27","http://www.chrismonshop.de/verbaut-die-kirche-ihre-zukunft-1147.html","Er erweist sich als scharfsinniger Querdenker,... weiterlesen"
"1903","2012-09-14","internetbasiert","Wenn aus Quertreibern Staatsfeinde werden » Von Frank Meyer. rottmeyer.de, 2012-09-14","http://www.rottmeyer.de/wenn-aus-quertreibern-staatsfeinde-werden/","Querdenker wäre angemessen."
"1904","2011-08-04","internetbasiert","Fünf Bücher von Klaus Kocks – Das Blog zum Lesen. Fünf Bücher: Das Blog zum Lesen, 2011-08-04","https://fuenfbuecher.de/56-fuenf-buecher-von-klaus-kocks/","Er kultiviert das Image des Querdenkers und Privatgelehrten, obwohl er ein ganz normaler Berater-Sklave in der Galeere seiner Agentur ist: rudern, rudern, rudern…"
"1905","2010-08-11","internetbasiert","Weil’s „so schön“ war … noch was zum Nationalismus der BRD. Adalberts Meckerecke, 2010-08-11","https://adalbertnaumann.wordpress.com/2010/08/11/weil%e2%80%99s-%e2%80%9eso-schon%e2%80%9c-war-%e2%80%a6-noch-was-zum-nationalismus-der-brd-2/","Während Sie es tun, sollten sie sich auch in Erinnerung rufen, wie viele „Verschwörungstheoretiker“ (kritische Selbst- und Querdenker – zur Definition bitte mal beim Kollegen Markus Göllner nachschauen => Klick) davor gewarnt hatten, dass der Vertrag von Lissabon u. a. auch dem Ziel gewidmet war, einem nicht demokratisch legitimierten Pseudo-Staatsgebilde auf Schleichwegen doch zu völkerrechtlicher Anerkennung zu verhelfen."
"1906","2011-01-17","internetbasiert","Renovierung Schloß Hammerstein. Mein-Maler.de, 2011-01-17","https://www.mein-maler.de/renovierung-schloss-hammerstein/","Ihr Querdenker und Kreativkopf"
"1907","2011-05-27","internetbasiert","Frauen an die Macht. {Luvb}Rain, 2011-05-27","https://dollybovarro.wordpress.com/2011/05/27/frauen-an-die-macht/","es gibt immer querdenker"
"1908","2011-10-20","internetbasiert","Kritische Stimmenzur Relativitätstheorie. kritik, relativitätstheorie, G.O., mueller, gom, projekt, ekkehard, friebe, jocelyne, lopez, 2011-10-20","http://www.kritik-relativitaetstheorie.de/2011/10/christian-geyer-kritisiert-im-faz-den-mangel-an-tabubrecher/","Im Sinne solcher Diskussionen rufen unsere Geistesgrößen und Führergestalten in regelmäßigen Abständen öffentlich händeringend nach “Querdenkern”."
"1909","2011-01-03","internetbasiert","CYNX – Der Netzmensch. fandomobserver.de, 2011-01-03","http://www.fandomobserver.de/2011/01/der-netzmensch/","Cynx beschreibt sich und seine Interessen: EduPunk, Gonzo Journalist, Sauerländer, Physiker, Programmierer, Cyberpunk, Skandinavienfan, Hacker, Buchsammler, Genussmensch, Kampfsportler, Hedonist, Geek, Pfeifenraucher, Armchair Adventurer, Steampunk, Querdenker, Klingenfetischist, Pfadfinder, Rollenspieler, Reenactor, Whiskytrinker, Fanboy, Waldgänger, Transhumanist, Maker, ZX81, C64, Atari ST, DFÜ, Fido, First Mail 1993, WWW seit 1995, Blogger seit 2003, CCC, Pirat, DIY, elektronische Musik, Folk, Metal, Cabaret, Burlesque"
"1910","2012-02-26","internetbasiert","Wie sich der linke Flügel der SPD eine erneuerte Demokratie vorstellt. Exportabel, 2012-02-26","https://exportabel.wordpress.com/2012/02/26/wie-sich-der-linke-flugel-der-spd-eine-erneuerte-demokratie-vorstellt/","Ich würde Gauck ja noch am ehesten zugute halten, dass er sich zu so etwas wie einem produktiven Querdenker entwickeln könnte, nicht im handelsüblichen Sinn des Begriffs, dass man rechte Positionen ausspricht und sich dann als Tabubrecher feiern lässt, sondern dass er einer gewissen Aufgeregtheit des politischen Betriebs, der gerne in Schubladen sortiert, entgegentritt, weil er nicht zur politischen Klasse im engeren Sinn gehört."
"1911","2010-03-19","internetbasiert","Medienforum NRW 2010: Originelle Konzepte brauchen Querdenker/-innen - coaching-blogger. Coaching-Blogger, 2010-03-19","http://www.coaching-blogger.de/2010/03/19/medienforum-nrw-2010-originelle-medienkonzepte-brauchen-querdenker-pionier-coaching-fur-den-kreativen-kick-kostprobe-fur-mutige/","Medienforum NRW 2010: Originelle Konzepte brauchen Querdenker/-innen"
"1912","2010-08-24","internetbasiert","Standing Ovations!. Denkquer'S Blog, 2010-08-24","https://denkquer.wordpress.com/2010/08/24/standing-ovations/","Der visionäre Querdenker, der mit Energie geladene Macher, der wortgewaltige Kommunikator, der Provokateur."
"1913","2011-03-18","internetbasiert","Stromrebellen pflanzen Regenwald. 88Energie, 2011-03-18","https://www.88energie.de/stromrebellen-pflanzen-regenwald-369985.html","Der VisionsWald ist ein unternehmerisches Modellprojekt, initiiert von der Freiburger Firma Querdenker GmbH."
"1914","2012-05-28","internetbasiert","Ludwig Greven. Quersatz, 2012-05-28","https://quersatz.wordpress.com/about/","Ich bin sehr erfahrener, recherche- und meinungsstarker, völlig unabhängiger Journalist, Publizist, Kolumnist, Essayist, Buchautor, Blogger, Dozent für polit. Journalismus und Querdenker, manchmal Querkopf."
"1915","2011-04-12","internetbasiert","Wir könnte die Zusammenarbeit in Netzwerkprojekten grob geregelt werden ?. onlinetechniker.de, 2011-04-12","http://onlinetechniker.de/?q=content%2Fwir-k%C3%B6nnte-die-zusammenarbeit-netzwerkprojekten-grob-geregelt-werden","Warum können große Gruppen keine großen Änderungen realisieren, warum brauchen wir dazu einzelne Querdenker ?"
"1916","2011-12-01","internetbasiert","Lifestyle Hospitality & Entertainment Group ist Finalist beim Querdenker Award des Querdenker Club | online zeitung. Online Zeitung, 2011-12-01","http://online-zeitung.de/2011/12/01/lifestyle-hospitality-entertainment-group-ist-finalist-beim-querdenker-award-des-querdenker-club/","Die Lifestyle Hospitality & Entertainment Group (LH&E) hat eine Platzierung unter den top fünf Finalisten beim Querdenker Award des Querdenker Club in der Kategorie Start-Up Unternehmen erreicht."
"1917","2011-09-30","internetbasiert","Rettungsschirm für Rede- und Gewissensfreiheit. 99 Thesen, 2011-09-30","https://99thesen.com/2011/09/30/rettungsschirm-fur-rede-und-gewissensfreiheit/","Somit wollten die Fraktionsführungen eine eigentlich dringend notwendige sachliche Diskussion über Für und Wider im Parlament verhindern und die Rede- und Gewissensfreiheit des einzelnen Abgeordneten einschränken: so macht man heute Machtpolitik: unbequeme Argumente, unbequeme Querdenker sollen keine Redezeit, keine Öffentlichkeit erhalten!"
"1918","2012-08-03","internetbasiert","Mut-Forscher gesucht!. Mafolution, 2012-08-03","http://mafolution.de/2012/08/mut-forscher-gesucht/","‘Fördere Rebellen und Querdenker!"
"1919","2010-03-29","internetbasiert","March, 2010. finn-johannsen.de, 2010-03-29","http://finn-johannsen.de/2010/03/","Solchen Querdenkern und Querulanten kann man nicht genug Respekt bezollen."
"1920","2012-05-06","internetbasiert","Gefragt: Querdenker | online zeitung. Online Zeitung, 2012-05-06","http://online-zeitung.de/2012/05/06/gefragt-querdenker/","Und natürlich hat ein solches berufsbegleitendes Studium eines Querdenkers auch für den Arbeitgeber Vorteile, weil das Know-How seinem Unternehmen zugute kommt."
"1921","2011-01-18","internetbasiert","Im Interview – Malerheyse heißt seine Kunden herzlich willkommen. Malerblog - Malerarbeiten Hannover, 2011-01-18","http://blog.maler-heyse.de/2011/01/18/im-interview-malerheyse-heist-seine-kunden-herzlich-willkommen/","Was mir bei Ihnen, Herrn Schultze, besonders aufgefallen ist, dass Sie sich als Querdenker, Vordenker, Impulsgeber und Ideenkopf bezeichnen."
"1922","2011-05-08","internetbasiert","Über die Märkte und das Vertrauen. nachrichtenspiegel.de, 2011-05-08","http://www.nachrichtenspiegel.de/2011/05/08/uber-die-markte-und-das-vertrauen/","Diese Frage ist sehr interessant, weil es ja unter den Analysten selbst kritische Querdenker wie den ""Mr. Dax"" Dirk Müller gibt, die das Geschehen an den Märkten zum Teil aufs Schärfste verurteilen, aber andererseits nie zugeben würden, dass diese Märkte, auf denen Preise für Währungen, Staatsanleihen und Rohstoffe scheinbar objektiv gebildet werden, überflüssig seien."
"1923","2010-01-27","internetbasiert","Doc Blog. doc-sarah-schons.de, 2010-01-27","http://www.doc-sarah-schons.de/blog/2010/01/querdenker-titelschutz-und-das-dpma-schilda-live/","Die Hauptsoap -und deswegen Eure Kommentare bitte auch dort- gibts aber nach wie vor bei den Querdenkern von Innovativ-in – und natürlich als hashtag #querdenker bei twitter, woselbst das Haus des Markeninhabers inzwischen auch aktiv geworden ist…"
"1924","2010-01-27","internetbasiert","» Marke Querdenker. wmwllp.de, 2010-01-27","http://www.wmwllp.de/berlinblawg/querdenker/","Mit großem Interesse verfolge ich den Streit um die (Wort-)Marke Querdenker in dem Blog innovativ.in.de."
"1925","2010-11-28","internetbasiert","Groß werden. Aloquence, 2010-11-28","https://aloquence.wordpress.com/2010/11/28/gros-werden/","Querdenker sind eine Gefahr für sie und ihre Macht."
"1926","2012-03-14","internetbasiert","NRW steht vor Neuwahlen. Sweetkoffie's Blog, 2012-03-14","https://sweetkoffie.wordpress.com/2012/03/14/nrw-steht-vor-neuwahlen/","Mag sein, dass auch die eckigsten Querdenker in der Politik erst in änderungsfähige Positionen gelangen, wenn sie rund geschliffen sind (was in der FDP erschreckend schnell zu funktionieren scheint, wenn man sich die Führungsriege anschaut)."
"1927","2011-01-27","internetbasiert","Blog – Jocelyne Lopez. Jocelyne Lopez, 2011-01-27","http://www.jocelyne-lopez.de/blog/2011/01/die-dada-mathematik-der-relativitatstheorie-teil-2/","Wenn man aber doch ein bisschen Querdenker ist, fragt man sich, wo die verschiedenen definierten Geschwindigkeiten der Beobachter v1, v2 und v3 überhaupt bei der Ausrechnung geblieben sind:"
"1928","2011-10-24","internetbasiert","Unternehmensgründung in nur 48 Stunden: Startup-Weekend der OSBF in Nürnberg | online zeitung. Online Zeitung, 2011-10-24","http://online-zeitung.de/2011/10/24/unternehmensgrundung-in-nur-48-stunden-startup-weekend-der-osbf-in-nurnberg/","Das Konzept des Startup Weekend entspricht dabei ganz dem der Open Source Prinzipien: eine Community, die sich selbstständig organisiert und ein für alle offenes Projekt, in das jeder sein Know-how einbringt”, skizziert Stefan Probst, Initiator des Startup Weekend Nürnberg und OSBF-Vorstandsmitglied, das ehrgeizige Projekt für Querdenker, Visionäre und Daniel Düsentriebs."
"1929","2012-03-04","internetbasiert","Ron Paul – Revolution 2012 oder doch nur eine weitere Illuminati Marionette?. Unsere korrupte Welt, 2012-03-04","https://unserekorruptewelt.wordpress.com/2012/03/04/ron-paul-revolution-2012-oder-doch-nur-eine-weitere-illuminati-marionette/","Es ist sehr Wahrscheinlich, dass er als Querdenker einfach aus dem Weg geräumt wurde zumal die Einzelattentäter Verschwörungstheorie dahinter genau so dünn ist wie die Verschwörungstheorie zu 911, bei dem ein schwer kranker O.b.L. für die mit wissenschaftlicher Präzision durchgeführten Sprengungen der drei WTC -Türme zuständig gewesen sein soll, was ja nun reichlich wiederlegt wurde und doch nicht von den Medien akzeptiert wird."
"1930","2011-04-17","internetbasiert","Gab es HAARP schon zu Cäsars Zeiten?. unzensiert.zeitgeist-online.de, 2011-04-17","http://unzensiert.zeitgeist-online.de/2011/04/17/gab-es-haarp-schon-zu-casars-zeiten/","Ich stimme mit vielen Aussagen des Artikels nicht überein, halte das Werk aber trotzdem für lesenswert, weil es sehr ausführlich die Techniken beschreibt, mit denen Frei- und Querdenker diskreditiert und mundtot gemacht werden."
"1931","2011-04-20","internetbasiert","» BPatG, Beschluss v. 09.02.2011 – 29 W (pat) 208/10–“Löschung der Marke Querdenker wegen fehlender Unterscheidungskraft nach § 8 Abs. 2 Nr. 1 MarkenG”. BPatG, Beschluss v. 09.02.2011 – 29 W (pat) 208/10–“Löschung der Marke Querdenker wegen fehlender Un...","http://www.wmwllp.de/berlinblawg/urteile/markenrecht/bpatg-29-w-pat-208-10/","Aus den tatsächlichen Feststellungen des Amtes ergäbe sich auch, dass der Begriff “Querdenker” in zahlreichen unterschiedlichen Zusammenhängen beschreibend verwendet werde, und zwar nicht nur von der Markeninhaberin (vgl. Anlagen 1 – 19 zum o. g. Beschluss, BI."
"1932","2012-12-05","internetbasiert","Senior Experte (w/m) SAP Logistik, Vertrieb oder Service. IT Business Excellence Blog, 2012-12-05","https://rnoll.wordpress.com/2012/12/05/senior-experte-wm-sap-logistik-vertrieb-oder-service/","Sie sind Experte, Querdenker, ein unangepasster, wissbegieriger und mutiger Mensch und finden sich in diesen Aufgaben"
"1933","2011-03-04","internetbasiert","Bonn: Opus E.L.F.: Sondermeier steuert das Narrenschiff in die Bonner Oper. Bonn: Opus E.L.F.: Sondermeier steuert das Narrenschiff in die Bonner Oper, 2011-03-04","http://www.bonner-presseblog.de/stadt-bonn/bonn-opus-e-l-f-sondermeier-steuert-das-narrenschiff-in-die-bonner-oper","Im Jahr 2011 lädt der kölsche Querdenker zur Betrachtung der Narrenzahl elf ein."
"1934","2011-04-25","internetbasiert","BPatG: Löschung der Marke Querdenker wegen fehlender Unterscheidungskraft Beschluss vom 09.02.2011 – 29 W (pat) 208/10 - markenmagazin:recht. Markenmagazin:Recht, 2011-04-25","http://www.markenmagazin.de/bpatg-loeschung-der-marke-querdenker-wegen-fehlender-unterscheidungskraft-beschluss-vom-09-02-2011-29-w-pat-20810/","Insoweit werden die angesprochenen Verkehrskreise in dem Begriff “Querdenker” einen Sachhinweis auf die Art und Weise der Werbe- bzw. Beratungsdienstleistungen sehen, nämlich, dass es sich um ungewohnte, neuartige Werbemaßnahmen bzw. innovative, unorthodoxe Beratungsmethoden im Marketingbereich handeln kann."
"1935","2011-05-03","internetbasiert","Erfolgreich verkaufen!. Weinakademie Berlin, 2011-05-03","http://www.weinakademie-berlin.de/erfolgreich-verkaufen","Dirk van der Niepoort – einer der innovativsten und erfolgreichsten Weinmacher Portugals. Querdenker"
"1936","2012-12-05","internetbasiert","Bringt bei, was interessiert, nützt oder fesselt! Über Schwarze Löcher, Dinos, Ritter und Smartphones. Initiative Wirtschaftsdemokratie, 2012-12-05","https://wirdemo.wordpress.com/2012/12/05/bringt-bei-was-interessiert-nutzt-oder-fesselt-uber-schwarze-locher-dinos-ritter-und-smartphones/","Heute hat mir der Querdenker und ehemalige Cheftechnologe der IBM, Prof."
"1937","2012-11-26","internetbasiert","Citizen Times. pressefreiheit.biz, 2012-11-26","http://www.pressefreiheit.biz/medien/citizen-times/","Im Stil einer klassischen Monatszeitschrift erscheinen wöchentlich zwei bis vier Artikel, vor allem Essays zu gesellschaftlichen und politischen Entwicklungen, Rezensionen zu wichtigen Büchern, Interviews mit Vor- und Querdenkern sowie Debattenbeiträge zu aktuellen Diskussionen."
"1938","2011-09-25","internetbasiert","Deutsche Post AG mobbt Ausländer. Die-aktuelle-Antimobbingrundschau, 2011-09-25","https://dieaktuelleantimobbingrundschau.wordpress.com/2011/09/25/deutsche-post-ag-mobbt-auslander/","Ein Paradies auf Erden, wenn da nicht so ein paar Journalisten und “Querdenker” wären und Bürger, die meinen, sie haben Anspruch auf das Postgeheimnis, ihr Stimme zur Wahl und die Bankkarte für ihr Konto."
"1939","2011-04-13","internetbasiert","Hinweise des Tages - www.NachDenkSeiten.de. NachDenkSeiten, 2011-04-13","http://www.nachdenkseiten.de/www.nachdenkseiten.de/?p=9057","Junge Ökonomen – „Den Job bekommt der Karrierist, nicht der Querdenker Drei Typen bevölkern die Wirtschaftswissenschaften: Karrieristen, Freizeit-Könige und eine Handvoll Idealisten."
"1940","2012-03-07","internetbasiert","Diesel: Italienische Jeans mit perfekter Passform - jeans-blog.eu. DenimMagazin.net, 2012-03-07","https://jeans-blog.eu/diesel-italienische-jeans-mit-perfekter-passform/","Diesel ist auf Grund des ausgefallen Designs zum Querdenker in der Mode- Szene geworden, zur bunt- schrillen trendy Kultmarke, gleichermaßen aber auch gewissermaßen zum Anführer in der Mode- Welt in Sachen Style, Qualitätskontrolle und vertretbaren Herstellungsmethoden, gibt dem Kunden eine Garantie für hervorragende Produkte."
"1941","2011-04-25","internetbasiert","BPatG: Löschung der Marke Querdenker wegen fehlender Unterscheidungskraft Beschluss vom 09.02.2011 – 29 W (pat) 208/10 - markenmagazin:recht. Markenmagazin:Recht, 2011-04-25","http://www.markenmagazin.de/bpatg-loeschung-der-marke-querdenker-wegen-fehlender-unterscheidungskraft-beschluss-vom-09-02-2011-29-w-pat-20810/","2. Einer Eintragung des Wortzeichens “Querdenker” für die oben genannten Waren und Dienstleistungen stand bereits im Eintragungszeitpunkt das absolute Schutzhindernis der fehlenden Unterscheidungskraft nach § 8 Abs. 2 Nr. 1 MarkenG entgegen."
"1942","2010-09-14","internetbasiert","Bonn: Kommentar: Sarrazin auch kein ‚Linke’s Zäpfchen‘. bonner-presseblog.de, 2010-09-14","http://www.bonner-presseblog.de/bonn/bonn-sarrazin-auch-kein-linkes-zapfen","Der Querdenker wurde mehrfach als Verquerdenker geortet und beim Foulspiel erwischt."
"1943","2010-10-18","internetbasiert","Wer kennt den Weg nach oben?. Jobs.de Karriere-Tipps, 2010-10-18","http://tipps.jobs.de/wer-kennt-den-weg-nach-oben/","Querdenker gesucht!"
"1944","2010-02-03","internetbasiert","Denkfabrik. Welthungerhilfe, 2010-02-03","http://www.welthungerhilfe.de/denkfabrik-move.html","1. Denkfabrik - Searchers Unlimited Querdenker aus Kultur, Medien, Wirtschaft und Sport"
"1945","2010-11-06","internetbasiert","Wie soll der Think Tank funktionieren?. Praxis für psychologische Beratung, Coaching, Supervision, 2010-11-06","https://www.margit-nowotny.de/wie-soll-der-think-tank-funktionieren/","Querdenker sind in jedem Fall willkommen!"
