"No.","Date","Genre","Bibl","URL","Hit"
"1299","2010-04-22","internetbasiert","„S’Denkn dorf ma nia ondre ibrlossn!“. Vinschgerwind, 2010-04-22","https://vinschgerwind.wordpress.com/2010/04/22/%e2%80%9es%e2%80%99denkn-dorf-ma-nia-ondre-ibrlossn%e2%80%9c/","Jedoch hatten nur die wenigsten mit der Zielstrebigkeit, Zähigkeit und Ausdauer des Aussteigers und Querdenkers gerechnet."
"1300","2010-02-05","internetbasiert","R@SELFIEBER: Reise in die Schweiz zu gewinnen. Das Kreuzworträtsel Blog, 2010-02-05","https://kreuzwortblog.wordpress.com/2010/02/05/rselfieber-reise-in-die-schweiz-zu-gewinnen/","Alle Querdenker, die die Schiffsreise nach Norwegen vom ZEIT-Jubiläumsrätsel verpassen werden – also jeder außer ich selbst 😉 – bekommen im virtuellen Rätselheft eine neue Chance auf einen schönen Urlaub."
"1301","2010-07-12","internetbasiert","HEY-Ø-HANSEN – Austrodub für Querdenker. IrieItes.de, 2010-07-12","http://www.irieites.de/wordpress/?p=9984","HEY-Ø-HANSEN Austrodub für Querdenker, oder:"
"1302","2010-12-13","internetbasiert","Totschweigen oder lächerlich machen. Auf gut Deutsch!, 2010-12-13","https://andreasmoelzer.wordpress.com/2010/12/13/totschweigen-oder-lacherlich-machen/","Die Freiheitlichen sind immer schon ein Auffangbecken für Interessierte, gut Informierte, Intellektuelle und Querdenker gewesen, die in der Lage sind, sich der Verblödung durch die Massenmedien zu entziehen und selbst zu recherchieren, wer in dieser immer weiter fortschreitenden Diktatur (der ‘New World Order’) mächtig ist und wer nicht."
"1303","2012-12-31","internetbasiert","OFFENER BRIEF AN DEN PRÄSIDENTEN DER MAX PLANCK GESELLSCHAFT Professor Dr. Peter Gruß – bleibt, wie der Brief an Joachim Gauck, unbeantwortet ! Täterschutz !? auch in eigenen Reihen !??. AdamLauks Blog, 2012-12-31","https://adamlauks.com/2012/12/31/offener-brief-an-den-prasidenten-der-max-planck-gesellschaft/","Interessant ist auch, daß Querdenkern Berufsverbot erteilt wird."
"1304","2011-04-25","internetbasiert","BPatG: Löschung der Marke Querdenker wegen fehlender Unterscheidungskraft Beschluss vom 09.02.2011 – 29 W (pat) 208/10 - markenmagazin:recht. Markenmagazin:Recht, 2011-04-25","http://www.markenmagazin.de/bpatg-loeschung-der-marke-querdenker-wegen-fehlender-unterscheidungskraft-beschluss-vom-09-02-2011-29-w-pat-20810/","Die Bezeichnung “Querdenker” weise auch keine Mehrdeutigkeit auf."
"1305","2010-09-08","internetbasiert","Kein Text zu Thilo S.. Bandschublade, 2010-09-08","https://bandschublade.wordpress.com/2010/09/08/kein-text-zu-thilo-s/","Im amerikanischen Englisch bezeichnet “Maverick” einen Querdenker."
"1306","2010-12-20","internetbasiert","“Aufgaben von Schülern für Schüler”. absolutfamilie.de, 2010-12-20","http://www.absolutfamilie.de/2010/12/20/aufgaben-von-schulern-fur-schuler/","Das ist der Titel eines neuen Buches für junge Rechenkünstler und Querdenker."
"1307","2011-10-28","internetbasiert","""Obama will mich töten!"" - Gaddafis politisches Testament, ungekürzt. Deutsch sein ist kein Verbrechen!, 2011-10-28","https://nohoearmy.wordpress.com/2011/10/28/obama-will-mich-toeten-gaddafis-politisches-testament-ungekuerzt/","Ist wirklich sehr unverdächtig…^^ Lies mal das hier: http://www.tlaxcala-int.org/article.asp?reference=4430 – ist ein Querdenker und offenbar jemand, der nicht alles glaubt, was man ihm vorsetzt…"
"1308","2011-07-27","internetbasiert","2011 Roero Arneis DOCG -bio. #Indexmetacopyright#, 2011-07-27","http://shop.aromakost.de/weinkeller/italien/piemont/933/2011-roero-arneis-docg-bio","Ein Querdenker, ein Vordenker, dem der unverfälschte Sortencharakter und das Profil des Weinbergs wichtiger sind als gefällig gestylte Weine!"
"1309","2011-11-14","internetbasiert","Integrationspreis für Rapper Bushido. anselmneft.de, 2011-11-14","http://www.anselmneft.de/2011/11/14/integrationspreis-für-rapper-bushido/","Diese Querdenker sind da so flexibel wie Mama Merkel, die uns alle lieb hat und mühelos den Ausstieg vom Ausstieg vom Ausstieg verkündet, wenn sich plötzlich die Gesetze der Physik verändern, weil in Japan ein Kernkraftwerk havariert."
"1310","2011-11-09","internetbasiert","Querdenker, ein Definitionsversuch. Living the future, 2011-11-09","http://www.livingthefuture.de/2011/11/09/querdenker-ein-definitionsversuch/","Optimalerweise nutzt ein Querdenker bestehende Hierarchien um Verbündete zu finden, eine Lobby aufzubauen oder denjenigen zu aktivieren, der in der spezifischen Problemstellung der richtige ist."
"1311","2010-05-21","internetbasiert","Von Mitmachern, Mitdenkern und Querdenkern. Entscheiderblog, 2010-05-21","https://www.entscheiderblog.de/von-mitmachern-mitdenkern-und-querdenkern/","Querdenker"
"1312","2011-07-27","internetbasiert","Verbaut die Kirche ihre Zukunft? | chrismonshop. Chrismonshop, 2011-07-27","http://www.chrismonshop.de/verbaut-die-kirche-ihre-zukunft-1147.html","Er erweist sich als scharfsinniger Querdenker, der in einem Streitgespräch versucht, christlichen Glaubenswahrheiten auf den Grund zu gehen."
"1313","2012-03-28","internetbasiert","Am 30.03. um 19 Uhr im FREIfenster: Chris Moser: Die Kunst Widerstand zu leisten. Am 30.03. um 19 Uhr im FREIfenster: Chris Moser: Die Kunst Widerstand zu leisten, 2012-03-28","http://www.freirad.at/?p=4246","Die Kunst Widerstand zu leisten beleuchtet anhand der umfangreichen Gefängnisaufzeichnungen und den Bildern von Chris Moser diesen “größten Justizskandal der zweiten Republik” (SPÖ-Justizsprecher Jarolim) aus der Perspektive eines Querdenkers, Künstlers und Familienvaters, stets untermauert mit den Fakten aus dem über 200.000 Seiten starken Ermittlungsakt."
"1314","2012-04-30","internetbasiert","Trader, Querdenker und ein paar Tipps » Von Frank Meyer. rottmeyer.de, 2012-04-30","http://www.rottmeyer.de/trader-querdenker-und-ein-paar-tipps/","[…] Manfred Gburek: Trader, Querdenker und ein paar Tipps […]"
"1315","2010-12-10","internetbasiert","Mit VORARLBERG ONLINE zu Fazil Say. vol.at, 2010-12-10","http://www.vol.at/mit-vorarlberg-online-zu-fazil-say/news-20101210-09231376","Fazil Say ist ein Querdenker, einer, der gerne Grenzen überschreitet und dabei lustvoll Neues zelebriert."
"1316","2010-11-15","internetbasiert","Seitenhieb gegen den Seitenhieb. DenkNachMainz, 2010-11-15","https://denknachmainz.wordpress.com/2010/11/15/seitenhieb-gegen-den-seitenhieb/","Es mag natürlich sein, dass mir der literarische Anspruch der Kolumne zu hoch ist, dass mir das querdenkerische Potenzial trotz der schönen Konjunktive entgeht, dass ich, selbst Querdenker par excellence, die ersten Querdenker-Gehversuche von Möchtegernjournalisten nicht wirklich zu schätzen weiß, aber mir erscheint der Text als Zeugnis abgrundtiefer Dummheit."
"1317","2011-08-30","internetbasiert","Idealkandidat gesucht!. blog.menschen-im-vertrieb.at, 2011-08-30","http://blog.menschen-im-vertrieb.at/2011/08/30/idealkandidat-gesucht/","Jene Querdenker, die aus völlig anderen Branchen kommen, die eine Dynamik und Begeisterung für ihre Verkaufstätigkeit entwickeln, von der Sie nur träumen."
"1318","2012-10-18","internetbasiert","Ein Herz und eine Seele ist tot. Die Stadtbibliothek Köln Bloggt, 2012-10-18","https://stadtbibliothekkoeln.wordpress.com/2012/10/18/ein-herz-und-eine-seele-ist-tot/","Zur Erinnerung ein paar Sätze des Querdenkers:."
"1319","2012-10-26","internetbasiert","EM 2013: Deutschland, Schweden und Frankreich gesetzt. womensoccer.de, 2012-10-26","http://www.womensoccer.de/2012/10/26/em-2013-deutschland-schweden-und-frankreich-gesetzt/","Hier benutzen viele den Ausdruck „Querdenker“."
"1320","2010-08-31","internetbasiert","Thilo Sarrazin: Das Buch als «Stein d …». web-quantensprung.blogspot.com, 2010-08-31","http://web-quantensprung.blogspot.com/2010/08/thilo-sarrazin-das-buch-als-stein-d.html","Es gibt die Wertschätzung der 'Querdenker' in Wirklichkeit nur so lange, wie sie und die anderen Provokateure sich an die Regeln halten."
"1321","2010-01-05","internetbasiert","Ex-Fraktionschef gießt Wasser in den Wein der Liberalen. Aus Baden Und Für Badner, 2010-01-05","https://badnerblog.wordpress.com/2010/01/05/ex-fraktionschef-giest-wasser-in-den-wein-der-liberalen/","Sie hätte ihn gerne in den Wahlkampf eingebunden, sagt Homburger, die nun hofft, dass auf dem Parteitag nicht der Querdenker, sondern das erste Grundsatzprogramm der Südwest-FDP im Fokus steht."
"1322","2011-01-24","internetbasiert","Rezension: Destroyer – Kaputt. AUFTOUREN.DE, 2011-01-24","http://www.auftouren.de/2011/01/24/rezension-destroyer-kaputt/","Er gibt sich als Genießer, als Querdenker und die Aussage könnte kaum klarer sein: Destroyer ist erwachsen geworden und muss niemandem mehr etwas beweisen, muss es niemandem mehr recht machen nach seinem beneidenswerten Schaffen in den vergangenen 15 Jahren."
"1323","2011-01-08","internetbasiert","Innovation braucht Querdenker. Living the future, 2011-01-08","http://www.livingthefuture.de/2011/01/08/innovation-braucht-querdenker/","Und sollte ein Unternehmen sich entschließen, Innovation als eigene Aufgabe zu verankern tut es gut daran, sich gerade die Querdenker zu suchen."
"1324","2010-11-12","internetbasiert","Erfindergeist macht Schule - ingenieur.de. ingenieur.de - Jobbörse und Nachrichtenportal für Ingenieure, 2010-11-12","https://www.ingenieur.de/technik/fachbereiche/rekorde/erfindergeist-schule/","„Manchmal braucht man eben ‚Querdenker’, um zu neuen Lösungen zu kommen.“ M."
"1325","2010-09-27","internetbasiert","Falschmeldung?! Tod von Kurt Albert - Die Kletterlegende verstarb auf Grund seiner Verletzungen (tot) | Bergfotografie | Kletterfotografie. 0817.de, 2010-09-27","http://www.0817.de/2010/kurt-albert-nach-absturz-tot/","Mit Kurt verliert die deutsche Kletterszene einer ihrer herausragensten Leistungsträger, Querdenker und Persönlichkeiten."
"1326","2011-04-06","internetbasiert","theALPS 2011: Alpine Touristiker erwartet ein hochkarätiges Programm. Wordpressdotcom, 2011-04-06","https://ceb2011.wordpress.com/2011/04/06/thealps-2011-alpine-touristiker-erwartet-ein-hochkaratiges-programm/","Bei der Auftakt-Veranstaltung zu “theALPS” werden u.a. Arno Ebner, Vice President für das globale E-Business (Consumer Goods/B2C) von Swarovski, der aus Berlin stammende Internet-Pionier und Querdenker Sascha Lobo, sowie Georg Ziegler, Head of B2B Marketing der größten deutschsprachigen Bewertungsplattform HolidayCheck AG, und Karl Pall, Head of GOOGLE Austria, in dieser Form noch nie präsentierte Einblicke in die digitale Zukunft geben."
"1327","2011-05-03","internetbasiert","Querdenker – Kreativ, aber teamunfähig!. hafawo.at, 2011-05-03","http://www.hafawo.at/beruf-und-karriere/querdenker-kreativ-aber-teamunfaehig/","Querdenker – Kreativ, aber teamunfähig!"
"1328","2011-12-14","internetbasiert","Essay: Peter Münder über neue Philosophie-Magazine - CulturMag. CulturMag, 2011-12-14","http://culturmag.de/litmag/essay-peter-munder-uber-neue-philosophie-magazine-und-bucher/40857","Magazin für Querdenker"
"1329","2012-04-10","internetbasiert","Günter Grass: Nach dem Sturm. Auf'n'Kaffee mit Rolf Krüger, 2012-04-10","http://www.aufnkaffee.net/2012/04/gunter-grass-nach-dem-sturm/","Nur, weil man ein Querdenker ist, kann man trotzdem auch Blödsinn reden."
"1330","2012-02-12","internetbasiert","Los Holstos. Digital. Media. Lifestyle., 2012-02-12","http://www.los-holstos.de/2012/02/12/toggle/","Ein Querdenker, der die Welt verändern will."
"1331","2012-07-03","internetbasiert","Tipps für mehr Produktivität und Zufriedenheit. Zeitgewinn Hamburg, 2012-07-03","http://zeitgewinn-hamburg.de/tipps-fuer-mehr-produktivitaet-und-zufriedenheit-teil-3/","Als Querdenker mit breitem Interessengebiet glaubt er daran, dass Lernen im persönlichen wie organisatorischen Maßstab von Grenzüberschreitungen profitiert."
"1332","2010-10-13","internetbasiert","» DPMA, Beschluss v. 09.08.2010 – 304 22 150 – S 50/10 Lösch–“Löschung der Marke Querdenker” (noch nicht rechtskräftig). DPMA, Beschluss v. 09.08.2010 – 304 22 150 – S 50/10 Lösch–“Löschung der Marke Querdenker” (noch nicht rechtskräftig) | Von Dennis S...","http://www.wmwllp.de/berlinblawg/urteile/markenrecht/dpma-304-22-150-s-5010/","Der Begriff „ Querdenker "" sei gerade auch im Hinblick auf Unternehmensberatung mehrdeutig."
"1333","2011-04-15","internetbasiert","Appell gegen „Alternativlosigkeit“: Professor Dr. Klaus Töpfer mit dem Peter-Wust-Preis ausgezeichnet. Peter-Wust-Gesellschaft e.V., 2011-04-15","https://www.peter-wust-gesellschaft.de/appell-gegen-alternativlosigkeit-professor-dr-klaus-toepfer-mit-dem-peter-wust-preis-ausgezeichnet/","Töpfer sei dabei durchaus „kein Querdenker“ sondern ein „Geradeaus-Denker der seiner Überzeugung Rechnung trägt“, sagte Müller und bezeichnete den neuen Preisträger als „Vorbild“."
"1334","2010-07-25","internetbasiert","Neues aus Hammelburg. unzensiert.zeitgeist-online.de, 2010-07-25","https://unzensiert.zeitgeist-online.de/2010/07/25/fur-selberdenker/","Selbst- und Querdenker – zur Definition bitte mal beim Kollegen Markus Göllner nachschauen => Klick) davor gewarnt hatten, dass der Vertrag von Lissabon u. a. auch dem Ziel gewidmet war, einem nicht [...]"
"1335","2010-06-03","internetbasiert","Digital Touch. PAGE online, 2010-06-03","http://page-online.de/events/digital-touch-2/","Branchenübergreifend spricht sie alle Beteiligten aus unterschiedlichsten Themengebieten an: von Treiber und Experten, Unternehmer und Manager, Querdenker und junge Startup-Firmen."
"1336","2010-03-19","internetbasiert","Querdenker. Mamiwata, 2010-03-19","http://www.no-mads.de/myblog/querdenker/","Ich habe es der Zeitschrift „Halbstark“ entnommen, die heute der TAZ beilag und überaus interessant war, trug sie doch den Titel „Die Querdenker“."
"1337","2010-09-28","internetbasiert","Was Gutmenschen sagen.... Der Blog des Politologen, 2010-09-28","https://politologe.wordpress.com/2010/09/28/was-gutmenschen-sagen/","Respekt – das ist ein Querdenker!"
"1338","2011-11-09","internetbasiert","ZIIIRO | Superlevel. Superlevel, 2011-11-09","https://superlevel.de/spielkram/ziiiro/","Man wird zwar immer noch etwas schräg mit so einer Leuchtreklametafel am Arm angeguckt, doch damit muss man leben, wenn man als total individueller Querdenker über diesen Erdball schreitet."
"1339","2012-06-19","internetbasiert","Ein Paradigmenwechsel wird notwendig! | online zeitung. Online Zeitung, 2012-06-19","http://online-zeitung.de/2012/06/19/ein-paradigmenwechsel-wird-notwendig/","Denker, Querdenker und Vordenker kommen historisch aus Europa."
"1340","2010-10-13","internetbasiert","» DPMA, Beschluss v. 09.08.2010 – 304 22 150 – S 50/10 Lösch–“Löschung der Marke Querdenker” (noch nicht rechtskräftig). DPMA, Beschluss v. 09.08.2010 – 304 22 150 – S 50/10 Lösch–“Löschung der Marke Querdenker” (noch nicht rechtskräftig) | Von Dennis S...","http://www.wmwllp.de/berlinblawg/urteile/markenrecht/dpma-304-22-150-s-5010/","Die Markeninhaberin selber benutze den Begriff „ Querdenker "" rein beschreibend und entgegen der Markeneintragung in Großbuchstaben sowie in verschiedenen Wortkombinationen mit dem ®."
"1341","2012-09-18","internetbasiert","Neuigkeit des Tages: Helge Schneider bekommt eine eigene Talkshow!. /The Weekender!, 2012-09-18","https://weekenderonline.wordpress.com/2012/09/18/neuigkeit-des-tages-helge-schneider-bekommt-eine-eigene-talkshow/","Zu Gast zum Musizieren und Reden werden, laut WDR-Homepage Künstler, Querdenker und gute Freunde sein."
"1342","2011-03-28","internetbasiert","Abschied von Kewil. Das ist der Titel des Blogs, 2011-03-28","https://aaaaasas.wordpress.com/2011/03/28/abschied-von-kewil/","Gute Nacht, Ihr Toren, politischen Geisterfahrer, neoliberale Fanatiker, kryptonationalsozialistische Utopisten, basisdemokratische Randsteinbiesler, besoffene Kryptoquerfrontler, verprellte Christsoziale und Christdemokraten, Libertäre, Querdenker, Querulanten, Mondsüchtige und -gläubige, Anomalisten, Skeptiker, Atheisten, Islamkritiker, usw."
"1343","2012-04-24","internetbasiert","Turmbau zu Bregenz. vol.at, 2012-04-24","http://www.vol.at/turmbau-zu-bregenz/3231537","„Für eine städtebaulich dienliche Entwicklung muss man manchmal über den Tellerrand blicken und Querdenker zulassen.“"
"1344","2010-05-21","internetbasiert","Von Mitmachern, Mitdenkern und Querdenkern. Entscheiderblog, 2010-05-21","https://www.entscheiderblog.de/von-mitmachern-mitdenkern-und-querdenkern/","Gelingt das, brauchen wir auch nicht mehr vom Querdenker zu sprechen."
"1345","2011-11-24","internetbasiert","Die Intelligenz unseres Körpers. Jean-Paul Pianta D.C., 2011-11-24","http://www.jppianta.de/shop/buecher/die-intelligenz-unseres-koerpers/","Pianta, ein brillanter Querdenker ohne Querulanz und Larmoyanz, vernetzt Fakten, Theorien und neues Denken zu einem faszinierenden Blick hinter die Kulissen unseres menschlichen Seins und Werdens."""
"1346","2012-11-23","internetbasiert","accessec auf Job-Tournee 2012: IT-Talente gesucht! | online zeitung. Online Zeitung, 2012-11-23","http://online-zeitung.de/2012/11/23/accessec-auf-job-tournee-2012-it-talente-gesucht/","Das Unternehmen beschäftigt eine wachsende Anzahl von „Querdenkern“, die außerhalb konventioneller Bahnen denken."
"1347","2010-07-21","internetbasiert","Spiritual Bouquet for the pope. weihrauchschnueffler.blogspot.com, 2010-07-21","http://weihrauchschnueffler.blogspot.com/2010/07/spiritual-bouquet-for-pope.html","[...] Mary's Land vor 6 Jahren Ecce, Sponsus venit Fashion And Beauty Survival Tips For You To Use Now! vor 6 Jahren FREYSING Das neue Jahr vor 6 Jahren Non Draco Sit Mihi Dux Wo der Schamanismus in die Kirche Einzug hält... vor 6 Jahren medio in mundo Jetzt als #Download: Katholikentagszeitung #kt16 vor 7 Jahren Kreuz & Querdenker Die Bundespräsidentenwahl – meine Bilanz vor 7 Jahren Vacate et Videte Mythen der deutschen Linken in Sachen Einwanderung und Integration vor 7 Jahren REFEKTORIUM Photo Artis Hot Indonesia '80s VS Hot Artists Present vor 7 Jahren tagebuch eines landpfarrers II ""Dieses Fest wird ein Trost sein für die ganze Welt vor 7 Jahren Zeichen und Zeugnis Top Tips And Techniques To Polish Your Woodworking Skills vor 7 Jahren Ad deum Zentralkomitee der deutschen Katholiken geht auf Distanz zur katholischen Sexuallehre vor 8 Jahren Aus dem Leben eines Ordensmanns Mengatasi Maag Kronis vor 8 Jahren Klosterneuburger Marginalien Ende hier,... vor 8 Jahren Epistulae Tiberii Demonstration gegen Praenatest der Lifecodexx AG vor 8 Jahren Jesum habemus socium » # 15 Die Prophetin der Endzeit (Gedanken vom Hochfest des Karmel) Confessions vor 9 Jahren OP-Jugend [...]"
"1348","2010-03-14","internetbasiert","Die Gewalt steckt verborgen wie der Teufel im System (und hat System?). Der AmSeL-Gedanke Plus = Gemeinschaft, 2010-03-14","https://moltaweto.wordpress.com/2010/03/14/die-gewalt-steckt-verborgen-wie-der-teufel-im-system-und-hat-system/","„…und jeder Individualist oder Querdenker gnadenlos ausgesiebt wird“"
"1349","2012-10-17","internetbasiert","Was ist die große Aufgabe, die jetzt ansteht und was können wir diesbezüglich aus der Geschichte lernen ?. onlinetechniker.de, 2012-10-17","http://onlinetechniker.de/?q=content%2Fwas-ist-die-gro%C3%9Fe-aufgabe-die-jetzt-ansteht-und-was-k%C3%B6nnen-wir-diesbez%C3%BCglich-aus-der-geschic","Warum können große Gruppen keine großen Änderungen realisieren, warum brauchen wir dazu einzelne Querdenker ?"
"1350","2012-11-12","internetbasiert","Das Lodern von innen - MATUSSEK!. MATUSSEK!, 2012-11-12","https://www.matthias-matussek.de/das-lodern-von-innen/","Querdenker können so anarchische und grundsätzliche Forderungen stellen wie Petrus mit seinem pfingstlichen “Kehrt um und tut Buße”."
"1351","2011-10-17","internetbasiert","Antworten Antworten abbrechen. blog.malik-management.com, 2011-10-17","https://blog.malik-management.com/2011/10/deflations-kenntnisse-gegen-null/","Dafür benötigen wir aber ganz andere Bildungsinstitutionen und mehr Querdenker Ihres Kalibers."
"1352","2012-12-19","internetbasiert","AZM #020 Ideen und Ziele tatsächlich erreichen - diese EINE Methode reicht dazu aus • GlüXX-Factory.de. GlüXX-Factory.de, 2012-12-19","https://www.gluexx-factory.de/azm-020-ideen-und-ziele-tatsaechlich-erreichen-diese-eine-methode-reicht-dazu-aus/","Unter dem Kürzel AZM (Abenteuer Zeitmanagement) erwarten Sie regelmäßige Tipps und Methoden, wie Sie als Kreativer Chaot, als Querdenker, als Scanner, als Polypotential mehr Ruhe und Gelassenheit in Ihren Alltag bekommen und somit ein glückliches und erfülltes Leben leben (statt ein gefülltes )."
"1353","2012-01-11","internetbasiert","Reading ‘the list of the deleted distinctions’ as #NegativeLanguage (Gotthard Gunther). Sinnsysteme, 2012-01-11","http://www.sinnsysteme.de/reading-the-list-of-the-deleted-distinctions-as-negativelanguage-gotthard-gunther-2/","Rebellen, Querdenker, Hofnarren benutzen sie gerne."
"1354","2011-11-30","internetbasiert","Erst der Sekt? Dann der Eklat?. Radio machen, 2011-11-30","https://www.radio-machen.de/2011/11/30/erst-der-sekt-dann-der-eklat/","Es hat ‚Lachs mit Zweierlei aus Roter Beete und Meerrettich‘ gegeben und Zweifel daran, ob Til Schweiger wirklich ein Querdenker ist.“"
"1355","2012-07-29","internetbasiert","11 Tipps einer Innovationsbremse. FÖHR, 2012-07-29","http://tanjafoehr.com/2012/07/29/11-tipps-einer-innovationsbremse/","6. Achten Sie bei Punkt 5 darauf keine Querdenker einzustellen."
"1356","2010-10-06","internetbasiert","fährfrau mit ♥. Dietauschlade, 2010-10-06","https://dietauschlade.wordpress.com/2010/10/06/fahrfrau-mit-%e2%99%a5/","By: querDenker mit ♥ « dieTauschlade on 16 Oktober 2011"
"1357","2011-05-25","internetbasiert","Kreative PR – und Marketingkonzepte für den Mittelstand: Teil 1-5 mit Malerfachbetrieb Heyse. Malerblog - Malerarbeiten Hannover, 2011-05-25","http://blog.maler-heyse.de/2011/05/25/kreative-pr-und-marketingkonzepte-fur-den-mittelstand-teil-1-5-mit-malerfachbetrieb-heyse/","Xing hingegen dient wiederum als reine Kontakt-Businessplattform, die wir als Kontaktquelle zu Entscheidern, Querdenkern, und Schlüsselpersonen pflegen."
"1358","2011-05-06","internetbasiert","Von Romeo an Julia.. The Sentinel, 2011-05-06","https://xflipside.wordpress.com/2011/05/06/von-romeo-an-julia/","Was macht es für den Philosophen, den Querdenker, dem kleinen Rebellen und Träumer so schmackhaft, über eine derartige Thematik überhaupt nachzudenken?"
"1359","2011-12-12","internetbasiert","Querdenker: Fähigkeit zur Innovation als wesentlicher Erfolgsfaktor. innovators-guide.ch, 2011-12-12","https://innovators-guide.ch/2011/12/querdenker-fahigkeit-zur-innovation-als-wesentlicher-erfolgsfaktor/","Ziel ist es, das externe kreative Innovationspotenzial der Kunden, Mitarbeiter und aller 260.000 QUERDENKER zu nutzen, um den Zugang zu Informationen für die Lösung des Problems zu erweitern und das Risiko in Innovationen zu minimieren."
"1360","2011-05-01","internetbasiert","Querdenken im Geo Magazin. Querdenken, 2011-05-01","https://querdenke.wordpress.com/2011/05/01/querdenken-im-geo-magazin/","“Wir alle lieben Querdenker – wenn sie seit mindestens 50 Jahren tot sind”."
"1361","2012-06-12","internetbasiert","Einfach machen: neue Webseite von LiNKiT Consulting | online zeitung. Online Zeitung, 2012-06-12","http://online-zeitung.de/2012/06/12/einfach-machen-neue-webseite-von-linkit-consulting/","Auf der Webseite erfahren “Querdenker, Brückenbauer und Innovatoren” alles über Karrieremöglichkeiten."
"1362","2012-10-06","internetbasiert","Blog – Jocelyne Lopez. Jocelyne Lopez, 2012-10-06","http://www.jocelyne-lopez.de/blog/2012/10/die-bloggerin-carolin-liefke-und-schmahkritik-uber-jocelyne-lopez/","Die “Diskussion” hier zeigt ja: Wie eingangs schon von Florian erwähnt, gibt es auf der einen Seite harmlose Querdenker wie den Philosophen oder Fred, auf der anderen Seite aber auch solche, die man guten Gewissens als besessen in fortgeschrittenem Zustand beschreiben kann."
"1363","2011-08-05","internetbasiert","Querdenken VII – Brich Tabus!. Querdenken, 2011-08-05","https://querdenke.wordpress.com/2011/08/05/querdenken-vii-brich-tabus/","In Politik und Gesellschaft bezeichnet man jemanden, der Tabus bricht, gern als Querdenker."
"1364","2012-02-28","internetbasiert","Verbotene Archäologie oder das erfundene Mittelalter. UFO-Erscheinungen, 2012-02-28","https://ufoerscheinungen.forumieren.com/t750-verbotene-archaologie-oder-das-erfundene-mittelalter","Geniale Querdenker gibt es auch unter den sogenannten Laien."
"1365","2010-02-09","internetbasiert","Hallo Welt!. QUERdenken, 2010-02-09","https://querdenken2010.wordpress.com/hallo-welt-2/","QUERdenker"
"1366","2011-10-06","internetbasiert","Unsterblicher Steve Jobs. MacCoach, 2011-10-06","https://maccoach.wordpress.com/2011/10/06/unsterblicher-steve-jobs/","Er wird für immer der Botschafter für exzellentes Design, großartiges Marketing und hervorragende Querdenker sein."
"1367","2010-07-01","internetbasiert","Unterstützer:innen. demokratie-waehlen.de, 2010-07-01","https://demokratie-waehlen.de/unterstuetzerinnen/","Anne Kahn Querdenker verhöhnen Widerstand ANPI Frankfurt am Main Wir mussten Demokratie hart erkämpfen – bewahrt sie!"
"1368","2011-12-29","internetbasiert","The Thrive - Die Querdenker Version. Goldständer, 2011-12-29","https://goldstaender.wordpress.com/2011/12/29/the-thrieve-die-querdenker-version/","Deshalb hier die Thrive Version für alle Querdenker."
"1369","2010-12-11","internetbasiert","Team | Qualität ist eine Team-Aufgabe, Führen heißt Coachen. Rupp, 2010-12-11","https://www.rupp-spritzguss.de/team/","Ein Team, dass nur aus kreativen Querdenkern besteht wird ebenso wenig Erfolg haben, wie ein Team, das sich nur aus kritischen Köpfen zusammensetzt."
