"No.","Date","Genre","Bibl","URL","Hit"
"654","2010-01-27","internetbasiert","Doc Blog. doc-sarah-schons.de, 2010-01-27","http://www.doc-sarah-schons.de/blog/2010/01/querdenker-titelschutz-und-das-dpma-schilda-live/","Wenn die Förderung von Querdenkern das Ziel von Herrn Ehrl ist, dann wiederspricht er sich."
"655","2011-08-22","internetbasiert","Buchvorstellung: Nur Tote bleiben liegen.. Einfach. Leichter. Leben., 2011-08-22","https://shivanireutlingen.wordpress.com/2011/08/22/buchvorstellung-nur-tote-bleiben-liegen/","Feedbacks von einer Veranstaltung der beiden Querdenker… viel Spaß!"
"656","2011-03-30","internetbasiert","Modeplattform The Couture Society launcht. modabot.de, 2011-03-30","http://www.modabot.de/2011/03","YOHJI YAMAMOTO at the V&A Nach Paris, Florenz und Antwerpen würdigt auch London im Victoria and Albert Museum die Arbeiten des Querdenkers Yohji Yamamoto."
"657","2011-05-09","internetbasiert","Der wirklich große John Kenneth Galbraith. STOCKPRESS.de, 2011-05-09","http://stockpress.de/2011/05/09/der-wirklich-grose-john-kenneth-galbraith/","John Kenneth Galbraith gefiel sich in seiner Rolle als Querdenker der Nationalökonomie."
"658","2012-01-04","internetbasiert","Here is to the crazy ones.... (Die berühmte ""Think different""- Kampagne von Apple). Rund um das Lernen, die Wirtschaft und das Leben, 2012-01-04","http://mariusebertsblog.com/marius-ebert/here-is-to-the-crazy-ones-die-beruhmte-think-different-kampagne-von-apple/","Die Rebellen, die Idealisten, die Visionäre, die Querdenker, die, die sich in kein Schema pressen lassen, die, die Dinge anders sehen."
"659","2011-06-11","internetbasiert","Bilderberg? Nur ein Häufchen Elite, Folks.. richard k. breuer, 2011-06-11","https://1668cc.wordpress.com/2011/06/11/bilderberg-nur-ein-haufchen-elite-folks/","Künstler oder Querdenker oder Philosoph oder Humanist konnte ich jedenfalls noch keinen ausmachen.Vermutlich haben sich diese als Hotelangestellte verkleidet und bedienen die Herrschaften für ein paar Münzen."
"660","2012-12-10","internetbasiert","Heute geht es einmal um das Thema Kreativität im Angebotsprozess. - Monday-Morning-Must. Managementtraining und Verkaufstraining - Martin Limbeck® Blog, 2012-12-10","http://www.managementtraining.de/2012/12/10/heute-geht-es-einmal-um-das-thema-kreativitat-im-angebotsprozess/","In der Tat ein wunderbares Beispiel dafür, dass “Querdenker” auch für Ihren Mut belohnt werden."
"661","2012-05-08","internetbasiert","Funky Business forever - business bestseller. Business Bestseller, 2012-05-08","https://www.business-bestseller.com/summary/funky-business-forever/","Ein Buch von bunten Vögeln für Querdenker, Philosophen, Stammesbrüder, Unternehmer und ei- gentlich jeden Erdenbürger, der die Welt von morgen verstehen lernen möchte."
"662","2011-03-08","internetbasiert","Lektüre-Empfehlung (mit Nachdruck!): Die Weichmacher. Das süße Gift der Harmoniekultur. Prof. Dr. Hans-Peter Ecker, 2011-03-08","https://hpecker.wordpress.com/2011/03/08/lekture-empfehlung-mit-nachdruck-die-weichmacher-das-suse-gift-der-harmoniekultur/","Wie Querdenker die Harmonie stören"
"663","2010-07-25","internetbasiert","Neues aus Hammelburg. unzensiert.zeitgeist-online.de, 2010-07-25","https://unzensiert.zeitgeist-online.de/2010/07/25/fur-selberdenker/","Die von Jochen beschriebenen, ein erhöhtes Risiko für Selbst-, Frei- und/oder Querdenker konstatierenden Fakten sind unbestreitbar real – aber der Preis, den man für “Sicherheit davor” zahlen muss, erscheint mit ebenfalls sowohl als zu hoch als auch inakzeptabel!"
"664","2012-09-05","internetbasiert","UBERBYTE veröffentlichen am 16.10. „Five Year Plan“. UBERBYTE veröffentlichen am 16.10. „Five Year Plan“, 2012-09-05","http://www.neurostyle.de/2012/09/uberbyte-veroeffentlichen-am-16-10-five-year-plan/","Die britischen Elektronic Querdenker UBERBYTE verstießen erstmals 2007 mit ihrem bemerkenswerten Debüt-Album gegen die etablierten EBM/Industrial Regeln."
"665","2010-09-04","internetbasiert","Sarrazin-Debatte entpersonalisieren!. Sendungsbewusstsein, 2010-09-04","https://sebew.wordpress.com/2010/09/04/sarrazin-debatte-entpersonalisieren/","So gesehen scheint es, dass gerade Sarrazins Partei, die SPD, ein fast chronisches Problem mit Querdenkern und kritischen Geistern hat, die nicht in den politisch korrekten Programm-Raster passen."
"666","2011-05-08","internetbasiert","Obama & Osama … der finale Crash-Test des Herrschaftssystems „Lug & Trug“?. Adalberts Meckerecke, 2011-05-08","https://adalbertnaumann.wordpress.com/2011/05/08/obama-osama-%e2%80%a6-der-finale-crash-test-des-herrschaftssystems-%e2%80%9elug-trug%e2%80%9c/","Zu den verbohrten Selbst- und Querdenkern also, die sich schon lange kein X mehr für ein U vormachen und sich das logisch-geradlinige Denken nicht verbieten lassen wollen."
"667","2012-12-28","internetbasiert","Neuer sensor ist da !!! (Januar 2013 Ausgabe). Sensor Magazin - Mainz, 2012-12-28","http://www.sensor-magazin.de/neuer-sensor-ist-da-januar-2013-ausgabe/","Außerdem dabei: eine neue Ballett-Compagnie in Mainz, ein großer Fußballkneipentest mit dem Kneipenhorst, guter Musigg, einem stadtmalenden Schatzsucher und anderen Querdenkern."
"668","2012-04-24","internetbasiert","News und Termine. kaltesonne.de, 2012-04-24","http://kaltesonne.de/ist-das-noch-normal-die-extrem-schwierige-analyse-von-extremwetter/","Querdenker wird man wohl auf diesem Posten vergeblich suchen."
"669","2012-04-06","internetbasiert","Dancing is illegal. Überschaubare Relevanz, 2012-04-06","https://ueberschaubarerelevanz.com/2012/04/06/dancing-is-illegal/","Unbequeme unangepasste Querdenker."
"670","2010-11-05","internetbasiert","Die Woche im Rückspiegel – 44. KW. Kadekmedien'S Blog, 2010-11-05","http://kadekmedien.com/2010/11/05/die-woche-im-ruckspiegel-44-kw/","»Eine Münchner Firma hat die Wortmarke „Querdenker“ beim Deutschen Patent- und Markenamt eintragen lassen."
"671","2012-06-15","internetbasiert","Video-Test: Lollipop Chainsaw. Ingame, 2012-06-15","http://www.ingame.de/cat-videos/video-tests/lollipop-chainsaw-video-test-review-gameplay-xbox-360-ps3/","So schnell passt sich ein Querdenker nicht an den Massenmarkt an …"
"672","2012-09-13","internetbasiert","Studienratgeber im Test. UNICUM, 2012-09-13","https://www.unicum.de/de/archiv/studienratgeber-im-test","Für: Querdenker, studienwillige Witzbolde"
"673","2011-03-16","internetbasiert","Impressionen zum 10. FI-TS Management-Forum online. Bilder und Präsentaionen vom 10. FI-TS Management-Forum sind online, 2011-03-16","http://www.f-i-ts.de/blog/events/management-forum/impressionen-zum-10-fi-ts-management-forum-online/","Ausreichend Gesprächsstoff gab es für jeden auf der Veranstaltung – von den Clouds bis hin zum Paragraphendschungel – ein erheiternder Blick auf die Juristerei von dem Kabarettisten Werner Koczwara -, oder Denkanstöße, wie man mit einer fundamental anderen Art des Managements sein Unternehmen zum Erfolg führen kann (vorgetragen von den beiden Business Querdenkern und Bestseller Wirtschaftsautoren Anja Förster und Dr. Peter Kreuz)."
"674","2011-06-18","internetbasiert","Kickoff Treffen im Tramdepot zu Bern. Design / Discussion, 2011-06-18","https://designslashdiscussion.wordpress.com/2011/06/18/kickoff/","Komm vorbei zum Start einer neuen Eventreihe in Bern – unter dem Titel “design / discussion” treffen sich Gleichgesinnte und Querdenker."
"675","2010-03-09","internetbasiert","In 7 Schritten zur Innovation!. unternehmer.de | Tipps für KMU & Startup, 2010-03-09","http://www.unternehmer.de/marketing-vertrieb/38591-in-7-schritten-zur-innovation","Die Mischung im Team macht's: Sorgen Sie für Visionäre, Querdenker, Missionare, Macher, Kundenbotschafter und Bedenkenträger."
"676","2011-01-01","internetbasiert","Highlights / Herbert Management. herbert-management.de, 2011-01-01","https://www.herbert-management.de/highlights/","Florian Schroeder mischt die Querdenker auf, trifft im 3sat auf das Böse, lädt zur ""Quarantäne-Show"", zum Podcast mit Serdar Somuncu und..."
"677","2011-11-14","internetbasiert","Gedanken zum Essay ""Sog der Masse"" von Harald Martenstein. Matthias Jung, 2011-11-14","https://blogmatthiasjung.wordpress.com/2011/11/14/gedanken-zum-essay-sog-der-masse-von-harald-martenstein/","Dennoch: »schöne« Aussichten für Querdenkern oder »Reaktanten«, wie Martenstein sie nennt."
"678","2011-04-20","internetbasiert","» BPatG, Beschluss v. 09.02.2011 – 29 W (pat) 208/10–“Löschung der Marke Querdenker wegen fehlender Unterscheidungskraft nach § 8 Abs. 2 Nr. 1 MarkenG”. BPatG, Beschluss v. 09.02.2011 – 29 W (pat) 208/10–“Löschung der Marke Querdenker wegen fehlender Un...","http://www.wmwllp.de/berlinblawg/urteile/markenrecht/bpatg-29-w-pat-208-10/","Insoweit werden die angesprochenen Verkehrskreise in dem Begriff “Querdenker” einen Sachhinweis auf die Art und Weise der Werbe- bzw. Beratungsdienstleistungen sehen, nämlich, dass es sich um ungewohnte, neuartige Werbemaßnahmen bzw. innovative, unorthodoxe Beratungsmethoden im Marketingbereich handeln kann."
"679","2011-02-24","internetbasiert","Alpine Horizonte - trends, brands & a quantum of solar. vol.at, 2011-02-24","http://www.vol.at/alpine-horizonte---trends-brands--a-quantum-of-solar/news-20110224-09285973","Führungsparadigmen für eine neue Zeit Hans A. Wüthrich – Managementforscher & Querdenker Erfolgreiche Unternehmer – Führungsexzellenz durch Musterbrüche Karl J. Reiter – Hotelier aus Leidenschaft & Hotelier des Jahres 2004 Mein BURGENLAND RESORT – ein Gast – & Landwirt aus Passion."
"680","2010-09-07","internetbasiert","Bonn: Thilo Sarrazin – Exorzismus oder Weiterbildung? Eine Glosse. bonner-presseblog.de, 2010-09-07","http://www.bonner-presseblog.de/bonn/bonn-thilo-sarrazin-%e2%80%93-exorzismus-oder-weiterbildung-eine-glosse","Die entrationalisierte Fantruppe hat aber nicht gemerkt, dass Herr T. Sarrazin kein Querdenker ist, sondern nur verquer denkt."
"681","2010-08-30","internetbasiert","Come to Sarrazin Country.... Honigbrot-Blog, 2010-08-30","https://frederichormuth.wordpress.com/2010/08/30/come-to-sarrazin-country/","Ansonsten gilt der Mann, für den es ein Juden-Gen gibt und der Angst vor migrationsunwilligem und migrationsunwürdigem Gen-Material hat, erschreckend vielen Medien als „Tabubrecher“ und „Querdenker“, der nur etwas zu pointiert formuliert hat."
"682","2012-07-20","internetbasiert","Leben nach der Halma-Strategie. S´Maulwerk, 2012-07-20","https://maulwerk.wordpress.com/2012/07/20/leben-nach-der-halma-strategie/","Querdenker aus Prinzip."
"683","2011-08-20","internetbasiert","Querdenken X- EigenSinn. Querdenken, 2011-08-20","https://querdenke.wordpress.com/2011/08/20/querdenken-eigensinn/","Querdenker sind eigen sinnig …"
"684","2010-02-02","internetbasiert","Global Game Jam | Superlevel. Superlevel, 2010-02-02","https://superlevel.de/spiele/global-game-jam/","Die teilnehmenden Konzeptionisten, Designer, Programmierer und sonstigen Querdenker bilden untereinander Gruppen, welche die Aufgabe haben, innerhalb von 48 Stunden ein Videospiel zu entwickeln."
"685","2011-08-01","internetbasiert","Neuer Kunde aus dem Personalmarketing. Balzer und Partner, 2011-08-01","https://www.balzer-partner.de/neuer-kunde-aus-dem-personalmarketing/","Pionier, Voraus- und Querdenker zu sein, das ist der Anspruch des Verlages."
"686","2010-09-17","internetbasiert","Unglaubliche Kampagne. Extrabrief, 2010-09-17","https://extrabrief.wordpress.com/2010/09/17/unglaubliche-kampagne/","Ich wünsche mir mehr Fairness in den Medien gegen Querdenker, weil sonst unsere Demokratie schweren Schaden nehmen wird, was nicht heißen soll, daß alles kritiklos hingenommen werden muß, wie ja Maybrit Illners Sendung zum Thema gezeigt hat, daß es auch anders geht.”"
"687","2012-09-15","internetbasiert","Sei smart, fahr' Smart!. Schräge Töne aus Paris, 2012-09-15","https://schraegetoeneausparis.wordpress.com/2012/09/15/sei-smart-fahr-smart/","Querdenker schaffen’s offensichtlich besser ans Ziel!"
"688","2010-03-29","internetbasiert","500. Kommentar im Weidegrund – eine kleine Bilanz.. Kurilka, 2010-03-29","https://kurilkablog.wordpress.com/2010/03/29/500-kommentar-im-weidegrund-eine-kleine-bilanz/","Die Besucherzahlen lagen im Monat Februar bei durchschnittlich etwa 390 Querdenkern und Weide-Zaungästen pro Tag, in Spitzen waren es 500, in den Tiefen etwa 290, auf den Monat beliefen sie sich auf etwas über 11.000 (zum Vergleich: Im August 2009 waren es noch etwa 2900)."
"689","2010-07-25","internetbasiert","Ausschluss eines Vereinsmitgliedes. Alles wird gut, 2010-07-25","https://gelabber.wordpress.com/2010/07/25/ausschluss-eines-vereinsmitgliedes/","Also ihr Korintenkacker,wer mit Spitzfindigkeiten vertrauensbildende Maßnahmen verhindert,sich hinter Papier verschanzt und sogenannten Querdenkern mit Vorsatz in Fallen lockt,hat den Namen “Papiertiger”redlich verdient."
"690","2012-01-20","internetbasiert","Suitestuff auf der Best of Events 2012. | online zeitung. Online Zeitung, 2012-01-20","http://online-zeitung.de/2012/01/20/suitestuff-auf-der-best-of-events-2012/","Die bisherigen Referenzen des Mietmöbelspezialisten sprechen für sich: Hannover Messe, Messe München, Messe Berlin, Flughafen München, Audi, BMW, Fussball Europameisterschaft, Nespresso, Querdenker Kongress, Sofitel, Sony, Veuve Clicquot…sind klangvolle Namen und Locations aus dem bisher betreuten Klientel."
"691","2011-02-21","internetbasiert","ERFOLGREICH VERKAUFEN: Konzepte-Strategien-Training. Weinakademie Berlin, 2011-02-21","http://www.weinakademie-berlin.de/erfolgreich-verkaufen-konzepte-strategien-training","Dirk van der Niepoort – einer der innovativsten und erfolgreichsten Weinmacher Portugals. Querdenker"
"692","2012-11-19","internetbasiert","Peter Rosegger-Jahr 2013 präsentiert. www.schuetzenhoefer.steiermark.at, 2012-11-19","https://www.schuetzenhoefer.steiermark.at/cms/beitrag/11773030/870915/","Peter Rosegger sei ein Vor-, Nach- und Querdenker gewesen."
"693","2011-11-30","internetbasiert","Erst der Sekt? Dann der Eklat?. Radio machen, 2011-11-30","https://www.radio-machen.de/2011/11/30/erst-der-sekt-dann-der-eklat/","Die Wirtschaftsvereinigung „Querdenker“ hat Til Schweiger einen Preis verliehen."
"694","2011-10-06","internetbasiert","Steve Jobs, Jesus der Neuzeit, ist verstorben | Dimido. Dimido, 2011-10-06","http://www.dimido.de/steve-jobs-jesus-der-neuzeit-ist-verstorben-2428","Fazit: Steve Jobs war (meiner Meinung nach) kein Erfinder sondern ein äußert erfolgreicher Querdenker und Menschenkenner."
"695","2012-01-05","internetbasiert","Für Bischof Wulffila hat es sich ausgebetet. robalef.de, 2012-01-05","http://www.robalef.de/2012/fur-bischof-wulffila-hat-es-sich-ausgebetet/","Da er fünfzehn Jahre jünger ist als Jopie Heesters, hätte der rüstige hanseatische Querdenker garantiert eine, vielleicht sogar zwei Amtsperioden vor sich."
"696","2012-09-19","internetbasiert","Kunsthalle Krems „Francis Picabia“ bis 4. November 2012. Kunsthalle Krems „Francis Picabia“ bis 4. November 2012, 2012-09-19","https://cornelia-kerber.de/kunsthalle-krems-francis-picabia-bis-4-november-2012/","Er, als Querdenker, Nihilist und Demagoge war Wegbereiter des Dadaismus in Europa und hinterließ uns sein bildnerisches wie literarisches Aufbäumen, welches sehenswert ist."
"697","2012-10-10","internetbasiert","Kunst + Film: Savages. Kunst+Film, 2012-10-10","https://kunstundfilm.de/2012/10/savages/","Oliver Stone tritt als letzter Querdenker von Hollywood auf:"
"698","2010-09-07","internetbasiert","Bonn: Thilo Sarrazin – Exorzismus oder Weiterbildung? Eine Glosse. bonner-presseblog.de, 2010-09-07","http://www.bonner-presseblog.de/bonn/bonn-thilo-sarrazin-%e2%80%93-exorzismus-oder-weiterbildung-eine-glosse","Die Meinungsfreiheit sei bedroht, der Parteivorstand der SPD habe das Buch von Thilo Sarrazin nicht einmal gelesen, reagiere aber schon mit parteidisziplinarischen Maßnahmen, so der in Bonn lebende „Querdenker“."
"699","2012-02-03","internetbasiert","Neue Mitte von Jochen Schimmang im Nautilus Verlag. Das ist mein Blog, 2012-02-03","http://www.dasistmeinblog.de/neue-mitte-von-jochen-schimmang-im-nautilus-verlag/","Deutschland erholt sich langsam vom Regime und auf dem Gelände, das einmal das Zentrum der Macht gewesen ist, finden sich Anarchisten, Freiheitskämpfer, Querdenker und innovative Macher ein."
"700","2012-01-01","internetbasiert","“Think Big” - AUTO1 Group - Online-Karrieretag. Online-Karrieretag, 2012-01-01","https://online-karrieretag.de/news/think-big-auto1-group","Was die AUTO1 Group ausmacht sind die Querdenker, Visionäre, Zahlenjongleure, Kommunikationsprofis, Autoenthusiasten und Kreative, die jeden Tag ihr Bestes für unsere gemeinsame Vision geben."
"701","2012-02-24","internetbasiert","Wasted & Wanted – Michael Wollny. Michael Wollny, 2012-02-24","https://michaelwollny.com/music-album/wasted-wanted/","„Zwischen feingliedriger Transparenz und expressiven Crescendi können die souveränen Querdenker Wollny, Kruse und Schaefer tatsächlich Zeit und Raum aus den Angeln heben“ (Frankfurter Allgemeine Zeitung)"
"702","2011-06-11","internetbasiert","Last Chance To Reason – Level 2. Demonic-Nights.at - Dein Rock- und Metal-Webzine, 2011-06-11","http://www.demonic-nights.at/2011/06/last-chance-to-reason-level-2/","Gespickt mit zahlreichen Videospielreferenzen und der dazugehörigen PC-tauglichen Umsetzung ist “Level 2″ ein Traum für Nerds jeden Kalibers, ein Festmahl für Querdenker."
"703","2010-11-01","internetbasiert","100. Todestag des Rotkreuz-Gründers Henry Dunant. 100. Todestag des Rotkreuz-Gründers Henry Dunant, 2010-11-01","http://www.senioren-internetz.de/2010/11/01/100-todestag-des-rotkreuz-grunders-henry-dunant/","Als Querdenker und Visionär überwand er verschiedenste Hürden, um seine Idee einer internationalen, religions- und nationalitätsunabhängigen Hilfsorganisation zu verwirklichen."
"704","2012-01-06","internetbasiert","Die langsame Reise des Alterns.. Klappentexterin und Herr Klappentexter, 2012-01-06","https://klappentexterin.wordpress.com/2012/01/06/die-langsame-reise-des-alterns/","Wie in jeder Gemeinschaft gibt es mindestens einen Außenseiter, einen Querdenker, der Unruhe stiftet."
"705","2010-01-27","internetbasiert","Doc Blog. doc-sarah-schons.de, 2010-01-27","http://www.doc-sarah-schons.de/blog/2010/01/querdenker-titelschutz-und-das-dpma-schilda-live/","Der greift nun wiederum – unglaublich, aber wahr – unseren Innovativ-in Business Club an, weil wir bis dato als “Innovativ-in – Business Club für Wertschöpfer, Querdenker und Innovatoren” firmierten und schoß unsere Querdenker-Forum Veranstaltungsreihe an."
"706","2012-10-02","internetbasiert","Ausgezeichnete Personalleitung bei Jäger Direkt | online zeitung. Online Zeitung, 2012-10-02","http://online-zeitung.de/2012/10/02/ausgezeichnete-personalleitung-bei-jaeger-direkt/","Die Kandidaten des Awards werden von ihren Vorgesetzten nominiert und ausgezeichnet werden Generalisten oder Spezialisten, die gemessen an ihrem Alter besonders viel Verantwortung übernehmen, Ideenreichtum beweisen und echte Querdenker sind."
"707","2010-03-26","internetbasiert","SDW11: Präsentations Analyse Teil 1 – Bielefeld und Chemnitz. Alex Boerger - Videoproduktion, 2010-03-26","http://alexboerger.de/blog/sdw11-prasentations-analyse-teil-1-bielefeld-und-chemnitz/","DenkwerkStadt – von Querdenkern, Querköpfen & Querulanten"
"708","2012-04-15","internetbasiert","Schulleiter zu Handlangern. kreidefressen.de, 2012-04-15","https://www.kreidefressen.de/2012/04/15/schulleiter-zu-handlangern/","Pingback: MAWSpitau / Lehrer, Querdenker und Medienjunkie » Blog Archiv » Mehr OER braucht das Land!"
"709","2010-07-05","internetbasiert","Die USA, Israel und der Iran – Gehen die Völker bald aufeinander los?. Der AmSeL-Gedanke Plus = Gemeinschaft, 2010-07-05","https://moltaweto.wordpress.com/2010/07/05/die-usa-israel-und-der-iran-%e2%80%93-gehen-die-volker-bald-aufeinander-los/","Nun denn … wie gesagt, werde ich an der Implementierung einer Kontoangabe arbeiten, was durch den Hintergedanken zusätzlich erschwert wird, die Bitte um Spenden mit irgendeinem raffinierten Dreh zu verbinden, der bei den Menschen, die das Kästchen auch nur ansehen, das unwiderstehliche Bedürfnis weckt, arme und mehr oder weniger Not leidende und kreative Querdenker wie uns nach besten Kräften zu sponsern … hört sich bestimmt gut an, ist aber auch nicht mehr als ein Wunschtraum nach Art des berüchtigten Spruches:"
"710","2010-10-03","internetbasiert","Politisch-philosophische Erwägungen zur „Sarrazin-Sache“: Beseitigungsphantasien von rechts und links. xtranews.de, 2010-10-03","http://www.xtranews.de/2010/10/03/politisch-philosophische-erwaegungen-zur-sarrazin-sache-beseitigungsphantasien-von-rechts-und-links/","Denn auch heute noch darf man von der Beseitigung des fremden Anderen träumen, jedenfalls dann, wenn es Rassisten, Kinderschänder oder Terroristen betrifft – und nicht etwa Juden, Feldhamster oder intellektuelle „Querdenker“."
"711","2010-09-17","internetbasiert","eigen. Schakim's Blog, 2010-09-17","https://schakim.wordpress.com/2010/09/17/eigen/","Querdenker lassen Gnade walten,"
"712","2011-10-31","internetbasiert","CoffeeBreak Design Blog - Here's To the Crazy Ones. CoffeeBreak Design Blog, 2011-10-31","http://www.coffeebreak-blog.de/heres-to-the-crazy-ones/","Die Rebellen, die Idealisten, die Visionäre, die Querdenker, die, die sich in kein Schema pressen lassen, die, die Dinge anders sehen."
"713","2011-02-21","internetbasiert","Paradiesinselkurier 1/2011/Kurzfassung. Paradiseislandfamily's Weblog, 2011-02-21","https://paradiseislandfamily.wordpress.com/2011/02/21/paradiesinselkurier-12011kurzfassung/","– Und nun will ein Ex-Punker, Weintrinker, Unmoralischer, Geimpfter, Querdenker… wie ich sich dazu versteigen, wiederum Neues zu erklären!?"
"714","2010-01-04","internetbasiert","Der Prothesenmensch. Netzivilisation, 2010-01-04","https://netzivilisation.wordpress.com/2010/01/04/der-prothesenmensch/","Das Korrektiv zu Leuten vom Schlage eines Steve Jobs oder Sergey Brin sind die kulturkritischen Querdenker, seien sie rabiat wie George Steiner, der im Gebrauch des Computers lediglich «eine niedrige Art menschlicher Kommunikation» erkennen will, oder moderat wie Umberto Eco, der es jedenfalls als eine offene Frage betrachtet, ob das Internet das Verständnis zwischen den Kulturen fördert oder den Identitätsverlust beschleunigt."
"715","2010-06-16","internetbasiert","„Geben Sie Querdenkern eine Chance. Lassen Sie Störer zu!”. Möglichmacher-Blog, 2010-06-16","https://moeglichmacher.wordpress.com/2010/06/16/%e2%80%9egeben-sie-querdenkern-eine-chance-lassen-sie-storer-zu%e2%80%9d/","„Geben Sie Querdenkern eine Chance."
"716","2011-08-30","internetbasiert","7 Minuten quergedacht. Jörg Dechert, 2011-08-30","https://pixelpastor.com/leadership/7-minuten-quergedacht/","Warum Leiterschaft etwas völlig anderes ist als Management, warum Fabrikenheute immer weniger Profit abwerfen, und wie man in der digitalen Welt von morgen erfolgreich sein kann – ein kurzes Interview mit Autor und Querdenker Seth Godin: http://vimeo.com/20290657 Mein Lieblingszitat: „That’s your opportunity:"
"717","2011-03-30","internetbasiert","Buffalo Bills in der Sezierstunde. Sideline Reporter - Eier, wir brauchen Eier!, 2011-03-30","https://sidelinereporter.wordpress.com/2011/03/30/buffalo-bills-in-der-sezierstunde/","Die Bills gelten seit Jahren als Querdenker, draften gerne mal völlig gegen den Konsens in der NFL."
"718","2012-09-14","internetbasiert","Gender Mainstreaming nach der Judith Butler-Ehrung – von nun an geht’s bergab?. Gabrielewolff, 2012-09-14","https://gabrielewolff.wordpress.com/2012/09/14/gender-mainstreaming-nach-der-judith-butler-ehrung-von-nun-an-gehts-bergab/","Die Erfahrung zeigt aber auch: wenn einstmalige Querdenker im Mainstream angekommen sind, mit der Zuneigung des Establishments bedacht und mit Preisen geehrt werden, haben sie ihre beste Zeit hinter sich."
"719","2010-06-10","internetbasiert","Hana-Bi – Feuerblume. Film-Rezensionen.de, 2010-06-10","http://www.film-rezensionen.de/2010/06/hana-bi-feuerblume/","Das Multitalent beweist hier eindrucksvoll, dass er ein Querdenker unserer Zeit ist und keineswegs der einfache Komiker aus Takeshis Castle."
"720","2010-11-23","internetbasiert","Eigenschaften der Indigo-Kinder. Igelin, 2010-11-23","https://igelin.wordpress.com/2010/11/23/eigenschaften-indigo-kinder-10036202/","* Sie gelten als Querdenker, da sie zu Hause und in der Schule oft Wege entdecken, Dinge und Vorgänge besser zu erledigen."
"721","2010-08-01","internetbasiert","München: Verdi kritisiert „Exzellenzinitiative“. Politische Berichte, 2010-08-01","https://politischeberichte.wordpress.com/2010/08/01/munchen-verdi-kritisiert-%e2%80%9eexzellenzinitiative%e2%80%9c/","Wissenschaftshistorisch lasse sich zeigen, dass echte Neuerungen eher durch Außenseiter und Querdenker entstehen."
"722","2011-02-24","internetbasiert","Selbstbetrug – Danke an den GutenBerg. Illing, 2011-02-24","https://illing.wordpress.com/2011/02/24/selbstbetrug-danke-an-den-gutenberg/","Wo sind die kreativen Köpfe, die Freigeister, die Querdenker, die Menschen auf die man sich verlassen konnte, bei denen ein Handschlag noch etwas zählt, die Ehre haben und ein Gesicht?"
"723","2011-10-28","internetbasiert","die Bioniker. diebioniker.de, 2011-10-28","https://www.diebioniker.de/2011/10/28/die-bioniker-im-rennen-um-den-querdenker-award-2011/","die Bioniker im Rennen um den Querdenker Award 2011"
