"No.","Date","Genre","Bibl","URL","Hit"
"1","2011-08-23","internetbasiert","Intern – Artikel 3.771 Mal gelesen. Blaulicht und Graulicht, 2011-08-23","https://justizkultur.wordpress.com/2011/08/23/intern-artikel-3771-mal-gelesen/","Keine Frage ist der Blog von Buchautor und Querdenker Robert Misik sehr gut gemacht."
"2","2012-05-11","internetbasiert","Landgasthof Hotel Gentner. erwinseitz.de, 2012-05-11","http://erwinseitz.de/gastronomie/landgasthof-hotel-gentner","Doch oft sind gerade diese Querdenker erfolgreich, wie Sabine und Harald Gentner."
"3","2012-05-16","internetbasiert","Global Sustainability Jam: Spielend einfach Nachhaltigkeit leben. unternehmer.de | Tipps für KMU & Startup, 2012-05-16","http://www.unternehmer.de/management-people-skills/132740-global-sustainability-jam-spielend-einfach-nachhaltigkeit-leben","Die UNO, EU, unterschiedliche Wissenschaftsdisziplinen und auch viele Querdenker haben in den unterschiedlichen Bereichen schon sehr gute Normen, Leitlinien und Strategien entwickelt."
"4","2010-10-13","internetbasiert","» DPMA, Beschluss v. 09.08.2010 – 304 22 150 – S 50/10 Lösch–“Löschung der Marke Querdenker” (noch nicht rechtskräftig). DPMA, Beschluss v. 09.08.2010 – 304 22 150 – S 50/10 Lösch–“Löschung der Marke Querdenker” (noch nicht rechtskräftig) | Von Dennis S...","http://www.wmwllp.de/berlinblawg/urteile/markenrecht/dpma-304-22-150-s-5010/","Die angesprochenen Verkehrskreise werden davon ausgehen, dass auch noch andere Institutionen über Querdenker, also Personen, die ungewöhnliche Gedanken haben, verfügen können."
"5","2011-10-06","internetbasiert","Das Lebende lebendiger werden lassen. futurestrategy.de, 2011-10-06","http://www.futurestrategy.de/2011/10/06/das-lebende-lebendiger-werden-lassen/","Dürr gilt als einer der bedeutendsten Querdenker unserer Zeit und Impulsgeber der internationalen Umwelt- und Friedensbewegung."
"6","2010-05-19","internetbasiert","MM046 Liebe ist …. Freak Show, 2010-05-19","http://freakshow.fm/mm046-liebe-ist","Es sind ganz klar keine Querdenker, sondern nur durch den Mainstream angezogene Mitläufer, die wie die 1984 Schafe im Chor den neuen Schäfer anblöken."
"7","2011-01-01","internetbasiert","creative circle - agb. creative-circle.de, 2011-01-01","https://www.creative-circle.de/agb/","Das Quiz für Querdenker"
"8","2012-03-30","internetbasiert","TEDx – Visionen neu gedacht. Daimler_News, 2012-03-30","http://blog.daimler.de/2012/03/30/tedx-stuttgart-2012-visionen-neu-gedacht/","Es ist wichtig, seine Themen nicht nur auf den Webportalen präsent zu halten, sondern man muss über neue Formate, wie zum Beispiel die re:publica nachdenken und dorthin gehen, wo Querdenker und Multiplikatoren sitzen, die reflektieren und getreu dem Motto „ideas worth spreading“ Visionen über die Stadtgrenzen hinaustragen."
"9","2010-05-18","internetbasiert","Suter’s Wahlexpress ist unterwegs. Feldwaldwiesenblog, 2010-05-18","https://feldwaldwiesenblog.ch/2010/05/18/suters-wahlexpress-ist-unterwegs/","Bruno Suter ist wohl ein Querdenker, hat aber sich nicht vor die Schweizer Neutralität abzuschaffen."
"10","2011-04-20","internetbasiert","» BPatG, Beschluss v. 09.02.2011 – 29 W (pat) 208/10–“Löschung der Marke Querdenker wegen fehlender Unterscheidungskraft nach § 8 Abs. 2 Nr. 1 MarkenG”. BPatG, Beschluss v. 09.02.2011 – 29 W (pat) 208/10–“Löschung der Marke Querdenker wegen fehlender Un...","http://www.wmwllp.de/berlinblawg/urteile/markenrecht/bpatg-29-w-pat-208-10/","So sei z. B. bei den Waren “Druckereierzeugnisse” nicht ausschlaggebend, ob die Bezeichnung als Titel dienen könnte für die Themen, die darin niedergelegt seien, sondern, ob das Zeichen “Querdenker” herkunftshinweisend auf diesen Waren verwendet werden könne."
"11","2011-06-02","internetbasiert","32. Schleswig-Holstein Gourmet Festival - LAND & MEER. Land & Meer, 2011-06-02","https://www.landundmeer.de/Artikel/5498/32-Schleswig-Holstein-Gourmet-Festival","[...] Rund 160 Gäste dürfen sich zur Auftaktgala, die erstmals an einem Freitag, 21. September 2018, stattfindet, über folgende Herd-Champions im Waldhaus Reinbek freuen: Powerfrau *Iris Bettinger – sie kombiniert Heimisches mit internationalen Gewürzen, Produktidealist **Marco Müller – der konsequent Nachhaltigkeit und Regionalität in treffsicheren Kombinationen vereint; Fermentierkünstler *René Mammen – der dänische Querdenker wendet überlieferte Methoden der Vorfahren an, um jahreszeitlich unabhängig frische Top-Produkte in seiner ‚Nordic Cuisine' zu verarbeiten; Pionier Alfred Schreiber – der einst die euroasiatische Küche in Hamburg etablierte und heute im ‚Der Seehof' in Ratzeburg verführerisch aufkocht sowie Lokalmatador Christian Dudka – der passionierte Jäger verwendet gern Qualitätsprodukte aus Schleswig-Holstein in seiner Küche. [...]"
"12","2011-02-04","internetbasiert","Luna. Maty's Blog, 2011-02-04","https://smaty.wordpress.com/2011/02/04/luna/","Das ist Luna, unser Querdenker, Spielgefährte und Allesfresser."
"13","2011-07-27","internetbasiert","Gemischtes Doppel 2. #Indexmetacopyright#, 2011-07-27","http://www.curiosi.de/metermorphosen/gemischtes-doppel/171/gemischtes-doppel-2","„Ein kniffliges Spiel für Querdenker, Wortakrobaten und Gedächtniskünstler.“"
"14","2012-05-15","internetbasiert","Neues Buch: Nazi-Terror und Verfassungsschutz-Skandal. VEREINIGUNG 17. JUNI 1953 e.V., 2012-05-15","https://17juni1953.wordpress.com/2012/05/15/neues-buch-nazi-terror-und-verfassungsschutz-skandal/","Allein die Tatsache der Herausgabe durch einen prominenten LINKEN-Politiker ist für einen Demokraten kein Ablehnungsmerkmal, zumal, wenn er Bodo Ramelow heißt, einer der nicht nur behaupteten Querdenker seiner Partei."
"15","2012-08-11","internetbasiert","IMMER HERTHA. immerhertha.de, 2012-08-11","http://www.immerhertha.de/2012/08/11/hertha-reist-mit-franz-sahar-und-wagner-zum-fsv-frankfurt/","…sind wir nicht alle “Querdenker”?"
"16","2011-10-22","internetbasiert","Ein mysteriöses Dokument. Der Wortbruchstellenverursacher, 2011-10-22","https://wortbruchstellenverursacher.wordpress.com/2011/10/22/ein-mysterioses-dokument/","Ein neues Slapstick-Duo im intellektuellen Kopfkino, Dick und Doof für Querdenker?"
"17","2010-07-09","internetbasiert","Mehr Strategie wagen - Das Progressive Zentrum. Das Progressive Zentrum e.V., 2010-07-09","https://www.progressives-zentrum.org/mehr-strategie-wagen/","Gefragt sind kommunikationsstarke Querdenker und umtriebige Grenzgänger zwischen Politik, Wirtschaft, Wissenschaft und Zivilgesellschaft."
"18","2010-10-13","internetbasiert","» DPMA, Beschluss v. 09.08.2010 – 304 22 150 – S 50/10 Lösch–“Löschung der Marke Querdenker” (noch nicht rechtskräftig). DPMA, Beschluss v. 09.08.2010 – 304 22 150 – S 50/10 Lösch–“Löschung der Marke Querdenker” (noch nicht rechtskräftig) | Von Dennis S...","http://www.wmwllp.de/berlinblawg/urteile/markenrecht/dpma-304-22-150-s-5010/","Bei „Querdenker"" handelt es sich um eine Wortzusammensetzung, deren Sinn sich im Zusammenhang mit den in Frage stehenden Waren und Dienstleistungen ohne weiteres erschließt, nämlich, dass es sich um Waren und Dienstleistungen handelt, die sich mit innovativen, unorthodoxen und auch themenübergreifenden Gedanken fernab der eingefahrenen Muster befassen, z.B. philosophische und wirtschaftliche oder naturwissenschaftliche Themen in bisher ungewohnter Weise verbinden."
"19","2011-03-20","internetbasiert","Das Labor. Einfach Machen - Labor für politische Bildung, 2011-03-20","https://politischebildungeinfachmachen.wordpress.com/das-labor/","[...] Das Labor 2011 Im ersten Labor 2011 haben sich Querdenker aus der politischen Fachdidaktik, aus Stiftungen, Verlagen, aus den Bundes- und Landeszentrale für politische Bildung, sowie aus Kunst und Medien auf Initiative der Professur für Didaktik der politischen Bildung (Prof. Anja Besand) an der TU Dresden und durch die großzügige Förderung der Robert Bosch Stiftung zwei Tage Laborzeit gegönnt, um über politische Bildung zu diskutieren, Ideen zu entwickeln, zu verwerfen, zu spinnen und kreativ zu sein; losgelöst von vermeintlichen Dogmen innerhalb der politischen Bildung und durchaus auch politisch unkorrekt. [...]"
"20","2011-08-17","internetbasiert","Querdenken IX - Regeln? Nö!. Querdenken, 2011-08-17","https://querdenke.wordpress.com/2011/08/17/querdenken-regeln-no/","Querdenker erkennen die Regeln – aber halten sich bewusst nicht daran!"
"21","2012-11-13","internetbasiert","Die Lüge vom teuren Ökostrom. Pv Magazine Deutschland, 2012-11-13","https://www.pv-magazine.de/2012/11/13/die-lge-vom-teuren-kostrom-2/","Bis 2003 leitete er die Zukunftsredaktion „Zeitsprung“ im SWR, seit 1997 das Magazin „Querdenker“ und ab 2000 das Magazin „Grenzenlos“ in 3sat."
"22","2011-08-08","internetbasiert","Bunte Vögel fliegen höher – Die Bühnen-Show zur Buchpremiere von Topseller-Autorin Cordula Nussbaum | online zeitung. Online Zeitung, 2011-08-08","http://online-zeitung.de/2011/08/08/bunte-vogel-fliegen-hoher-die-buhnen-show-zur-buchpremiere-von-topseller-autorin-cordula-nussbaum/","Unserer Wirtschaftswelt ist unübersichtlicher und riskanter geworden und so brauchen Unternehmen visionäre Querdenker mit unkonventionellen Talenten."
"23","2012-01-17","internetbasiert","Bestellen - Kalte Sonne. Kalte Sonne, 2012-01-17","https://kaltesonne.de/order/","»Vahrenholt gilt als Querdenker wider den Zeitgeist.«"
"24","2012-01-01","internetbasiert","PS-ART – Fotograf Hannover ». PS-ART.de Alexander Demandt, 2012-01-01","http://www.ps-art.de/unsere-philosophie/","Verspielt, Freundlich, offen, kreativ, unkonventionell, Querdenker, Spaß, Realist, Träumer,"
"25","2011-04-20","internetbasiert","» BPatG, Beschluss v. 09.02.2011 – 29 W (pat) 208/10–“Löschung der Marke Querdenker wegen fehlender Unterscheidungskraft nach § 8 Abs. 2 Nr. 1 MarkenG”. BPatG, Beschluss v. 09.02.2011 – 29 W (pat) 208/10–“Löschung der Marke Querdenker wegen fehlender Un...","http://www.wmwllp.de/berlinblawg/urteile/markenrecht/bpatg-29-w-pat-208-10/","Dass das Wort “Querdenker” darauf von der Beschwerdeführerin in vermeintlich herkunftshinweisender Art und Weise angebracht gezeigt wird, steht der Annahme der Löschungsreife nicht entgegen."
"26","2012-01-01","internetbasiert","Referenten Agile@Hardware 2019. CO Improve, 2012-01-01","https://www.co-improve.com/events/agile-hardware-konferenz/agile-hardware-2019/referenten.html","Aktuell ist Günther Wagner als Unternehmensberater, Vortragender und Querdenker aktiv."
"27","2012-11-21","internetbasiert","Tobias Faix Theologe, Autor, Blogger. „Die Politik Jesu. Von John Howard Yoder “, 2012-11-21","http://tobiasfaix.de/2012/11/die-politik-jesu-von-john-howard-yoder/","Der 1997 verstorbene täuferisch-mennonitischen Theologe war schon zu Lebzeiten ein Querdenker und seine Gedanken sind sehr herausfordernd."
"28","2012-02-29","internetbasiert","Umleitung – Presseschau vom 29.2.2012. Umleitung – Presseschau vom 29.2.2012 | xtranews, 2012-02-29","http://www.xtranews.de/2012/02/29/umleitung-presseschau-vom-29-2-2012/","Uns fehlen die Querdenker"
"29","2012-10-23","internetbasiert","Quote – und was ist mit den Eichhörnchen?. _Belze_, 2012-10-23","https://belze1981.wordpress.com/2012/10/23/quote-definiere-die-gruppe/","Frauenquote für Querdenker"
"30","2011-01-27","internetbasiert","Blog – Jocelyne Lopez. Jocelyne Lopez, 2011-01-27","http://www.jocelyne-lopez.de/blog/2011/01/die-dada-mathematik-der-relativitatstheorie-teil-2/","Man fragt sich sogar, wenn man Querdenker ist, warum man uns eine Formel überhaupt dafür angibt, ist doch gar nicht nötig, es reicht zu lehren, die Welle behält ihre postulierte konstante Geschwindigkeit 70 km/h in allen Lebenslagen, und fertig, das verstehen wir schon."
"31","2011-09-22","internetbasiert","Samsas Traum verabschiedet sich. Dunkelwelle, 2011-09-22","https://dunkelwelle.wordpress.com/2011/09/22/samsas-traum-verabschiedet-sich/","Mit SAMSAS TRAUM und WEENA MORLOCH verschwinden nicht nur zwei deutsche Musik-Kuriositäten von den Brettern, die für manche die Welt bedeuten – mit ihnen zieht einer der herausragendsten Querdenker unserer Zeit einmal mehr stur und geradlinig seines Weges."
"32","2012-06-06","internetbasiert","Wir als Arbeitgeber. LABOKLIN Bad Kissingen, 2012-06-06","https://laboklin.de/de/start-karriere-bei-laboklin/wir-als-arbeitgeber/","Ob Querdenker oder Pragmatiker, Visionär oder Realist: gemeinsam arbeiten wir an der Weiterführung einer über 30-jährigen Erfolgsgeschichte namens LABOKLIN!"
"33","2012-11-08","internetbasiert","Heute geht´s los. Werden Sie zum Professor für Ergebnisse, 2012-11-08","https://90tageplan.wordpress.com/2012/11/08/heute-geht%c2%b4s-los/","Ich bin kein Besserwisser sondern ein Querdenker und kann dieses allgemeine Genöle nicht mehr ertragen."
"34","2011-11-09","internetbasiert","Querdenker, ein Definitionsversuch. Living the future, 2011-11-09","http://www.livingthefuture.de/2011/11/09/querdenker-ein-definitionsversuch/","10 Querdenker sind anstrengend"
"35","2011-10-06","internetbasiert","Meinungen: Jeder hat eine. Und jede ist richtig.. Herz im Kopf Blog, 2011-10-06","https://iranique.wordpress.com/2011/10/06/meinungen-jeder-hat-eine-und-jede-ist-richtig/","Manche, weil sie einer Ideologie nachhängen und sie nicht aufgeben wollen, und manche, weil sie tatsächlich denken, sie hätten eine starke Persönlichkeit, wenn sie auf ihrer Meinung bestehen bleiben und den individuellen Querdenker geben, der seiner Zeit voraus ist."
"36","2012-09-19","internetbasiert","Top Finanzielle e-Letter Investitionen Contrarians Reports: Labor Unruhen gehen weiter in Südafrika, Hit Mining Stocks Harte. maxx3 grafik design Werbeagentur Hamburg Webdesign E-Commerce grafikdesign günstiges druck und vieles mehr. Drupal CMS, TYPO3 C...","http://www.maxx3.de/wordpress/top-finanzielle-e-letter-investitionen-contrarians-reports-labor-unruhen-gehen-weiter-in-sudafrika-hit-mining-stocks-harte.html","Um den vollständigen Artikel zu sehen und einen echten Contrarian Perspektive auf Investitions-und der Wirtschaft zu erhalten, besuchen Investition Querdenker am http://www.investmentcontrarians.com."
"37","2010-01-12","internetbasiert","Wieder ein Todesfall! im deutschen Gefängnis 26.05.2010 (1.12.2009 / 8.12.2009) Der Deutsche Terrorstaat im 21. Jahrhundert? › Justizfreund. Justizfreund, 2010-01-12","http://blog.justizfreund.de/wieder-ein-todesfall-im-deutschen-gefangnis-26-05-2010-1-12-2009-8-12-2009-der-deutsche-terrorstaat-im-21-jahrhundert/","Eberhard war ein Kritiker, ein Querdenker und ein Rebell."
"38","2010-06-17","internetbasiert","Krise-News. Schlagzeilen vom 17.06.2010, 2010-06-17","http://www.krise-news.de/schlagzeilen/schlagzeilen-vom-17-06-2010/","FTD: Biedenkopf gauckt gegen Merkel (Der Querdenker aus der CDU fordert die Befreiung der Präsidentenwahl vom Parteienzwang.)"
"39","2011-01-04","internetbasiert","Fandom Observer 259. Das ist mein Blog, 2011-01-04","http://www.dasistmeinblog.de/fandom-observer-259/","[...] In diesem Umfeld bewegt sich Cynx, das ist Aley Jahnke, der seine Interessen wie folgt beschreibt: EduPunk, Gonzo Journalist, Sauerländer, Physiker, Programmierer, Cyberpunk, Skandinavienfan, Hacker, Buchsammler, Genussmensch, Kampfsportler, donist, Geek, Pfeifenraucher, Armchair Adventurer, Steampunk, Querdenker, Klingenfetischist, Pfadfinder, Rollenspieler, eenactor, Whiskytrinker, Fanboy, Waldgänger,Transhumanist, Maker, ZX81, C64, Atari ST, DFÜ, Fido, First Mail 1993, WWW seit 1995, Blogger seit 2003, CCC, Pirat, DIY,elektronische Musik, Folk, Metal, Cabaret, Burlesque. [...]"
"40","2010-02-09","internetbasiert","Hallo Welt!. QUERdenken, 2010-02-09","https://querdenken2010.wordpress.com/hallo-welt-2/","QUERdenker"
"41","2011-07-21","internetbasiert","Achtzig Jahre Jacques Guidon. engadinerpost.ch, 2011-07-21","https://www.engadinerpost.ch/2011/07/21/Achtzig-Jahre-Jacques-Guidon","Morgen feiert der unermüdliche Querdenker seinen Achtzigsten."
"42","2010-06-04","internetbasiert","ZEN - vom Schubkastendenken zum QUERDENKEN !!!. white-zen.blogspot.com, 2010-06-04","http://white-zen.blogspot.com/2010/06/zen-vom-schubkastendenken-zum.html","Sind nicht die grossen ZEN-Meister alle Querdenker gewesen und haben uns mit ihren Antworten ""vor den Kopf gestossen""?"
"43","2012-10-04","internetbasiert","Treiben lassen. Qu3Rdenker, 2012-10-04","https://qu3rdenker.wordpress.com/2012/10/04/treiben-lassen/","Verfasst von Jonathan Querdenker - Oktober 4, 2012 in Uncategorized"
"44","2012-07-17","internetbasiert","Leave a Reply Cancel. Die Göttin im Sandkasten und ihre Flucht aus Köln Ehrenfeld.Oder: Warum der Bundestraffic Minister Ramsauer seinen Kampf gegen transnationale Marken verliert und Thomas Gottschalk bald nur noch im Klapprechner sehen kann., 2012-07-17","http://mindstoremarketing.de/blog/international-digital-forum-koln-die-gottin-im-sandkasten-und-ihre-flucht-aus-koln-ehrenfeld-oder-warum-der-bundestraffic-minister-ramsauer-seinen-kampf-gegen-transnationale-marken-verliert-und-tho/","Dort wird er konfrontiert mit provozierendem Infotainment, er muss mitdenken (Querdenker können erfahrungsgemäß leichter folgen), wenn es um Typologisierungen geht wie die Göttin im Sandkasten (in Verbindung mit Ritterlichkeitsresistenz und De-Heroisierungsprozessen), Robinson Krösus oder die metro-A-sexuelle Frau."
"45","2012-07-09","internetbasiert","Warum kleine Kinder nicht in eine Kita, sondern zu ihren Müttern gehören. meinesvenja.de, 2012-07-09","http://www.meinesvenja.de/2012/07/09/warum-kleine-kinder-zu-ihren-muttern-und-nicht-eine-kita-gehoren/","Mitläufer erfinden keine Dinge, das tun Querdenker, Andersdenker …."
"46","2011-04-25","internetbasiert","BPatG: Löschung der Marke Querdenker wegen fehlender Unterscheidungskraft Beschluss vom 09.02.2011 – 29 W (pat) 208/10 - markenmagazin:recht. Markenmagazin:Recht, 2011-04-25","http://www.markenmagazin.de/bpatg-loeschung-der-marke-querdenker-wegen-fehlender-unterscheidungskraft-beschluss-vom-09-02-2011-29-w-pat-20810/","Dass das Wort “Querdenker” darauf von der Beschwerdeführerin in vermeintlich herkunftshinweisender Art und Weise angebracht gezeigt wird, steht der Annahme der Löschungsreife nicht entgegen."
"47","2011-06-14","internetbasiert","Die Matrix über der Erdenmenschheit. MindLoveProject, 2011-06-14","http://www.mindloveproject.net/2011/06/14/die-matrix-uber-der-erdenmenschheit/","Die Mächtigen können weiterhin ihre Kriegsspiele und Strategiespiele auf Kosten des Restes der Menschheit ausleben, und alle Querdenker schnell und einfach ausschalten, bevor sie ihnen gefährlich werden können."
"48","2011-04-25","internetbasiert","BPatG: Löschung der Marke Querdenker wegen fehlender Unterscheidungskraft Beschluss vom 09.02.2011 – 29 W (pat) 208/10 - markenmagazin:recht. Markenmagazin:Recht, 2011-04-25","http://www.markenmagazin.de/bpatg-loeschung-der-marke-querdenker-wegen-fehlender-unterscheidungskraft-beschluss-vom-09-02-2011-29-w-pat-20810/","Der Bedeutungsgehalt des Begriffs “Querdenker” wurde vom DPMA richtigerweise in dem Sinn festgestellt, dass damit eine Person gemeint ist, die bestimmte Fragen oder Problemstellungen mit innovativen, unorthodoxen und auch themenübergreifenden Gedanken fernab der eingefahrenen Muster zu lösen im Stande ist."
"49","2010-08-14","internetbasiert","GlobArt Academy 2010, Pernegg AT – Web 3.0 Panel. GlobArt Academy 2010, Pernegg AT - Web 3.0 Panel, 2010-08-14","http://www.mack-consulting.at/globart-academy-2010-pernegg-at-web-3-0-panel/","Im Kloster Pernegg findet die alljährliche GlobArt Academy statt, bei der Vordenker und Querdenker zu Wort kommen und interessante Beiträge leisten."
"50","2011-01-10","internetbasiert","Warum können die Minister und ihre staatlich anerkannten Experten unsere Hauptprobleme nicht wirklich lösen ?. onlinetechniker.de, 2011-01-10","http://onlinetechniker.de/?q=content%2Fwarum-k%C3%B6nnen-die-minister-und-ihre-staatlich-anerkannten-experten-unsere-hauptprobleme-nicht","Die Minister, Journalisten und staatlich anerkannten Experten, die neue Ideen und Konzepte von Visionären und Querdenkern nachplappern und so tun als wären es ihre Gedanken, werden bei der Realisierung, ja schon bei einfachen Rückfragen kläglich scheitern."
"51","2010-06-10","internetbasiert","www.eco-world.de EVENTS. eco-world.de, 2010-06-10","http://www.eco-world.de/service/events/archiv/8292/index.html","Vernetzt. nachhaltig. anders - QUERDENKER®-Kongress bei der BMW Group (Kongress)"
"52","2012-03-22","internetbasiert","Chaya Fuera: Neuer Club im 7. Wiener Gemeinde Bezirk | pressplay magazin. Pressplay Magazin, 2012-03-22","http://www.press-play.at/2012/03/22/chaya-fuera-neuer-club-im-7-wiener-gemeinde-bezirk/","Ob Networking Hot-Spot für Querdenker, akustische Spielwiese für Audiophile oder kulturelles Wohnzimmer; das Chaya Fuera ist einfach, was es sein will."
"53","2010-05-21","internetbasiert","Von Mitmachern, Mitdenkern und Querdenkern. Entscheiderblog, 2010-05-21","https://www.entscheiderblog.de/von-mitmachern-mitdenkern-und-querdenkern/","Denn der Querdenker hat zwar viel Potential, aber setzt es aus Frust nicht im Sinne des Unternehmens ein."
"54","2011-12-06","internetbasiert","Heiner Geißler: Die Loyalität eines Abgeordneten gilt zunächst einmal gegenüber den Menschen, die ihm das Mandat anvertraut haben. Werner Kalinka MdL, 2011-12-06","https://www.werner-kalinka.de/2011/12/heiner-geisler-hermann-ehlers-preisverleihun/","In ihrer Laudatio hatte Prof. Dr. Margot Käßmann Heiner Geißler als „Querdenker, als Politiker mit Mut zum Widerspruch” gewürdigt."
"55","2010-08-03","internetbasiert","Taube Helden. Not quite like Beethoven, 2010-08-03","http://notquitelikebeethoven.wordpress.com/taube-helden/","Er musss seinen Alltag neu gestalten, auch deshalb, weil er, der Querulant und Querdenker, wegen seines Handicaps aus der Kulturredaktion in den Lokalteil der Zeitung abgeschoben werden soll."
"56","2010-09-06","internetbasiert","Wolfgang Huste Blog. Der Volkstribun. Ein Beitrag von Werner Pirker, 2010-09-06","http://wolfgang-huste-ahrweiler.de/2010/09/06/der-volkstribun-wernerpirker/","Zum einen beherrscht Sarrazin die Attitüde des vom Meinungskartell unerbittlich verfolgten Querdenkers."
"57","2012-04-17","internetbasiert","Ein Buch für kreative Chaoten. Landsiedel NLP Blog, 2012-04-17","http://www.landsiedel-seminare.de/nlp-blog/ein-buch-fur-kreative-chaoten/","Für jeden, der mehr über Querdenker und innovative Menschen wissen möchte, zum Beispiel, um kreativ denkende Menschen in Unternehmen besser fördern zu können."
"58","2012-12-30","internetbasiert","Roland Düringer. Verena Randolf - Freelance Journalistin, 2012-12-30","https://souverena.wordpress.com/2012/12/30/roland-duringer/","Für viele seiner Fans kommt der Wandel vom Proleten zum naturbewussten Querdenker unerwartet."
"59","2011-04-20","internetbasiert","» BPatG, Beschluss v. 09.02.2011 – 29 W (pat) 208/10–“Löschung der Marke Querdenker wegen fehlender Unterscheidungskraft nach § 8 Abs. 2 Nr. 1 MarkenG”. BPatG, Beschluss v. 09.02.2011 – 29 W (pat) 208/10–“Löschung der Marke Querdenker wegen fehlender Un...","http://www.wmwllp.de/berlinblawg/urteile/markenrecht/bpatg-29-w-pat-208-10/","Abgesehen davon zählen die von der Beschwerdeführerin als Beispiel für eine herkunftshinweisende Verwendung des Zeichens “Querdenker” angeführten Schreibblöcke nicht zu Druckereierzeugnissen, sondern zu Papierwaren."
"60","2012-04-27","internetbasiert","Interview mit Robert Betz. Seelenweisheit, 2012-04-27","http://seelenweisheit.at/2012/04/27/interview-mit-robert-betz/","er ist Pionier, Querdenker, Visionär, Rebell."
"61","2012-05-24","internetbasiert","MBA-Studiengang: Querdenker gesucht. MEDIZIN ASPEKTE, 2012-05-24","http://medizin-aspekte.de/mba-studiengang-querdenker-gesucht_27562/","Dieses berufsbegleitende Studium eines Querdenkers hat natürlich auch Vorteile für den Arbeitgeber, denn das Erlernte kommt dem Unternehmen zugute."
"62","2011-05-03","internetbasiert","Querdenker – Kreativ, aber teamunfähig!. hafawo.at, 2011-05-03","http://www.hafawo.at/beruf-und-karriere/querdenker-kreativ-aber-teamunfaehig/","Jedoch, es zeigt, dass schon eine Idee eines Querdenkers das Wachstum des Unternehmens auf über Jahre hinaus sichern kann."
"63","2012-04-02","internetbasiert","Beeindruckende Buchpräsentation gegen Gewalt und Repression. vol.at, 2012-04-02","http://www.vol.at/beeindruckende-buchpraesentation-gegen-gewalt-und-repression/3211729","In Form von Bildern aus der Gefangenschaft, anhand von über 200 Seiten Gefängnistagebuch und in der künstlerischen Auseinandersetzung während des großen Tierschützerprozesses beleuchtet er diesen „größten Justizskandal der zweiten Republik“ aus seiner persönlichen Sicht, der Perspektive des Querdenkers, Künstlers und Familienvaters, untermauert mit Fakten aus dem über 200.000 Seiten starken Ermittlungsakt."
"64","2011-03-11","internetbasiert","Messe-Termine -. ar-medienberatung.de, 2011-03-11","http://www.ar-medienberatung.de/intro/messe-termine","Für alle Vor- und Querdenker der Food-Branche und natürlich Food-Liebhaber!"
